Watched one of their commercials and contacted them by phone. I was told that to handle my case I had to ok a money withdrawal from my checking account in the amount of $5500.00. After 30 days and no communication other than paperwork that was sent to me, I called and was told that 30 days had past and no response from me so I had to pay another $3900.00 to them to continue working on my case. At this pont I figured I had no choice and agreed. Then nothing happened for a number of months until I call and was put in touch with another associate. So far all that has happened is I have to sign an agreement with the IRS stating that I will pay $533/month. I could of accomplished this by myself.
I called American Tax Relief when I found out that in spite of trying to pay our taxes properly, we still owed $11,000. All the guy on the phone cared about was How much can you send us today? He mentioned a figure which seemed a reasonable amount but alarm bells rang when I realized that all he had to go on was an amount due and no specifics on the situation. When I started to ask questions he swore at me and told me I guess you don't need help. and then sworw agin and hung up.
I did a free consultation with American Tax Relief during which my credit card number was taken. I opted to not use their services and after calling them to inform them I did not want to proceed, I also sent them a fax terminating my case. Two days after the date of my fax my credit card was charged $2450. When I discovered the charge on my credit card I called them to remove it. They talked in circles about how I was not in their database so they had no record of the charge and couldn't issue a credit. Fortunately, my credit card company dispute manager got them on a conference call and they changed their tune and said they would issue a credit.
Took $2750 for a fee. I said I could not afford $5,500 - he said that he'd 'work with me' about any further amount - came to find out they sent a bank draft to my bank account and without my knowledge or consent, withdrew the remaining $2750. Then I got a call from his supervisor that he needed another $3500 because the amount owed the IRS was $20,000 more than I told Campbell, which was NOT TRUE! I defaulted on my alimony, mortgage and ALL bills due this month, there is just no money in the till now!
I paid American Tax Relief $10,000 in advance to settle a $122,000 payroll tax debt. ATR claimed that they could get the bill reduced by at least 60%. Once we paid we could not get a direct response or information from ATR on how our case was progressing. They gave us inaccurate and misleading information or no information at all. We had to attend a meeting with our local IRS agent without legal representation even though their literature indicated we would no longer have to deal with IRS. When we called to get answers the people at ATR hung up on us and would not return calls. We have since obtained other legal counsel to resolve our tax issue and they have indicated other numerous errors made by ATR.
I am one the unfortunate victims of American Tax Relief (ATR). This company based in Hollywood and Los Angeles, California, advertises by way of radio and television that they can help individuals with issues with the IRS and can stop liens and negotiate IRS debt down to next to nothing. I enlisted their services with a deposit of $2750 to which they debited from my credit card on January 29, 2008. Robert Campbell (the representative from ATR) said that he would have the lien removed from my payroll check immediately. A month later nothing much was done. Unfortunately, after they received my deposit I found dozens of complaints about this company defrauding customers out of thousands of dollars and their being in worse shape than when they first contacted them. I faxed a letter to ATR on March 5th expressing my dissatisfaction with their service and my concerns about the many complaints I found, and requested a refund. Typical of the behavior other past customers experienced, Mr. Campbell left me a phone message around 8:15 a.m. on March 6, 2008, calling me a liar and said that they will pursue collection of the additional $2750 I supposedly owe their company. I am sorry that I had anything to do with this company. Not only do I still have to clear up this IRS issue, I have incurred more debt by charging this $2750 on my credit card, and now my credit will probably be in jeopardy because they are coming after me for the balance. Someone needs to pursue putting this company out of business for good! How someone with such a horrible reputation and history of defrauding consumers can continue to do business is beyond me.
I thought I was dealing with an honest company to assist me with a huge tax burden. I was so desperate for help that I completely lost all of my common sense...that is: If it sounds too good to be true it probably is. These people are so sick and deserve dire consequences. I had originally tried to deal with the IRS on my own but had little success. As my tax liability (with penalties and interest) grew, I was at a loss at what to do. I went to ATR for help after hearing their commercial on TV and radio. I should have known from the start that this was nothing but a scam. Unfortunately, I was so desperate. How I have come to regret that now! I paid ATR 2 separate payments of $3250 to help me settle a tax liability of $51,000 for less than $20,000. Wow, I thought, this is the way to go. I was so wrong. They make you fill out tons of paperwork to masquerade as actually working a case file. Sadly, I came to find out yesterday that my entire bank accounts have been cleaned out by the IRS due to a levy! I am ruined financially, no thanks to American Tax Relief. These guys, especially Sean Madden, are evil. I lost $6500 to American Tax Relief. I also had $9300 seized from my bank account to pay a portion of my outstanding balance. I was left with the impression that they were still going to work on my case. After reading all of these horror stories online, I am certain my options have totally run out.
I want all consumers to beware of this unethical company with their false claims of being able to settle your tax debts for pennies on the dollar. All they want is to collect your money before they ever understand your specific tax situation. The individuals that answer their phones are hard core sales people with no tax knowledge or expertise. They take advantage of individuals who truly need help on very serious tax situations and never intend to do anything about it, except to collect outrageous fees before they ever even examine your specific case. At the end of the conversation they ask you for your bank information and want you to immediately fax over documents to them that will allow them to take money right out of your bank account for their fees. When my husband called them and asked them questions, they yelled at him and said 'when you get serious about your taxes, call us' and hung up on him. Out of curiosity and already disgusted, I called back and this same guy was making disgusting comments about women referring to them as 'chicks' and then proceeded to ask me to fax a power of attorney and my bank info. I was smart enough to know a scam when I see one, so I want to warn anyone else out there who is thinking of using them to BEWARE! I settled my own issues with the IRS directly. The IRS posts a warning on their website about agencies claiming to settle tax issues for pennies on the dollar. Before you ever give your money to a place like this, try to work directly with the IRS or call the tax advocacy. If that does not work, find a legitimate tax attorney! I am lucky that I was smart enough NOT to consider dealing with this Boiler Room, so they did not get one, single penny from me. You can even call the tax advocacy and they will help you to resolve your issue. This is what I did. THANK GOD I did not buy into this horrendous scam.
I hired American Tax Relief about 8 months ago to help me resolve some tax issues. I paid them $4900 and was told that as soon as I signed over power of attorney to them, the tax dept could not legally take any of the aggressive actions they were threatening. Three days later the tax dept. did show up and took possession of my restaurant, changing the locks and threatening to start auctioning off the business contents in 12 days if I didn't come up with almost $9000. I borrowed the money, opened my business back up and continued dialog with the people at American Tax Relief. They assured me that what the tax dept. had done was illegal and that they could still help me resolve the tax problems. I returned all the questionnaires and all other requested statements, etc. For the last 8 months I was under the impression that this company was working for me. I finally received a voicemail in November 2007 from Shawn Madden, from ATR, stating that he would really like to get moving on my case, and I needed to return his call. Upon calling Shawn Madden I learned that nothing had been done on my case. He claimed that he had never received a completed questionnaire and that I had terminated his company's POA with the tax dept. I sent him proof that the POA was still in effect but was told that I would still have to send him another $3500 to resume work on the account as he hadn't received the questionnaire. I told him that I desperately needed help as the tax dept. was once again threatening to seize my business, and that I didn't have any more money to give him. He told me to call him back when I came up with the money, until then there was nothing he could do for me. I've had to close up my business. The tax dept gave me until 1-17-08 to come up with $26,000, or they were going to once again seize and auction off my business. I just didn't have the money, and I didn't have any choices. I'm out of business, unemployed, and so far in debt that it scares me to death. The people at ATR made me a lot of promises and assurances and did nothing at all to help. They took my money and ran. I was desperate for help. I guess that makes for the perfect victim.
In 2003 I paid ATR $3500. in cash to settle my tax debt with the IRS. Every time I contacted them (they never called me), to inquire about progress they were making, they gave me an excuse as to why I could not speak with my attorney. My tax debt continued to increase and my wages were garnished. I still could not get an answer from ATR as to what was going on. I ended up calling the IRS myself and found out that no one from ATR had ever contacted them. In 2006, I wrote to the CA Attorney General, WI Dept. of Consumer Protection and I attempted to file a complaint in small claims court. Three times I paid the Los Angeles County Sheriff's Dept. to serve the papers. They were never served on time. I contacted a local process server to serve papers and he claimed that ATR was out of business and nothing further could be done. Within the past three months I have heard their advertisment on the local radio station and they have the same address. Is there anything more that I can do to recover my $3500? I would use that money to pay the IRS. I still owe them well over $12,000. My wages were garnished 25% of $9.00/hr. I was able to have that reduced to 15%. I now work part time and I am paying them $50.00 a month. I have suffered great embarrassment at my jobs as they knew how much I owed to the IRS. My credit is non-existent. I saved some money to make an Offer and Compromise. Money that I should be saving for retirement as I am 52 years old. This situation has also taken a toll on my mental health and I continue to take antidepressants to combat the resulting depression and anxiety.
In April of 2006 I called ATR. I was connected to a James Flemming who immediately stated that in order to retain their services I needed to deposit the amount of $5,500.00. The money was transfered immediately by wire transer. I was able to speak to James on two seperate occasions and we sent all necessary paperwork that he requested. When I could not reach him again, I was then directed to a women that said James was first on leave and then she later stated that he had taken a leave of absence and that she was taking over his accounts. I sent all the paperwork again to her as she could not find the paperwork I had previous sent. They were suppose to contact the IRS but also failed to do so. After not hearing from them when the IRS deadline was fast approaching I was told by ATR that there was nothing that they could do for me and could not help me further. The bottom line is that I paid them $5,500.00 and I did not receive any help from American Tax Relief. I then had to paid the IRS monies owed which amounted to a sum of over 40 thousand plus dollars.
I saw a commercial for American Tax Relief. I thought, finally an answer to my tax problem. I had gone through a divorce during the previous tax year. I am the owner of a small preschool in Tennessee. I fought for my preschool during the divorce and luckily enough I was able to retain sole ownership. Although, during the process of the divorce I began paying myself a regular salary due to the fact that I was now a single mom. I began having to make the choice between feeding my kids and pay my bills or pay the tax. I thought I could catch up on my taxes, but little did I know how quickly and enormously the penalties and interest would grow. I called the 800 number hoping to work with someone knowledgeable about taxes. I really wanted to make a repayment plan. I was told by one of the Hannahs at ATR that I qualified for the penalty abatement program. I was under the impression once I sent in all of my paperwork they would begin to represent my company and resolve my tax issues. I was sent an enormous amount of paperwork to fill out and a huge amount of copies to send to the company. I would call the company to ask questions, be put on hold, told someone would return my call shortly and never would. The paperwork was so detailed that an average person could not understand what to send back to them. I spoke with someone who told me to just send it back incomplete! Yet, on the paperwork it clearly states not to send imcomplete paperwork. After, some time had passed I spoke with Chris Hannah who proceded to talk to me like I was uneducated and told me that I had passed the time limit. I told him I had every piece of correspondence from the company and no where on the paperwork did it explain that there was any time line after only speaking to someone that I had to have the paperwork back. I understood that once they had all of my information they would move forward in representing me to the IRS. I was treated very poorly and the company attitude was not professional. They also tried to get me to pay an additional $4,000! I had to take out a loan for the first $4,000. I have no where elso to turn and now I am too afraid to hire another firm. I am further indebted to the IRS due to the amount of time that has passed. I have not seen any action on behalf of the American Tax Relief. They took my $4,000.00 and did ABSOLUTELY NOTHING for my company.
Well my story is the same as all the rest, I was taken by ATR. They promised they would take care of my tax problem. I got nothing. Tonight I got a phone call telling me the IRS was now saying I owed more money then they first reported. And now I need to pay ATR more money because there is more work to do. I already paid them $4000 and now ATR needs $4600 to settle my trouble with the IRS. Im out the $4000,and I'm still in trouble with the IRS!
I called and asked for a receipt from American Tax Relief for the 11 thousand dollars I paid them to do tax work in 2006. Frist of all they never did the work !!! and then when I asked for a receipt they said I should have kept better records and paid the IRS. He Rick George ( if that's his name ) said he would not send the receipt from my payment because he saw that I complained about him. These people should be out of business. Why does the IRS let them continue ?
I was laid off after 25 years with the same company, shortly there after I developed severe RA, I could not walk or use my hands, was on many perscription drugs. I withdrew some of my 401K but at end of year but forgot to include in my tax filing. Got a big bill from the IRS. Called ATR to get some help. They charged me $5,500 and promised that they would reduce the amount owed and get me on a payment plan. During that time my wife developed cancer, need less to say we really needed their help, we got nothing for our $5,500.00. With all the medical bills we had to sell our home and now a year later I'm working with the IRS to avoid a lien...... I'm working two jobs and my wife is working full time and we are facing liens and levies...... read more hide
I contacted ATR in response to a direct mail solicitation. Eli guaranteed me that they could resolve my tax problems. He used pressure sales tactics to get me to agree to allow him to deduct $3000 from my bank account before the conversation was over. The next day I contacted my accountant. My accountant had recently hired a former high-level IRS manager who had been personally responsible for approving/denying OICs. My accountant said his firm would handle the case for the same amount that I had paid ATR, and throw in tax prep for three years besides. I immediately called ATR to ask for a refund. They said that my 24-hour refund period had lapsed. I told them that I was going to have my accountant do the OIC anyway. They said, fine, you have a fully paid-up account with us when you decide you need our help. I got burned by my accountant, who after three years had still not filed my OIC and who billed me $14,000 for services NOT rendered. Everytime I gave him the documents he requested, no action was taken; the information would become obsolete and I would do all the research again...I had the distinct feeling I was dealing with a crew of alcoholics. But, back to ATR... After I fired my accountant I called back ATR and reminded them of my fully paid up account. In the meantime penalties had accrued and my case had ballooned to where I owed over $200K. The ATR rep said that since it was much larger case necessitating more work they had to charge another $5000. I told them that they did not have my permission to charge more funds, and since they refused to honor their word they did not have permission to work on the case---I prefer to deal with people who are honorable. Later, to be safe, I checked with my bank and ATR Had taken $1000 from my account, which the bank retrieved from them. I actually closed the account and opened a new one to protect myself from ATR. So, after spending $6000 on two different white-collar bandit firms I decided to file the OIC myself. It took me about 5 solid days of work. I researched and found software on the web that cost $100 and that helped automate the process of filling out the forms; it's the software that your accountant would use if you hired him/her to do the job. I bought some books that helped. I called the IRS numerous times and with each call I was given another hint, another tiny clue that helped me stay on course. After I filed the Offer I completed myself it was accepted; I negotiated a $33K settlement on at $216K debt. YOU CAN DO THIS YOURSELF. Also, know this: it doesn't matter how large your debt to the IRS is, the amount of work to fill out the OIC forms is exactly the same for a $10K debt as it is for a multi-million debt (although of course sorting out accounts will be more complex if you're the type of person with lots of money). I was ripped off for $3000 by ATR, and for $3000 by my accountant. read more hide
big promises, little delivery; As POA for my mother I contacted this compamy to help reduce a 32K dollar IRS debt. I paid them 4700 dollars and the only thing they did was set up a payment plan. The IRS took every penny she had out of her bank account, and is still putting a lien on her condo. this women is 80, suffers from Alzheimers, and lives in a care home. There was no reduction of fees, interest, or total amount due. Now every penny plus is taken paying the care home and IRS. There isn't even enough left over to pay the minimun balance due on the credit card that paid the tax relief company. read more hide
I payed American Tax Relief $5,300 in late July of 2005 for representation to the IRS. My tax debt at that time was $60,036. I got notices from the IRS in June of this year saying they now wanted $76,680. When I got last year's notice from the IRS, I called ATR and they had me send it to them saying don't worry and let us do our job. I did because this is what I paid for. After more than 30 phone calls in the month of June of this year (before and after recieving more notices from the IRS) and NOT ONE return, I contacted the IRS (I have names and numbers) and was told that ATR had only contacted them about my case three times (with the most recent one being in February of 2006). I sent cancellations of their Power of Attorney to represent me (to ATR and the IRS) and began talking directly to the IRS to get this over with. My tax liability has, under ATR's direct compensated involvement to avoid, has not only not been addressed but has grown approximately $17,000. Why are they not accountable and why can someone not hold them responsible for monetary damages? Besides the original $5,300 for services never rendered, my tax liability has, under ATR's direct compensated involvement to avoid, has not only gone un-addressed but has grown approximately $17,000. Two years later and a 28% increase in my tax liability because of these fools. It's safe to say that they did exactly what they set out to do and cost me money. Not only what they took in the beginning but then making it grow by ignoring the IRS while telling me and my wife don't worry about it. Let us do what you paid us to do. read more hide
I also owed money to the IRS and called ATR. They said they would save me at least half of what I owed. $15000. Took over two years and finally got a reply from the IRS telling me to pay the tax in full. As far as I am concerned they did nothing for me. read more hide
I paid $5,300 in late July of 2005 to American Tax relief for representation. My tax liability was just over $50,000 when I contacted these people. It has now been 22 months since first contact and they won't return a phone call. I've left approximately 32 messages (with Stacey Brandon and a supervisor named Hadji Chana) in the last ten working days. My latest notice from the IRS has my tax liability at approximately $77,000. I called the IRS today (Friday 15 June 2007)and their representative said that ATR's Stacey Brandon had contacted them in December of 2005, and twice in February of 2006. That's a total of three calls on my behalf in 22 months and seemingly no attempt at resolution whatsoever. The econimic damage is obvious. My tax liability has grown since they got my $5,300 and I'm now in debt over this up to about $82,000. My income is less than $40,000 per year and my wife doesn't work. At a minimum I feel like American Tax Relief owes me my original $5,300 (plus interest and penalties) plus the difference of what I owed when I contracted with these people. At the most, they can pay my back taxes plus punitive damages. They misrepresented themselves and would not talk to myself or my wife during this process except to tell us we're going to take care of this for you, just relax. This has been a tremendous stress on my wife, our marriage, and our lives. read more hide
I am a single mother that has got behind in taxes that I could not afford. I owed approx. $13,000. I contacted American Tax Releif and was told that they could lower the amout to approx. $4000. I payed them $3,900 in April 2006 to take care of this. It is now June 2007 and they did nothing. I am now out of the $3,900 and my taxes are up to almost $15,000 because of late fees and interest. I had to set up a payment plan myself and now there is a lien on my property. This has been a huge strain on me and my children. $that $3,900 could have went a long way in feeding and clothing my girls, but instead a company that I thought I could trust took it from us. Now my tax debt is worst than it was a year ago. I wanted to contact the IRS last year but was told by ATR not to do so. read more hide
I paid American Tax Relief $4000.00 in March of 2005, I was asked to pay the money within minutes of asking what they could do for me. The company did nothing and the IRS continues to hound me. I contacted ATR on 5/7/07 and was told by them that I would need to pay another $5000.00 for another POA and that they would not repay my money. I would like to speak with anyone who would be willing to pursue a class action suit against this company of thieves. I have chronic kidney disease and American Tax Credit took my money when I was going through Kidney Cancer, I was so ill and thought that they would help. read more hide
