We hired them to help with a tax issue,after a failed business due to the economy in Michigan. I saw a television advert for American Tax Relief. they charged us $4000 up front and did absolutely nothing. I sent them everything they requested but they lost it all when they moved offices, so I had to spend a fortune again copying and posting another box of documents to them. They are to stop interest and penalties asap while they worked on our negotiations with the IRS. They did NOT! No one is ever available to answer the phone, you can leave messages till your blue in the face and no one ever returns your calls. On the rare occasion you do get through, they have an excuse for everything, which always has to do with a mistake on your part, not theirs. After 4 years of this they had the nerve to ask for $4000 more to finish. I told them to &^#%*@ OFF! I now owe tons more than I did to start with as 4 more years of interest and penalties have accrued, All my accounts have been frozen and I face financial ruin! read more hide
In April faced with a large tax debt to the IRS and State and no job. I was living off of my 401k plan to make my house payments and feed myself, daughter & grand-daughter. I made the biggest mistake of my life and seen the ad on tv from one of the worst companies on the face of the earth and made a call to them asking what they can do for me, to make a long story short. Sean guaranteed me that they could eliminate all but 3 - 4 thousand dollars of my tax debt if I paid them $5,900.00 well, I did and after that it was next to impossible to get a hold of them and when I did get a hold of them they would run me in circles giving me every excuse in the world as to why things are not settled yet. Then one day out of the blue I get a letter from the IRS saying they have set up a payment plan for which I am too pay them monthly, probably for the rest of my life. I then called ATR to find out what was going on and they told me that they set up a payment plan for me. When I told him that this is not what you said you were going to do for me he said that once I have paid off a substantial amount of the debt they would pursue abatement of the penalty and interest. This company is nothing more than a bunch of illegal crooks preying on good honest people who found them selves in trouble. I will be filing a lawsuit against them in Los Angeles County Court this coming month 03/2009 as I hope to have the approx. $200.00 need to file the case so I can try and recoup my money, But, probably I am going to be spending more money on a dead horse. If there is anyone else that would like to join me in this lawsuit maybe we can make it a class action lawsuit and put these scum bags out of business permanently and possibly any other firms like this one. although I am fairly certain now that there could not be any other company as scummy as this one!! How does a company like this stay in business as long as they have? Why doesn't the State shut them down? And, Why doesn't the Federal government and/or State put this scum bags in jail where they belong. I want my money back please if there is anyone out there that can help me please call me. read more hide
They Wanted $4k to start my file. after doing some research I figured I would help some other people. Check the Better Business Bureau website for more information about this company. There rating is F Thanks to others posting the problems that they had. read more hide
they took my last $5,000.00 and did nothing for me. they are pure scum, and i get a stomach ache every time i see their commercial on t.v! i cant believe its still on, but it is! someone please contact me and lets stop them! i was so distrought after dealing with them. read more hide
May husband passed away suddenly in November 2008. I contacted American Tax Relief on 1/7/09 after finding evidence that my husband had not filed some of his tax returns. Since he was coming out of backruptcy after a previous marriage, we filed separate returns. I spoke with Chris H or ATR who promised they could resolve my husband's tax situation. I paid $8500 through a bank draft but never received any disclosure forms. I kept calling Mr. H and asking for some paperwork or documentation. On 1/28/09, I asked for a refund only to be told that they did not give refunds. He then proceeded to tell me how he was trying to be nice about it and that he needed and additional $21,000 for attorney fees since my husband owed $400,000. I told him that I did not have any more money and that I was not responsible for my husband's tax burden before we were married and that I believed the burden to be excessive. Mr. H kept saying that the paperwork was in the mail and that if I contacted the IRS the amount would be larger. To this day I still have not received any disclosure forms, contract or anything in writing stating that they do not give refunds, or exactly what their services cover. I believe ATR preyed on me because of my vulnerability after losing my husband of only 6 years. They should be sued and made to repay each client WITH interest. Losing my husband has been tough enough without having to deal with ATR representatives who are nothing more than crooks. Since I'm out of $8500, I have no funds to pay the IRS. I could have given that amount to the IRS. I have spoken with the IRS and my tax burden should be much less than the $400,000 that ATR quoted. read more hide
On November 8, 2007 I made one of the biggest mistakes of my life. I talked with Chris H from American Tax Relief (ATR). I had a significant tax issue that I couldnt solve myself. I fell for the ads that American Tax Relief has on TV and called them. Chris informed me that ATR could solve the issue for pennies on the dollar. He said all I had to do was send him $12,500 and ATR would take care of the rest. Just two months later without any correspondence in between Chris called me to inform me ATR needed another $8,500 to upgrade their service. Then just one month later Chris called again and claimed another $8,500 was needed to once again upgrade their service. Again there had been no other correspondence in between the requests. I was desperate and still believed his promises so I paid the additional amount. Fast forward to today. ATR has had exactly one meeting with the IRS on my behalf and they botched that one. In working with Melissa I supplied her every document she needed for the meeting. During the meeting ATR was advised that there were other filings that I needed to have completed so I was put into a non-compliant status. ATR didnt advise me of that either because they didnt know or they wanted to upgrade their service again. I didnt give them a chance because I fired them yesterday. Perhaps you can add my letter to the voluminous stack you already have on ATR. Maybe someday they will be held accountable for their actions. read more hide
I own and manage a small business, and interact with the public on a daily basis. I thought I'd dealt with some low life's, but these guys are without question the worst group of schiester rip-off's that I've ever had to deal with. Some months ago, I contacted ATR about pending issues with the IRS, and explained IN FULL DETAIL my situation. The 'sales' agent (Robert) told me that this would not be an issue - that they would take care of my situation and would most likely be able to handle it in entirety. He went to great lengths to promise that it would NOT be an issue, that they in fact WOULD be able to get my fines reduced/eliminated, and that if that were NOT to happen (and if they couldn't help me), they would close out and not charge me full rate ($8500).. I gave them a credit card for the first half of the charge ($4250.00), on the agreement that they would charge this, contact the IRS, and determine what they could. They were to also immediately mail me a set of papers and documents, which I would need to fill out. After 10 days and 2 phone calls I never received these papers. Now, my situation was quite urgent, as I had communicated. In fact after 3 days I called in to find out why I hadn't heard. After 14 days still no papers. I needed some action with the IRS, as I was under threat by a lawyer. 2 further calls. no paperwork. No return phone calls. AFTER FOUR WEEKS, I had my CPA represent me to the IRS and moved forward. I called ATR,got more run-around. Was told they were i motion. When I told them I was cancelling the transaction,I was told that was not possible,as I was contracted and couldn't cancel. They then began calling me repeatedly. Robert and another agent (don't remember off the top of my head) told me I had lied to them, that I hadn't disclosed my situation, made threats against me (that my supposed misrepresentation was illegal, blah blah blah), and that I wouldn't get any refund and no furter help from them. Fortunately I hadn't wired the funds (as they had originally demanded!), but had a credit card company pay them (note only the first half was paid). several days ago I checked my credit card account. Guess what - - these guys had charged me (WITHOUT AGREEMENT ON MY BEHALF) another $4250.00. FURTHERMORE, My credit card has had 2 more unauthorized charges in the past 4 weeks. (please note that this card has NOT been used for ANY OTHER online or phone purchase in 3 years, nor have I ever had unauthorized charges in this time!) My credit card company is investigating this currently. Meanwhile..... I faxed the company this morning, with a note reiterating two things from my prior phone conversation: 1. any further contact is unathorized, not allowed, they do NOT represent me at all to ANYONE, and 2. do not contact me except by fax or mail (do NOT phone me again). Guess what. these clowns called me ON MY CELL PHONE not 5 minutes after getting the fax. I do believe that is a felony. I didn't answer my cell phone, but Robert left me a nice voicemail.. Then after 3 minutes, he called me at my office. I had the forethought to record that conversation, during which he agreed that he KNEW I had legally warned him not to contact me again, and that he did so anyway. He then continued to attempt to coerce me over the charges, claiming I had received paperwork from them, that I was negligent, and supposedly I was somehow legally to blame for this, and that I still owed them even more funds! I am out of a lot of time dealing with these guys, and quite possibly I may be in deep water with the IRS, due to their negligence. There is not a chance in hell I would recommend these clowns to anyone. read more hide
They charged me $12,000.00 for $11,000.00 taxes owed. Now I cannot pay my taxes. I still had to pay an attorney in Virginia to do my taxes and he got the reduction not ATR. I cannot pay my taxes because they took all of my money. read more hide
hired american tax relief back in 2004..they promised me that my buisness taxes would be settled for pennies on the dollar..400,000.00 inbuisness taxes which these were fraudulent due to sell of buisness. they said i ieed to give them 10,000. i agreed to give them 5,000.00 down but they would not get the other 5,000.00 until we had a resolution...i received my packet in the mail and filled it out complete and mailed it back. didnt here from them so i begin calling, which was a run around everytime i called.. couldnt get them to return calls. 30 days into it i noticed they hit my credit card for 5,000.00 ... never got any resolution. lost 10,000.00 and still owe taxes. which im still fighting. when can the government step in and cut the nuts off these guys and put there ass in prison...? there just seems to be no justice in america... lost 10,000.00 i want it back
I owed $35K in back taxes. Chris from ATM sent papers only after securing $5500 from me. I have had nothing done, I had to fill out all the paperwork do the chasing around and then have received two threatening letters saying I should have sent this or that. Meanwhile I now have a deadline to get two turndowns from mortgage companies and pay my debt down to 25K Meanwhile my tax bill is now $69K. I left 10 messages for Chris who didn't call back of course. When I finally reached him-he asked me for $3900 more. FOr what? I called the IRS and told them I was trying to get a mortage to pay them. Unfortunately I don't have a mortage so IRS would grab my home in a heart beat. I would love to get a refund but after reading your other complaints about this company I sure wish I had never called. THe IRS is much nicer than American Tax Relief. I have been so stressed over this, The IRS is threatening to take my pension & SSDI and put a lien on my property. Yes they have put me through more stress than the IRS
Spoke with Associated Tax, Was assigned to Harry. Was very infomative, helpful knowledgable. Once they received payment, they never performed any service. Now, unable to reach anyone on phone/via mail/anything. Bait and switch operation. $6000, No movement on IRS Issues and Interest Still running
My husband and I hired American Tax Relief to settle our taxes owed to the IRS. They promised me the world. They said they knew what they were doing and there would be no problem in getting the IRS to accept $6000 (pennies on the dollar they advertise). With the penalties and interest, we owed $23000. I paid them and filled out all the forms and the IRS said no to the offer of compromise. American Tax Relief came up with the $6000 figure, not us. My husband gets paid hourly and he had two good years and American Tax Relief said the IRS would not consider a 40 hr week - they will only look at the two year average. This was in 2004!!! Today I owe over $40,000. American Tax Relief has done nothing to help us. In fact, they have made it worse. I have requested my money back several times. They don't return phone calls, they might respond to you in writing if you are lucky. I have gone to a local attorney and am finally getting the help we need. The local attorney didn't cost me what American Tax Relief charged me! I am going to report this company to the Better Business Bureau and any other Bureau I can find. Never - Never listen to the ads! This was a hard lesson to learn and live through.
I paid them $5500.00 to help me fix my back due taxes. I finally got a response back from the IRS and I owe them more than before. So American Tax Relief did nothing and took my money.
In huge IRS debt and saw the TV commercial. Called and when you are desperate and afraid, I guess common sense goes out the window. Retainer fee to be $12,500 (Apparently fees based on how much you owe... more IRS debt, means you are more scared, and that much more susceptible to being talked into higher fees, which seem like nothing compared to IRS debt...) Since only had room on credit card of $6k, they agreed to take that, that day and balance on end of month 9/30/08. Have never spoken to or received any advice and/or consultation from their staff attorneys and/or enrolled agents. Only communications were from their sales consultants who would call w/a friendly premise but always turned conversation to when could they expect to get the $6500 balance, 'could they get another credit card to run it through on?'. I would point out that due on 9/30, and ask about my case, but always conversation went back to the balance due. Original sales guy was David, but on Friday, 9/26/08, someone named John called. Said he was David's partner so naturally I asked about my case. It quickly became apparent that the point of his call was collection of $6500 only using very strong-arm, collection agency type tactics. Escalated to where he was simply rude and I was not going to get any where w/him in civil manner, so I hung up. No call back from him to apologize or smooth out misunderstanding. Since this occured end of business day Friday, around 5:30 pm, over the weekend I faxed them a notice of my wish to discontinue our relationship, since no real activity performed on my behalf by them I requested a refund of the $6k already paid, and most importantly I revoked any POAs and credit card authorizations previously given. Faxed it down (hard copy via USPS this morning certified), because I wanted to give them written notice....but of course first thing this morning they have already drafted an additional $6500 from my credit account (today is 9/29/08, agreement calls for it to be drafted on 9/30/98). Called them to drop charges and was told that it is non-refundable, which is ridiculous since I have received no service, was cancelling anyway, and in writing they were expressly told that they were not authorized to draft monies from any of my accounts. Needless to say, I have posted a complaint on Los Angeles County Better Business Bureau, (where by the way they have an F rating...wish I had checked prior to...water under the bridge...). I am putting out fraud alert on my credit accounts (they have too much info about me...scary). I will file a small claims for the initial $6k. I am filing a complaint w/the Los Angeles county District Attorney's office Consumer Complaint Division. Well, unless ATR agrees to refund my money, I am out $12,500. Plus the time and additional stress it is taking to get my money back.
i paid them almost 2 thousand dollars for them to get us a tax settlement with the irs & they did nothing except want more money so they could continue or case. so i called the irs myself & got more satisfaction from them, than i did atr.
I hired Amer. Tax Relief in March of 2007 to negotiate a settlement on my behalf, re: my Ga. St. Sales taxes. They promised abatement of penalties, to petition for removal of interest, promised a feasible re-payment plan, etc... I was advised once I hired them to make no tax payments and not to deal with the Revenue dept. myself, to let ATR handle everything. I paid ATR $3950, they took my money and they've done NOTHING on my behalf, in fact, they've made matters worse. As a direct result, I now owe 2x the original amount and it just continues to increase. Additionally, a lien as been levied and the state is threatening to sieze my accounts and close my business. I gave Amer. Tax Relief the last of my money and now I'm up against a wall with no hope of ever being able to pay the ridiculous amount now owed. The increased mental stress has been almost unbearable and has caused physical deterioration as well, resulting in medical bills at a time that I can't afford any medical insurance. Please help.
In March 2008, I hired American Tax Relief to help settle my tax debt. In the beginning, they came across as the answer to my prayer. I told Paul Franklin the details of my situation, what the government said I owed and what my tax returns said I owed. I also told them that I'd originally hired JK Harris to file my taxes and that they had been unable to get anything right the three times they'd prepared my taxes and that I'd eventually done them myself. Since I was let go from my job in 2004 and had not worked a day since, I was assured by Paul Franklin my Tax Consultant that they would be able to settle my taxes for $2,000 to $3,000 dollars after I paid them the $4,900 dollar fee. I told them that I didn't have any money that I lived with my boyfriend and that he paid all the bills now. Long story short, my boyfriend agreed to pay the money to hire them. I returned all their paperwork on May 15th. They had already recieved their final $2450 payment on May 9th. After that, I heard nothing from them until I contacted them on June 30th to ask what the status of the claim was. They assigned me to a Gabriella who seemed like she wanted to work with me when I was talking with her...she just needed to run some things by her supervisor. But...the next phone call I got was from my tax consultant Paul trying to scare me and strong arm me into paying another $3900 for them to complete the process. Seems rather than speak with her supervisor like she said, they were just looking for a way to bilk more money out of me with scare tactics. I told him I'd been speaking with the IRS because I had some questions regarding my daughters fiancial aid and this man had the nerve to yell at me like I somehow answered to him. Then when I told him that I didn't like his scare tactics, he told me I should be scared seeing that I owed the governement $60K according to their calculations. This company is scarier to deal with than the IRS themselves. At least with the IRS, they speak to you with respect. My boyfirend and I are now out $4900 dollars with nothing to show for it. I would like to get the $4900 dollars back as nothing was as they promised unless I can come up with another $3900 dollars which could actually be my tax settlement since there is a formula that the government works off of for an offer-in-compromise.
My wife and I owe $41,000 to the IRS. We had contacted ATR for help, since the IRS didn't want to work with us. I took out a 401K loan in the amount of $5,500.00 for ATR to take our case. Now, after two years nothing was done, just a lot of paperwork back and forth. Nothing was resolved, since my wife and I make too much income for an Offer in Compromise. Now the IRS has levied my paycheck and will leave us pennyless. My wife is on disability and I don't know how we are going to afford her medical bills now.
In early July 2008 I spoke with Robert Campbell about some tax issues I was having. I then asked for a cost estimate for his firm, American Tax Relief, to work on this problem for me. Before he would give me a cost estimate he insisted on getting my bank information. I tried twice to avoid this but finally succumbed. Once he gave me the cost estimate I said that I could not afford that figure and thought the matter was closed. In a few days a package of forms and a cover letter arrived from American Tax Relief. The cover letter very clearly said that the first step was to complete the enclosed powers of attorney for the IRS and a survey form which was also enclosed. Since I had no plans to do business with ATR I simply ignored the paperwork. I was shocked when, on August 4, 2008, ATR emptied my bank account by executing a withdrawal of $1950.
I spoke to Robert Cambell and he was agressive threatening and tryied to take money out of my checking account without my permission. THEY ARE down right extortionist. I want to let the feds know that these so called lawyers are bilking thousands of money from hard working TAX PAYIERS He didnt care if i made payroll or had any money left in my account
June 26, 2008 we signed a contract with David Bradley stating that he would be the power of attorney to get all the tax information from 2000-2008. We gave him $5,900 to do both fed. and state and he said we would only owe the IRS $1,000- $2,000. After we gave him the money we received a phone call from a man named John Buckner yelling at us saying that they need more money ($3,100) in 2 hours or they were going to drop us. At that time we knew it was a scam and they were taking us for a ride. We were stuck and they had all our money. They are the most ignorant people I have ever met. I don't know how they can sleep at night. I would never do business with them and I just want everybody to know to stay away from those people! They had taken money out of my bank account without my permission and after doing that they wanted more. After giving them all of our personal info. John Buckner said he was dropping us.
During my initial call will ATR, the representative was initially polite and seemingly helpful, however, he pushed for more and more personal information including name, address, Social Security Numbers, and then wanted 3900.00 upfront by check over the phone to take our case. I asked Shawn to let me read over the paperwork he was supposed to be faxing, research the company, and discuss the service with my husband and I would call him back. He became irate and insulting. I had to hang up on him. Apparently he knew my research would uncover numerous complaints regarding their rude, bullying tactics. I am now establishing fraud alerts with the credit bureaus for our protection against ATR becasue I gave them our SSN
This is an addition to the report posted. Now, on June 6 I received a letter from my credit card company saying they were unable to process the credit. When I initially talked to American Tax, I provided my credit card over the phone. I was to sign and return documents that were faxed to me but I changed my mind, advised them by fax within a day and did not sign any documents. They did not provide any service to me as we terminated before we even started. Sounds to me like my credit card company and American Tax are in bed together. I'm out $2450 at this point. This is after American Tax agreed to a refund over the phone with the credit card representative on a conferfence call.
my husband contacted atr in april 2008 to help him straighten out a big delinquent tax problem and paid them 3,900.00. on april 17, 2008. on 6/4/2008 a chris hannah called and stated he had let an arbitary deadline go by and demaned another 3,100. they did absoloutely nothing but use strongarm and scare tactics. questioned our character and yelled. i am interested in any way shape or form to sue these people to recover the 3,900.00 and to shed light on this company! i did not have the 3,900.00 to begin with. that put us in a financial bind and now their threats to sue us over the 3,100.00 as being a bad check has me constantly worried and feeling helpless that they just took the money and did not in any way offer us any form of service for this money. how can i recover this money?
