I let JK Harris know that they missed an important deadline that IRS documents needed to be filed on. After I let them know, I dismissed or 'fired' them, they went ahead and withdrew money from my account on a day it was not authorized, causing havoc with my checking account. This company has poor communication and very non responsive. Because they debited my account on the wrong day I had a charge for unsufficent funds. This was AFTER they knew I didn't want their services for inaction. Also I had told my rep about the date the papers needed to be filed by and the deadline was missed.
in 1999 I called jk harris &company& setup payments of $2.500 over time we paid all of $2.500 for them to get offer of compromise. all we got was the run around and I forgive you. Thank You. I wood like to have a copy of my account so I can clame it on my taxes is that to much ask.
On numerous occations I gave them money to represent me and do my offering compromise. They kept my money and would not even call me and would not return any off my calls. I do not understand how this company can be allowed to take thousands of dollars fromn people and still advertise on tv.
It's been a number of years, almost 5 to be exact, that my issues with JK Harris began but a commercial on the television prompted me to do some research. My husband and I were attracted by JK Harris ads and sought out their help and were made promises that were never delivered. Our OIC offer was for about $750 based on about $7000 of back taxes. Obviously that wasn't an amount that was acceptable to the IRS. In fact, because of the shoddy job, lack of sufficient communication the result was that this company knew everything about my life, had all my personal information and then some, a bunch of my money, and led to my wages being attached. About two years ago, it could be more, I was contacted by an attorney, Seth from Hersch and Hersch, about a class action suit. I also supplied this man some information who then promised to call me back after he returned from his honeymoon, never got that call. Made a call myself that was never returned. Sometime last summer I received a class action application, filled it out, mailed it, and placed another call to him. There was mention that payouts would begin sometime after December 2007. Here it is, July '08. I have not received a call back from Seth or any reimbursement from this class action suit. So who is making money??? I'm not nearly as bitter as I used to be but it does cross my mind every now and again. It would have taken way more money that what we have and owed to fight this on our own, but once again it seems that we've been walked on once again. I'm still paying on those back taxes, and I suppose that what is left is really all the penalty and late charges. It's not difficult to see what difficulties a family suffers. There have been times of hardship and scraping by. Poor ratings in getting credit or high interests because of it.
Ihad back taxes problems and was looking for some tax consultation. I seen j.k harris on t.v. and gave them a call. they quoted me a number which was to good to be true and it was. stupid me i went for it and paid them $ 5000 and after a year of getting shuffled around and the paper work getting lost, no return calls on statis,i had enough.Icalled the I.R.S. and got ahold of someone with people skills not theses ive talked to before and he laughed at the amount j.k.harris quoted me and said there was no way uncle sam would agree to that so he gave me a real number. basicly the only thing they can do is drop the penalties and interest, that is the amount u must pay. Bottom line j.k.harris is a big ripoff, do not trust them. loss of $5000,pain and suffering, stress and uncle sam adding more penalties to the amount owed
I contacted JK Harris in November of 2007 due to contact I'd been having with the IRS for approximately 5 months. I knew I owed a big delinquent tax bill. I was desperate for relief and decided to contact JK Harris. Their contact told me they could help me. They gave me paperwork to fill out and send to their offices in South Carolina. It took me longer than I thought it would to round up all the information they requested. My wife and I are estranged, were at the time, and she possessed all the documentation they wanted. Although I told JK Harris I would take on our tax liability on my own, they required an information submission from my wife. I couldn't get mine together till my wife gave me hers due to the fact I needed some of the information she would be supplying. They also told me they needed me to submit both packets of information at the same time. The information was submitted to JK Harris in February '08. I called in April '08 to find out what the status was of my application for a payment plan. They asked me if I'd submitted my delinquent state tax returns yet. I was appalled at this question as I was never informed that these delinquent returns needed to be posted before JK Harris could prepare my application for a payment plan. I got the state returns filed. I then called in June '08 to see what the status was. I was told my case worker would need to check on some information and that she would call me back. She never did. In the past couple of days I received a notice of intent to levy from the IRS. I also received a notice from my employer that the IRS would be garnishing my wages commencing July 18, 2008. I called JK Harris to see what the status was of my application for a payment plan, and I was put on hold while the person on the phone (not my case worker) looked up some information. I was then told my case worker would need to look up some things and that she'd call me in two days. It's two days later, and the call hasn't come. She has one hour left in South Carolina to call me, and I'm not expecting any miracles. By the way, I have never been able to speak with my case worker. It's always some underling who has no idea of what's going on. I doubt my case worker does either. I decided to take matters into my own hands. I called the IRS today, July 2, 2008. I was on hold for about 15 minutes. I was greeted by a woman who was friendlier than others I'd spoken to at the IRS in the past. Maybe it was just my lucky day. She told me I could work out a payment plan on my own. I knew this all along, but JK Harris kept telling me to stick with them because they could get me a lower payment than I could negotiate on my own. The IRS lady took my information, asked me what I could pay, and I gave her a figure that I'd hoped JK Harris would be able to secure for me with their magical negotiating powers. The IRS lady told me my plan would most likely be approved and that the levy and garnishment would be lifted within about 10 days. This process took less than 40 minutes. I have suffered the loss of over $3000 I paid to JK Harris to submit my payment plan application. I have spent many hours filling out paperwork for JK Harris. I have lost sleep and have been stressed out over the fact I owe money to the IRS and no word on if or when an installment plan would be submitted or approved. There is one thing I can give JK Harris credit for. They do tell the truth when they say IRS problems won't just go away. They should heed their own words and do some of the work they say they're going to do. I will say that I paid for some tax services, and the man who has done the work for me, Tom, has been responsive and prompt in getting things done. Perhaps I have overpaid for this service, but Mr. has been the one ray of light that has shone through. The stuff JK Harris says they can do better for you is completely doable by an individual, at least in my case. I got my problem taken care of in 40 minutes. It took me hours to fill out paperwork for JK Harris, all with more stress than was necessary and to no avail. Live and learn.
In 2006 we contacted jk harris about tax problems because I was layed off and could not afford to back taxes. We submitted the paperwork they asked for, and after a few months they told us that our case worker had changed and we must resubmit the papers. We did, and after another period of no action, we were told the same thing again, and again. We finally contacted the IRS ourselves and found out that only the IRS can help us, and they did. We have set up a monthly payment. We were recently sent a letter form jk harris, telling us how great a job they did. We paid them $3000 and they did nothing but give us a runaround. They want us to tell our friends about them, so I am. I'm telling them if they are having problems with the IRS, call the IRS, NOT jk harris. We borrowed $3000 to apy them and are still paying the loan, for nothing
I contracted with this tax resolution company back on January 23, 2008 and agreement was to put me in a Non Collectible Status with IRS for back payroll taxes - 940's & 941's that were not paid as a result of my husband's neglect as the accountant of my business. I did not know how long they had gone unpaid until I had to file for bankruptcy in middle of 2006 and again in early 2007. To make it worse, there were quarters not even filed. My husband ran off with another woman in 2005 and left me accountable for his mistakes. Since I am the owner of the business that he did not pay the taxes on, I hold the responsiblity for paying them. He was keeping money from my company to fund his affair and neglecting his financial duties as CFO of my company. Getting back to JK Harris, it is policy of the IRS to not put me in a Non-Collectible status unless the business was officially closed and paperwork filled out, which it was not and JK Harris should have done their homework and known that rule before promising a Non-Collectibe Status. They have been absolutely no help in contacting or compromising with the IRS and I have been assigned numerous case specialists since going on board with them and then they tell me they can't do anything until some missing filings are taken care of. Again I struggled to get these taken care of right away and it has been 3 weeks and they still have not followed up with the IRS to see that they have received them. They should have also known that some of these filings were not done when they requested my master file from the IRS several months ago. Everytime I called them, they would take days to get back to me and were also asking for more paperwork. Today was the final straw with them because my bank accounts have been frozen and I am literally without cash in my pocket because they have not been doing what they say they will do. I called my case specialist 5 times or more in the last week and finally today she says she will call the IRS office about the levy. Well so much for that, because I called them myself and have a meeting Wednesday morning to work this out myself. JK Harris promised me a call back today and I never received it. I have had it with that scamming outfit and want something done about it and all my money refunded which was an inital $250 deposit and $118 taken every month from my bank account starting 3/15/08 thru 6/15/08. They charged me $1,400 ($250 was up front) and the remaining $1,150 is taken out in $118 installments every month until it is paid off. So far I am out $722 which I want a total refund on. PLEASE HELP!!!!! The economic damage is the further damage to my already poor credit. Now I have had my bank accounts, including my 18 year old sons account because my name is on it and he is an innocent party to this whole mess. The mental strain alone over the last several years and months is more than I can handle.
I made the unfortunate decision in 2006 to use JK Harris to resolve my tax problems. I met with a representitive, gave a down payment of $500.00 and had JK Harris's finance department automactically withdraw the rest of the $2500 plus interest ($331.00 per month) for a year. In this year I was assigned to 4 different case workers, all just as clueless as to my case as the last. The IRS started garnishing my wages and it took JK Harris's attorneys 2 pay periods (one month) to file the Power of Attorney to stop the garnishments. So, not only was I paying JK Harris every month, but the month of May 2006, I had ZERO money for my bills, as the IRS took half of my pay, JK Harris another portion and the rest to bills. I have tried to contact by phone and postal mail in regards to the standing on my OIC - and have yet to receive any type of response. Today, June 20, 2008, I received a letter in the mail from the IRS that JK Harris has revoked their Power of Attorney and are no longer representing me, no notification from JK Harris first, just a scary letter from the IRS. What now? Do I get a refund of the money I paid them to do NOTHING for me? Can the IRS attack my bank account now? JK Harris has only taken from me - now what do I do?
I hired JK Harris & Company in August of 2005 to represet me to negotiate a smaller payment with the Federal and State for my 2004 taxes. At the time I had been downsized out of my job of 18 1/2 years and was doing temporary work for very low pay and was barely making it. The representative (fast talking and pushy) that I saw convinced me that I would be crazy to try to do this without a tax attorney, so I signed on the dotted line. They took my money and gave me nothing in return. They charged me close to $3,000.00 and did nothing for it. I was charged $15.00 a month for them to send me a payment invoice vs automatic bank payments which I thought was outrageous. I paid them off about 6 months ahead of time trying to save as much as I could with the high interest rate of 18.9% and $15.00 a month invoice charges. From the very beginning I did not like the way they were representing me but I was locked into the contract and had to deal with it. I always had to track them down to find out the status of my case. No one ever updated me as to what was going on. I had to send them paperwork all the time it was never acknowledged that they received it so I never knew it they got it or not. I was always in the dark as to what was going on with my case. The IRS was always sending me letters like I have not been responding to their letters I thought that JK Harris was doing that for me because everything that the IRS or State sent me I sent to JK Harris because my understanding was that they were representing me. In April of 2006 they did present an Offer of Compromise to the IRS. The IRS denied this Offer of Compromise becasue of some wrong information that they had. When this was presented to me I immediately told my representative that this was not correct she said that she would have to send my case to another department for reseach. To speed things up I did the reseach on my own and sent them the proper paperwork showing that what the IRS had was incorrect. I thought that this would solve the problem and that the Compromise would be accepted. I waited and waited and nothing happened. Finally around April of 2007 I wrote them a disgruntled letter telling them how unsatisifed I was with the way they were handling my case, and that I was going to report them to the BBB and any complaint sites I could find. All I really wanted was some response from them and to get closure to this matter, because by now the stress has taken toll on me my health was not good and I could not sleep at night. I waited, and waited and waited. Finally in Nov. 2007 I called to find out the status of my case and was told by a very not pleasent representative that my case had been closed. I was shocked. I asked her who closed it? She said that I did and I said when did I close it? She said that when I wrote that disgruntled letter that they automatically closed my account. I was stunned here I have paid you in full and you close my account without even letting me know. Here I am still thinking that you are working on my case and you have closed it. I was really upset. The representative finally said that if I wanted the case reopened I would have to write JK Harris a letter stating this. I immediately wrote to them stressing that I wanted my case reopened and finished. I never heard word from them. NOTHING. Everthing that the representative said to me to get me to get me to sign a contract was misleading and untrue. They never even tried to negotiate with the state taxes as I was told they would, they just let the state put a lien on my home for the debt. They never finish negotiating with the IRS. So all of this time I have acurred extra late fees, interest etc. on both the IRS and State taxes. The bottom line is JK Harris ripped me off for nearly $3,000.00 and I wound up paying the IRS and the State more money because of the lack of representation that I thought I had. The time that they messed around with my case and did nothing cost me more money. I am very upset because I do not have money like that to be giving away. The money that JK Harris ripped me off for I could have used to pay on my debts. I know that I am not the only one he has ripped off, but something should be done about his being able to do this to people who put their trust in him and his services. He is on TV lying to people on a daily basis and this is wrong Finally this year 2008 I had to borrow and beg to pay these debts off because they were just getting larger and larger.
JK Harris was the biggest rip-off I've ever experienced. I paid $1300.00 for NOTHING! Let me correct myself; Worse than NOTHING! Had I gone with JK Harris' documents, I would have paid the IRS $12,000 I sisn't owe! At the initial consultation, I asked why the price was so high, and Scott assured me it was because they were The Best in America. It took nine months of badgering to get our documents, only to realize that they were completely wrong! They said I owed the IRS $12,000! When I took the papers to a to a small local tax office for corrections, they noted numerous errors (glaring, obvious errors) the IRS owed me $600.00. I contacted JK Harris, and asked that they refund our fee, but The best in America refused to answer. Completely unprofessional. I wish I had given the money to a reputable charity. Almost paid $12,000 to IRS which we didn't owe. Lost $1,300 to JK Harris for worthless work. Had to pay $700.00 to another tax consultant to straighten it out.
In September, 2006 I went to JK Harris & Company to resolve my tax issues. I owed over $9,000.00. I started with Regional Manager in NY David W. Reynolds who told me I qualified for an Offer in Compromise. On 9/19/06 I gave him a deposit of $350.00 and gave him a post dated check for the balance of $2,500.00 which was cleared on 10/16/06. $2,850 later I never had resolution. I was bounced around from David W. Reynolds to consultant Anthony Catropa to case Specialist who was assigned to me on 10/4/06, Felicia Dailey who I never heard from then Danielle Bowman who replaced Felicia Dailey who I was also not able to get in contact with, to her supervisor Pecolia Mathis who never returned my calls, then months later Nicole Jenkins who told me she was working on my problems but then never followed up. My offer in compromise wasn't given to the IRS until March 2008! By this time the IRS kept my returns for years 2006 and 2007 in addition to my rebate check of $600.00 in 2008 so the offer in compromise was denied because I know only owe $732.39. I reached out to John K Harris via e-mail and left him several voice mail messages and have not received a response. What I did receive was a letter from Finacial services advising me that they would not be giving me a refund. I'm asking for help in getting my money back as I feel I have been scammed out of $2,850.00. The IRS kept my refunds of 2006, 2007 and my 2008 tax rebate. I had to withdrwaw money out of my 401k to pay back the $2,850 that I borrowed that resulted in penalties. This situation stressed me out so much that I started to suffer from migraines and back pains.
I started with JK Harris in November-2007, they started woking on my case, and every time I turned around I had a new Rep.who had the sliightest clue of what was going on in my case, and so far my husband wages are being garnish, and they are still taking are money until I canceled the payments. I would like to know how I can get my money back, and should I hire an attorney. I can,t sleep worrying about what can be done to a company that can get away with something like this and a lost of money in this result.
I thought I was pretty savvy when it came to companies who have questionable practices, for lack of better words. So imagine how embarrass I was to find out that after feeling uneasy about this guys office, and how overly friendly he was, my husband and I gave JK Harris the benefit of the doubt. After waiting five months and $1042 later, something doesnt pan out with this company. So I check around, and sure enough, JK Harris has complaint one after another over and over again.
My husband and I entered into an agreement with JK Harris on January 11, 2008. Please note todays date; what we understood as to what was going to happen when we met with a reprehensive of JK Harris, ( Mr. Rusty J), is our tax filings being amended to include both my husband and I, to reduce what we owed in taxes. Mr. J advised us that several years of taxes would need to be amended; he also added is their anything else; we also included my educational loan that has been due; however I never could repay it due to extreme illnesses. The IRS has garnished my social security disability check, and I stated to Mr. J I needed to have that stop or reduce to a very minimal payment, he said that was fine, we could take care of that, is their anything else? Little did we know, the more we added, the more we were being charged. Days and weeks went by, and I had to call JK Harris, to see what was going on with our taxes, I find out that this person who was apparently a tax preparer, (?) said she was waiting on transcript or something from the IRS, she said they havent come in. More weeks went by, I had to call her again, and she said they came, but she needed the actual copies of our tax returns for those years. In the meantime, I got on the phone with the gentleman who was working on my school loan. He was very professional, and easy to understand, however, what we were paying JK Harris to do, the gentlemen, find out that I had already done that, which was to reduce my payments to a minimal. He then asks me, what else I wanted him to do; we both agreed he could do very little. So why are we paying JK Harris some 1900.00 with interest? Now time continues on, and its time for us to file our 2007, and we have a refund due, however it would not be realized because we are still in the process of trying to get taxes amended. The person that is handling our taxes, keeps telling me that they still need this or that document. Finally, I called her, Emily C, and ask, if you have a power of attorney for us, why arent you getting these documents. She continues to ask me to call the IRS and get these documents, after I mention to POA she said she would called them. Also, she told me she was done with our taxes but they needed originally signatures?? We never got them; in fact, we havent received anything from JK Harris, not even phone calls. The original reprehensive of JK Harris, Rusty J, of whom I sent an email to with the similar complaints, told us in our first meeting, that we would get many phone calls from the office as our taxes or being process, however, we never did. In fact, Mr. J, talked up JK Harris, and himself, pretending to be very friendly and caring, even having he and his family to meet us to show them around Houston, the next time I seen him to discuss our taxes, he acted as though he didnt know who I was, that was of course after we had already signed the contract. Today, we owe 1688.00, which are being deducted from our bank account. We have not seen anything that JK Harris has done, with regard to our taxes or student loan, after nearly six months. So my question to you is: can I get a refund???? Do you agree we shouldnt pay for what we are not getting? I noticed that companies like JK Harris, are being exposed on the web, and many consumers are now using the comments of other consumers to decide if they are going to do business with them, I believe thats one of the quickest ways to get information on a company.ask the consumer before you sign anything, I usually do that, but I wasnt feeling well, and we just rush into this. However, I will share this complaint after your response, fair enough..
on 4/26/07 i went to see mr.perdomo regarding tax issues, after he explained to me the process i said i would think about hiring their services, of course they don't let you walk out he conviced me into hiring them that i would be worried free in no time and all tax issues would be resolved, big mistake as of taday they have collected $2,000 dollars and meanwhile my husband had his wages garnished,levy sent to bank and we are on a monthly payment of $250.00 and now they are going after me they have threaten to levy me now had no other choice but to contact irs and make arrangements for a monthly payment of $50.00 meanwhile jk harris and company has not done a thing about all this that's going on, i have sent several emails to my so called case specialist and as always i'm being told this takes a while to be resolved, yeap after irs feels they collected enough from us it will definitive get resolved, thank you
We have been with them for several months and we have had 4 different people, and the issue has not been resolved, they just keep giving us the run around, we have been levyed, and still paying money to them and we need to know what we can do about it, and can we sue.
