My husband and I entered into a contract agreement with JK Harris a year ago with the understanding the company would represent us with Federal and State Income Tax problems. Our tax files are for multiple years, and when we met the representative, we were told that we did not need to worry anymore, because with them representing us, they could get our taxes reduced. All we needed to do was to make a downpayment and additional $1,400 to cover other expenses. Hearing this was music to our ears, because we had labored over this problem for years and we would finally be relieved of the stress and anxiety, worrying about closing these accounts. There were lots of phone calls and letters written to JK Harris asking questions and providing duplicate information. We never received an answer to our questions. This did not set well with us. We are elderly people with multiple medical problems and did not need the stress this company has created. After a period of waiting for something to happen, I contacted both tax agencies and learned that JK Harris had not contacted these agencies on our behalf at any time. The tax people did acknowledge they have on file a power of attorney for JK Harris that we have officially voided on June 29, 2009. There was no recent activity on our accounts, and we have decided we would take the responsibility of completing this process on our own. We have cut ties with this company, filed complaints with the appropriate agencies, and asked for our refund plus damages. None of the services we were told we would received materialized. We were shown little respect, we could not trust them, and we never could believe that our case was important to them, because of lack of results. Each month a payment from our account of $148.00 was taken like clock work for services we never received. The company misrepresented itself, provided false advertising information, and has defrauded customers across the country. They have lawsuits everywhere. We need to file a suit; this company is scamming and ripping off people.
I had a large tax to pay in 2005. JK Harris ads say we will help you pay pennies on the dollars, so I contacted them to see if they could help. They immediately called me back and then set up a meeting. Yes, it was in the back room of an office that they were renting just for appointments and not a nice one. My counselor told me they could help me and I needed to sign up today because there was no time to waste, I did. I felt like promises were made and as I look back, they could never have been kept. I had levies put against my bank accounts and liens against my home. I recommend that you talk to the tax advocate at the IRS and research the internet for what can really be done before entering any contract with JK Harris or other first that prey on those that have financial troubles. The first thing my consultant Sowell did was ask me questions about what my expenses were and how much money did I make at my job. At the time, I did not have a job and had not had one because I was a stay at home mom and widowed. Her first recommendation was Federal Installment Agreement (W-2/Sch C). The cost of this was $3125.00. What she did not tell me is that in order to file for a Federal Installment Agreement, you have to have been employed to show some income coming in from a job. Recently, when I filed for a refund with the review and oversight, I was told they would have to investigate. Seeing a 0 on my contract for income put there by their paid consultant was not proof enough for them. They are taking it under review and 60 days from the day you talk to them, they will send you a letter and tell you what their findings were. I paid $750.00 for a State Installment Agreement (W2/SCH C). This would let them notify my state that they were working with me and set up another payment plan, but my state was never notified. Money in their pocket and a lien on my house. The thing to really watch is the Prepare Abatement of Penalty Request (Federal). The cost of this was $2200.00. What they don't tell you is the total tax, interest and penalty must be paid first before you can file for this. If you don't have the money to pay in the first place, how can they prepare an abatement? I signed an agreement that they could be my Power of Attorney. After contacting the IRS advocate office, I withdrew that POA and have been working with the IRS and it is a lot less expensive and things are getting accomplished because I am in control and more worried about my affairs than JK Harris. It was my tax advocate who told me how to make a request for my money on the back of your contract and kept her advised on what I said and how I was doing in the process. What have I learned? Be sure to date everything you do with them because your 60 days starts from that date. They like to make it from the day that you talked to them if you can get an answer. I left messages and waited days for callbacks. They have several offices and be sure to send all request to all offices because they do not update records very often and if you do not have a copy of a letter you sent to another office, the 60 days starts when it arrives in the office you are talking to. Be sure if you mail any information to them that you send it priority or overnight with delivery confirmation. I sent a letter on the 13th. USPS said it was delivered 4 days later. Weekend in there and they received it on the 22nd according to their records. When asking for your money back, it is not important to them and they did not consider it a scam that they had charged me $6,075 for services they could not and did not perform. The answer was they were very busy with other refunds (confirmation to me) to put mine ahead of anyone else, I would just have to wait my turn. Please research your options well and contact the IRS and see what you can do. During the contract period when I asked about the pennies on the dollars, their response was "not all customers are the same and you do not qualify". Why wasn't I told this in the beginning? I would have thought more and not signed. Hard lesson and still fighting to get my money back because it is important to me.
They did not complete their end of contract. I requested my money back. I even signed general release over year ago. They owe $1,400 just on contract. I paid my taxes and have wasted many hours. I have been lied to and stress was beyond belief. They should pay thousands for the stress they caused.
I paid them $1400 to help make out of a tax problem. They did not ever contact the IRS about my case and jerked me around and I ended up contacting the IRS myself and having to set up payments which I could have done in the first place and now I have been trying to get my refund from them, which they promised I would receive for 2 years. They are complete frauds and I get so mad when I see their ads on TV, I could scream. We are two old people living on social security and every dollar is precious to us.
In November 2007, my husband and I met with JK Harris regarding our 2005 taxes. The IRS was stating that we owed $9,000 but with interest/penalties, it was over $20,000. The representative assured us that due to my husband's illness and the amount of income, we were 100% certain that we would not have to pay anything to the IRS but we had to sign a contract to pay JK Harris $3,000. We were able to talk to someone when we called but never really got any solid information. My husband passed away on July 20, 2008 so the disability I was receiving for him was stopped. I finally got JK Harris paid off March 2009 and now I can't get anyone to answer my calls or return my emails. Of course, my refund for 2008 $795 was kept by the IRS and the amount I owe has gone up to $25,000 now and they are saying they are going to put a lien on everything I own. I am about ready to go to the local TV and see if they will do a segment on them especially after reading all the other complaints listed here. I will probably lose everything I own. I can't sleep because of worrying about this and received no benefit from the $3,000 I paid JK Harris and I had to do without food and some medications each month to pay for the services they supposedly were providing to me.
I contacted JK Harris to approach the IRS about 47K tax liability. I was told they would jump on the case and get the debt reduced along with interest and penalties. They sat on my case and avoided all calls and emails until they sent me my 2008 returns which weren't even completed. I called to ask why the return wasn't completed and never heard back from them. I sopped paying hem and finally heard back from them. They claim they never told me they would do something to address my tax liability. They now claim they were hired to develop a business plan for me. What? I'm not a business, I'm an individual taxpayer. I have refused all requests for more money from them until they can produce some actual work product relating to the tax liability. As the IRS agent told me, there is no magic bullet for IRS issues. And none of these companies ever produce results for their clients. Just look at all of the complaints for all of these companies.
JK Harris stole $2900 from me. They told me they could get my $32,000 tax debt (due to illness and a 38% tax rate on retirement benefits that I screwed up myself. ALWAYS use a tax pro!) reduced to $3,000. JK Harris jerked me around for a full year, by which time I either had to enter into a payment agreement with the IRS or face prison time. In the end, JK Harris did absolutely NOTHING for me, and in all actuality, made things much worse. They are criminals, pure and simple. I finally recovered around $1,400 of my money through class action suits and small claims action, but that leaves $1,500 that JK Harris STOLE from me! They can do NOTHING for you that you can't do for yourself by just talking to the IRS. There is no magic pill that JK Harris can use to make the IRS go away. They'll just make you THINK they can, and in the end they'll just steal your money and get you into worse trouble with the IRS. AVOID THEM AT ALL COSTS!!!!!!!
Lack of service, no follow-up, paid 1700.00 and received nothing in return from JK Harris only that they could arrange repayment with IRS which I could do myself. No return calls when filed complaint. Now owe more than before dealing with them. Contract I signed when dealing with them and paying them 1700.00 said they would reduce my debt by 70%, now told I make too much and have to repay all, be aware of this company and what they promise
On july 10,2008, I met with a rep from JK Harris in a "BARROWED OFFICE" (should of been a clue right there!!!!!).My wife and i fell into tax problems of over $20,000,The JK Harris rep told us that his company could get our tax dept reduced to arround $750.00 to $1,200 because of "THEIR SPECIAL KNOWLEDGE OF THE TAX GAME"!! Being in tax dept for three years and feeling like a thief for not paying our taxes,we felt such a relief that our nightmare could soon be over,IF WE ONLY KNEW IT WAS JUST GETTING STARTED!!!! We faxed document after document to them and never hearing back from them (thinking everything being done as promised),finally after several moths of not hearing from them, I called too see where we were at this time,was SHOCKED to hear from a "linda" that NO DOCUMENTS HAVE YET BEEN RECIEVED FROM US! I told linda that all the documents asked for was faxed(lucky i kept records of fax dates with comfirmation docs from fax ) she just said srry-nothing is here,I told her to stay there that im faxing over and want her to stand by fax machine,she relucantly said she would, since then NOTHING- NOTHING has been done,we are recieving threating letters from the IRS stating that OUR HOME OF 24 YEARS IS GOING TO BE TAKIN FROM US. Calling JK Harris co and all we get is THEIR IN A MEETING AND WILL CALL U BACK WHEN MEETING IS THREW, NO CALL BACK EVER, its been over a year and again NOTHING HAS BEEN DONE! If your reading this and thionking of contacting JK Harris co for help, PLEASE DONT!!!!! AGAIN PLEASE DO NOT USE THIS COMPANY!!!!!!! BUT IF YOU ARE USING THIS COMPANY AND FEEL THE SAME AS MY WIFE AND I-- WE WOULD LIKE TO FORM A LARGE NUMBER OF PEOPLE TO TAKE THIS COMPANY TO COURT AND SEW NOT ONLY FOR OUR MONEY BACK BUT ALSO LOSS OF TIME AND GRIEF!!!!
As a result of divorce, and a business my ex-wife and I had sunk our savings into, I found myself owing the IRS over $161,000. I contacted JK Harris out of a desire to remain anonymous with local attorneys and CPAs. My mistake was made out of a lack of experience, making emotional decisions and feeling criminal for not being able to pay my fair share of taxes. I should have known beter when they wanted $7,500 to resolve my issues and for representation with the IRS. I negotiated to $5,500 and feeling as though I had made progress to resolve the issues. It was only the beginning. I cannot begin to describe the encounter, except for saying what many others have, they did nothing. Absolutely nothing. No return calls, many voicemails that went unreturned and actually found the IRS far easier to deal with. I simply want to warn others to NEVER contract with this firm. They are ineffectual at best and criminal at worst. At the end of the day, you will simply waste valuable time dealing with this shell of a company, simply hire an attorney and avoid yourself a headache.
JK Harris screwed us. It's been over a year and a half. We called numerous times. Today we called them & now they tell us they did all they could. And they told us that our case has been transfered to another person. The never ever call or let us know what is happening with our case. The refused to refund us because of lack of services. First they tell us when we hired them we would only pay a fraction of the amount we owe the IRS. Then, and this is many mounts later, they are still working on the case. Also JK Harris agreed at the time we signed up, they will also represent us with our New York State Taxes. The problem with that is today they tell us they have not done anything with New York State. The IRS tells us that we pay too much rent. JK Harris never informed us about a limit to the amount of rent we need to pay. This is after signing a two year lease. All this information we got was because of phone calls we made to either IRS or JK Harris. We never know who our JK Harris representative ever is or was. Each time we call we are told that we "now have a new representative". when we started with JK Harris, our income was (our new rep is now A. johnson) very low. We lost our house in Hernendo, Fl. Since we moved our income has gotten better. But, only after we moved. Also when we signed with JK Harris I did not receive SSI until a few mounts before we moved to our rental. Since we moved to our new address and only then our income has improved. It was only after then that the IRS told us we make too much & pay too much rent. WE CALLED IRS. NOT JK HARRIS. What in the world do they do? Keep our money & sit on there rear. JK Harris sat on our case too long.(we spoke to a William no last name) Even JK Harris said they took too long. Talking too them is like talking to a brick wall. JK Harris never gives a straight answer, always give us some kind of double talk. We were paying the IRS $62. JK Harris tole us to not pay the IRS anymore because they are handling our case. JK Harris promises you when you sign up with them that "you will pay only a fraction of what you owe the IRS" EVEN in the TV ad JK Harris says that. This is not the only complaint against them. Just go on the internet. The list is endless. The only thing we did not do is check JK Harris before we signed with them. Is there something we can do? Or is it too late. The only advice we have is DO NOT UES JK HARRIS. We are so behind that we now filing bankruptcy. Is there anything we could do.
we are owed a refund of over $2600.00 and have waiting over one year. Every phone call to them is to no avail. They keep telling us it is being processed but nothing ever comes of it. They have proven to be a scam!
JK Harris promised to reduce my tax owed. They did not. They have not done anything for me and I am still paying them.
Several years ago, I went through the divorce from hell. One of the repercussions was the failure to pay taxes. It was my fault, but I was under tremendous stress and wasn't functioning normally. Nonetheless, I needed legal representation with the IRS. I hired JK Harris to represent me and after almost 2 years of trying to contact someone at the company to help, they never did anything for me. I eventually realized the company was a total scam. I am not alone; search the web for JK Harris Scam and you will learn it is not a reputable company. They claim to be the largest company defending taxpayers. However, check out their website (Backtaxes.com) and you will not find an address or central location listed. The address I used in this complaint was my so-called contact for assistance. I wound up paying the IRS a huge amount of money but it was the money that I paid JK Harris and never received one iota of assistance that burned me more than anything else. read more hide
We were completely scammed by these vultures. We would love to be able to have any guidance or help in addressing this outrageous rip-off. We contracted with these scam artists in good faith to the tune of $3200 and the only contact we had was when they sent us a payment contract and an unsigned letter terminating the contract. They did absolutely nothing! All calls were made by us to find out the progress being made. We simply wanted some help to make things right with the IRS. When we contacted the IRS, they threatened garnishment, which they did for 2001, for $7000 that not a penny of that went to 2001. We had filed all of our returns to current and $12,000 plus went for taxes 14 years ago. We were simply desperate for some help in understanding and resolving our tax issues. The only thing we gained with JK Harris was a huge fee we couldn't afford and untold frustration and heartache. My biggest wish is to be able to warn others of what a complete scam this is and to stop these people from hurting more people than they already have. If anyone, anywhere can offer some insight to this, please let us know. read more hide
They got me too. 4 years and $4000 later, and I owe IRS more than when it started. I can't count the times I had sent them my info, and now they want me to do it again so they can set me up on payment plan of $61,000.00; that was only $41,000.00 when they told me I could pay $1200.00 and be through. Oh yeah, they can’t stop a lien or levy neither. I know I have them, I know what needs to be done with these crooks but tar and feathers are hard to come by. Plus, I may be in up to my scalp in debt with Uncle Sam. I like to live. read more hide
I contracted with JK Harris in May 2008 to settle about $11k in IRS debt from tax years 2004 and 2005, penalties and interest. I paid $1,500 upfront with assurances that my federal taxes would be reduced by half. I sent the large amount of financial information to JK Harris as requested and waited. In the meantime, I continued to get letters from the IRS about my past taxes. Today, April 8, JK Harris emailed me completed tax returns with a total amount owed of $9,400 - not including any interest or payments the IRS may add! Needless to say, this is a far cry from the half off I was assured when I contracted with them last year. I emailed them to ask the sense in filing their returns, when what the IRS will likely add in penalties and interest will total more than what the IRS said I owed them in the first place, prior to involving JK Harris. I'm holding out hope that there's some good news in this, that there's simply something I'm not understanding. But in reading the reviews on this site and others, it seems I've fallen prey to JK Harris' overinflated advertising and baseless, misleading promises. Absent clarification from JK Harris and significant reduction of my tax burden, I will seek a refund. If that proves to be as difficult as other dissatisfied clients say it is, I'll be filing a lawsuit against JK Harris. read more hide
In 2005, we paid a JK Harris attorney at his rented office space $3600 to settle my back taxes. I completed the intensive paperwork and turned it in to the attorney who forwarded it for processing. When I attempted to reach JK Harris to discuss why there had not been any progress, I was told they never received the paperwork. My relationship with JK Harris immediately went to a hostile one because the representative acted like a bill collector to me. To this day, no work was done with the IRS. I requested a refund. They agreed to a partial refund, but have not paid it. When we follow up by email (there is no one to speak with by phone), they respond by saying they are not able to pay now, and they are sorry about that. I want to be part of a class action lawsuit. Who do I speak with? read more hide
These remarks are like so many others I have read on the internet at different sites. This is my scenario with JK Harris & Co. and how I resolved the issue and got a refund. On 11/07/2007 I met with a Richard **. He explained the whole process of JK Harris and what was involved. He then asked me all kinds of questions and within an hour, he told me he could reduce my taxes from around $50,000 at the time to about $3,200. I was stunned and amazed at the same time. I thought if it sounded too good to be true, it probably is! These are professionals and should know what they are talking about. I signed the necessary paperwork and said, "Let's get this thing rolling." Within a week JK Harris called and we were rolling. Through weeks of preparation because my problem was both business and personal, they got working. This cost me $5,650 for the OIC and $450 for them to do my taxes for 2007. In February 2008, they sent the final OIC offer for me to review. The figure wasn't even close. Their total was $47,373. I was furious to say the least. I immediately called them and they said they would review my numbers. They did and said this is what I owed. I argued they did nothing for me. They gained me $3,000 with the IRS and I paid them $6,000. I told them to not do my 2007 taxes and refund my money. I had to sign a waiver and they refunded me $325. I then told them I want my $5,650 refunded. They sent me another form and I went back and forth with the Review and Oversight Board for about 3 months. I finally decided to sign the waiver and take a loss here also. I was more interested in getting as much as possible refunded. By signing, I agreed to a refund of $3,743 out of $5,650. The form states 90 to 120 days before expecting the refund. The stress over back taxes alone is tremendous, let alone have a company like JK Harris prey on you for more money. I waited and called JK Harris so many times and finally decided enough was enough. In January 2009, I searched the internet and immediately found out that 13 states had filed suit against JK Harris and PA was one of them. I contacted the PA Attorney General's office immediately. They took some information, told me to go to a website and print out a form and send it to them along with all correspondence from JK Harris and myself. In March 2009 an associate from the Attorney General's office called and told me that JK Harris claimed they paid me in December 2008. I told her they didn't and she said she was going to call again and ask for a copy of the cancelled check. On March 24, 2009, a person from JK Harris called and told me to expect a check for $3,743 within a week. On March 30, 2009 I received the check. Everyone, contact your state Attorney General's office. File a complaint with them. Give them all the facts and paperwork and see what they can do. There are no guarantees it will work like my case, but what do you have to lose? It's free and it's your right. read more hide
Don't do what JK Harris claims they can do for you when you can do it for yourself. The IRS simply want the money you owe them. They will be glad to take the money that you are paying JK Harris. I had to call every week to get my money back. You got to be like an agressive credit card collector and they will get tired of you calling every week trust me it works. read more hide
We were having some trouble paying our back taxes because of the economic hard times I'm sure everyone is going through. We went to JK Harris for help. A man in a small local office promised us it could be reduced in no time and that attornys would be working on our case. He also promised us that all leans and levies would completely stop. We paid a large amount of money for him to do this for us. After 7 months with no word from anyone with JK Harris and a lien nitice from the IRS I fired them and am in the process of trying to get my money back.(wich will happen or I will file a civil lawsuit and get it.) We are now so financially behind its not funny and we cant even sell anything to get the money because there is a lean on our properties. This has taken a toll on our marriage and family. I just pray the outcome of this doesn't turn out much worse. My husband has even considered just going to jail to settle it. I begged him not to so we've been doing everything else we can. My husban and I love each other very much along with our 2 children. I don't know what to do! My husban is working daylight to dark tryin to get us out of this mess and I cant get a job because we have no one to watch our children even if I could find one.(wich the unemployment rate in our county is 15%)Please pray for us. read more hide
