I went to JK Harris after receiving several certified mailings from the IRS for back tax returns. As is the case, I was terrified. I had been laid off from my job, on unemployment, unable to pay my existing bills, etc. After several hours, mountains of paperwork, Powers-of-Attorney, I was told that it would cost me approximately $3,000 with a down payment which I made. I was promised that the letters would no longer come to my house and they would get me a "do not attempt to collect" status until I found a job. Months and months later, with no communication from anyone at JK Harris unless, I initiated the call. The only thing I received from them were monthly billings which I did not pay and have not paid. The certified letters continued and finally after over a year of constant harassment, I received the "do not attempt to collect," however, we have filed a lien letter. I no longer receive mail from IRS, but I am furious that it took so long and that no communication came from their office to me to update. When I called them, I would find that I had a new person in charge of my case and they were not familiar with what was going on. There was no team. The only good thing about all this is that I have paid them very little and do not intend to pay them anymore regardless of the contract. They did not do what they said they would do and I lived with the nightmare until they did. Sorry, JK Harris, I would never recommend you to anyone for any reason! Psychological for a year or so my life was a living hell. Financially, I do not know yet and I still can't find work and will not pay JKH when I do. read more hide
I got them to do my taxes & dropped them. I called and they sent me a letter stating I was granted a partial refund of $1,545 after I have paid them $2,100. I signed a receipt & General Release, they said it would take 90-120 days before I got anything. Now look I still don't have my money and that was February 2009. I have called numerous times and no one will return my calls. What kind of business are they running? They take people's money and run with it. I want what's mine. I am stressed out about them not giving me my money back. read more hide
I have been a client of theirs for over 4 years and I have had numerous case workers handling my case. Of all there was only one that took all of two days to solve my case. Bridgette I believe is her name. I have paid them and had a problem but still ended up paying you as agreed. Since that time I have become disabled. I don't want sympathy, I just want you to hear this. At the end when it was most crucial, no one from JK Harris handled the IRS. I was told that I was to speak to them so what did I pay you guys for? Then they told me to ignore the rejection of offer and compromise and when I hear from the IRS again to call you back. Then I was told my case is closed because they didn't accept my offer. I thought you were supposed to take it to the end. I even told the worker I would be willing to try to make reasonable payments and I was transferred to the sales department. I feel like a fool. I don't think it is just unsatisfied customers. They make promises that they don't keep, they hire inexperienced workers, and they don't advise people properly. Half of these young people I am sure never worked for the IRS. I depended on them and told people good things about their company. I asked for support and asked questions, but their people are more closed mouth than the IRS! Well, no more. Now I have a lien on my home, getting ready to levy my SSDI checked again, and other personal problems that I would love to tell you but I am sure that you don't care. I made a mistake and have been trying to fix it with your help but you really let me down! read more hide
I hired J K Harris to represent me with the IRS, paid them $3500 to help fix a problem, now they have created an even bigger problem than when we started. One of the employers Erica admitted to making a mistake on August 26, 2010 at 9:00 am. They sent paperwork for another compromise and nothing was updated, they just sent anything to shut us up. We let a lawyer look at the paperwork and he laughed and said what a joke. We are so unhappy with J K Harris, I would never recommend them to anyone and I would like at least half a refund of the $3500 I paid them. The corporate Gina ** never returned any of our 5 phone messages we left. They never return any phone calls at the office. It is sad that I have to pay to re-open my compromise because of the neglect of J K Harris. having to take time out from work to try and contact people to try and fix the mistakes made by J K Harris, and having to come up with more money to re-open my case. I was making all my payments monthly. I’m worried because nobody would return my calls to let me know anything about my case. read more hide
This nightmare with J.K. Harris was over a year and a half ago. We needed to clear up our taxes. I saw their commercial and called for an appointment. Signed all of the forms and releases it took them forever to get anything back to us. Mostly due to the fact someone had lost our file. Every time I sent paper they asked for they would send me a letter that the file could not be completed because they did not have the papers I had sent to them. This was a constant routine with them. I would send papers to them and they would send me a letter stating that they need the same papers that they had just requested only to find out that they did not get them. I would call and never get a call back. Trying to email was just as bad. At one point with State Taxes, the person I was told the cases had been handed told me that she had no idea what I was talking about and that I had to deal with State myself. I called the gentleman who was working on our taxes. After 6 weeks I finally reaching him, he said, the reason he had not done them was he did not have a S.S.I After I picked my chin up off the floor, I, gave him the S.S. I number. Several weeks later the IRS papers that he sent were still wrong. They did not have any of my husband’s W2's. I called him to let him know that they were wrong and left a message. Three weeks later I called again, He said, (not to worry about it, just file them and they would file an amendment). I told him I will not send them in that way I wanted them done correct. That took a few more months. The worst problem was the State Taxes. Eight months we have been trying to get them to CA. We lived in CA. in 2004, moved to AZ in 2005, 2006, 2007, and WA in 2008. When they filed the State, they filed them all for the State of CA. Sense then CA has garnished my husband’s wages for taxes that we don't even owe. I called the case worker she would not take my call. After a week I spoke to someone else she was somewhat rude. Then I asked if I had signed the revised form for them to do the different states. I think that she was hopeful that we had not. Come to find out we had. So now I am waiting for them to review our file to see what happened so they may be able to fix the problem of the garnishing of the check. At one point with State Taxes, the person I was told the cases had been handed to someone else told me that she had no idea what I was talking about and that I had to deal with State myself. This has been the worst experience I have ever had in my life. The customer service was horrible. There, business practices are questionable at best. We paid them over $11,000 and still have nothing settled. read more hide
After 3 years and over $15,000 paid to J.K. Harris, my wife and I are forced to deal with the IRS on our own. Three years ago, we were told by a J.K. Harris representative that they could settle our $48,000 plus tax debt with the IRS. All of a sudden, we were recently told that the debt is less than the amount of our income and that they could not help us. This is the same debt and income that we had 3 years ago. Had they told us this from the beginning, we could have paid to the IRS already the $15,000 towards our debt. J.K. Harris and companies like these are all scam artists. Our tax debt is still there and we are out of $15,000. My advice, try to deal with the IRS yourselves. We are now forced to deal with the IRS ourselves in order of reaching a payment arrangement. We have received letters on their "intent to levy". We do not own any real property. But they could levy our income if we cannot reach a reasonable payment arrangement. read more hide
I had a liability to pay a fine on Income tax. I went to see them with the first letter. They claimed that I needed a thorough tax review done. I paid $1200.00. Documentation was sent to me. I contacted them when I received the documentation which was at the same time I got the bill from the IRS. The tax review that was so necessary to get things started was never discussed with me. Rather they started their scare tactics on what the IRS was going to demand and how much it was going to cost me in addition to what I already paid. Do not use these types of tax services. They are scams. I called the IRS and worked it out with them. They were very understanding and agreed on an amount that I had offered. read more hide
My husband had 5 years of back tax debt. He saw the ad on TV for JK Harris and thought it was the way to go. He was scared and nervous, he thought they could help. $6,000.00 and 1 year later, the issue is still not resolved. Every time I call, I am told a different story and the customer service reps are very rude, no compassion or empathy for my husband and I. They are argumentative and instantly on the defense. I have said to them, you must get a lot of calls from unhappy clients because of the way you are instantly defensive, bold and loud on the phone. My husband and I were told we wouldn't have to worry, they could make a deal with the state and federal government so we wouldn't have to pay penalties or interest. It didn't happen. They didn't even tell us that they had our returns done until I called and asked what was going on. Then they said, "oh, they're finished now and we will mail them to you". They only mailed some of the returns (state). I had to call and fight with them on the phone just to get the federal returns. My husband and I have wasted $6,000 on nothing but lies and deceit. That money could have went to our back taxes. So now, we are at the point where only some of the state returns were completed and they are trying to say we were not contracted for 2003 state, only federal return. Come on, why would we do only the federal returns and not the state? I am very upset. I feel that this is a scam. We were lied to and treated very poorly. They are misrepresenting what they can do. They are nice when you first walk in and when you are paying them but after you have paid all you owed, you're lucky if you hear from them again. I definitely do not recommend using this company's services. They shouldn't be allowed to prey on innocent citizens who are just trying to set things right with uncle Sam. My husband and I are humiliated and exhausted and now, we have to pay even more to get our '03 state return done. I have lost sleep many nights over this and I am depressed even more today than I ever was. read more hide
I contacted JK Harris to help me to settle my back taxes and paid the fee that they had asked. I received very little contact from them and now I have had a lien placed by the IRS, but all the time I thought that JK Harris and Company was working to prevent that from happening, and the money I had paid to JK Harris I could have paid towards my taxes. I feel that they are out for themselves and take advantage of people’s mishaps. I never should have put my trust in them, but they make their TV commercials seem so innocent that they can help you, but they don't. How can a company continue to operate like they do? I’ve had more problems with the IRS, and lost money for the fee that JK Harris charge and the stress afterwards after you find out that they did not do what you have paid them to do. I hope there’s some way that I could be refunded the money I lost with them and that someone closes this company down before they cause more hardship to people who trust them for their services that they do not deliver. Thank you. read more hide
Tyrone ****, my JK Harris representative was a smooth talker. He assured me that they would be able to cut my IRS debt down substantially by obtaining an 'OIC' (mine is offer in compromise) from the IRS. Upon the 1st meeting, I was told I needed to make 3 payments of $250 to get the JK Harris lawyers in motion collecting my information and establishing a case for me. From what I've read, I was lucky it was not a larger amount! After calling me into the office, two more times to get additional information and signatures, I was told that the JK Harris lawyers recommended a payment plan. When I protested, they said they would continue to fight for my cause and I never heard back. It's obviously a well-oiled corruption machine out for money any way they can get it. The more gullible the client, the more they stand to make. I wish I had done more research and taken care of things myself. Visiting JK Harris for help simply added $750 to my $11,000 IRS debt. Not to mention the time it took to meet with them, gather the required paperwork and the stress of waiting and frustration. read more hide
In September of 2008, I walked into a JK Harris office scared and confused about my back tax situation. After seeing the advertisement from JK Harris about how much they could help someone like me with the tax problems I was having. I put my trust in them to help me. Being Tax specialists as they claim I went ahead and listened to all the things they said they could and would do for me. Then after signing a contract worth over 6000.00 dollars it started. The constant things that( I ) had to do, not JK HARRIS, I did a lot if not most of the information gathering and when I tried to get some help from them I was treated poorly and told that is what I had to do and they could not help me. So after a year or so I was presented with the fact that they indeed could not remove any of the interest or penalties from my state taxes which is not what I was told at the start of these proceedings. So I had to settle for a payment plan for 99 months. Then the fed tax issue became just that an issue, after going back and forth with JK Harris and changing people that were handling my case at least 3 times they got me to the OIC and of course it was rejected. When I asked them about why the penalties and interest where not removed like they said they could and would do. There was a pause in the conversation and then they had no good explanation why that did not happen. At this point, I asked the JK Harris rep, "What the next move was?" and she told me that I needed to sign another contract for them to continue with my case, When asked what have you done for me for the six thousand I already gave you? They said and I quote " we got you to the offer OIC". So in closing, I just want to say that they did nothing for me. I could not have done myself for the money I gave them. They misrepresented themselves about what they could do for me and I truly believe they should be held accountable for the people like me who are trying to do the right thing in getting these matters taken care of but are not sure or even know nothing about tax laws and programs that are available. I am not a very educated man so being able to read and truly understand the contracts that they provide is almost impossible and I believe they know that and take advantage of this. I am very upset and disappointed with JK Harris and am not sure what to do or who to turn to. So if any one knows who or how to handle this matter please feel free to contact me so we can put a stop to people like JK HARRIS taking advantage of the average person that works hard for there money and is truly trying to do the right thing by being a productive tax paying member of our society. read more hide
On May 4th 2010, in Jackson Mississippi, I signed a contract for with JK Harris to assist me with settling back taxes with the Iraq. From May 4th until June 23rd, I was contacted by Angela J. to complete a form 8821. I had no further contact with anyone from JK Harris until June 23. At which time I e-mailed Angela ***. I have all email traffic. Anglea J. responded with, "Your Professional Staff Recommendation Report was completed and sent to your Consultant on June 4th." I was told I would receive a phone call from my consultant. As I am still serving in Iraq and there is an 8-hour time difference. I waited patiently by my phone for 8 hours on the 23rd ( all night) and on the 24th and had no contact from JK Harris at all. On the 25th, I asked for my money back as I have received no communications other than my contact with Angela. I was told by Angela that someone would be in contact with me over my request . In mid July, I had not received any communications from JK Harris. I contacted my bank and filed a dispute over the charges. That money was refunded to my account. Several days after I was refunded my money, I received notice from the IRS that I was identified as a tax delinquent and had a certain number of days to render payment. As I am still in Iraq, no action can be filed against me by the IRS. JK Harris is the only one that could have made any allegations or notified the IRS of my situation as JK Harris is the only entity other than myself that is aware of my tax situation. On August 12th, I received at my home in Richland, Mississippi a packet of information from JK Harris outlining what actions I should take with the IRS. This is the first communication I have had with JK harris concerning my case since May 4TH. The same packet of information was mailed to the bank investigator, who promptly made the decision to send JK Harris back the funds I had disputed. I made every attempt to point out that I had not been provided with any services from JK Harris. I even provided an example to the investigator. I pointed out it was like paying for a hamburger. The hamburger is prepared but I never got the hamburger. Even with this, the investigator had an IQ of 2 minus plant life and could not understand the concept. JK Harris notified the IRS that I was tax delinquent. I am serving in Iraq and am exempted from paying my taxes until I return home. I have been charged $1350 by JK HARRIS and have received nothing. I entered into contract with JK Harris on May the 4th. I had no communication or contact from JK Harris until August 10th. The added stress and worry over my taxes being here in a combat environment caused me many sleepless nights. It has affected my work and my personal relationship with my wife and children and my health. These people took my money like any common thief would read more hide
I ran into tax issues for the 2009 tax year. After spending $1500.00 for J. K. services, I received no results. They did not perform any services and I was asked to pay them more to set up a repayment plan to the IRS. With the money that I gave them, I could have used it to pay off part of my debt. I wish I had looked into it more. They put on a good front but in reality they don't do anything they advertise. I did not get any reductions at all! That didn't stop them from collecting me money. I will be paying to the IRS for the next 15 years. Thanks for your service. You did nothing for me and it makes me wonder if your company didn't pay for the so called testimonials. read more hide
Well I called in about a tax problem I had, and as soon as I explained my tax hardship, I was asked for 2250 as a down payment for the service. But the total fee was around $6700 for a back tax owed of $40k, federal and state together. They told me that I can get an offer and I was feeling good about it, but I also told them that I did get a letter from the IRS that I was getting garnished and it was coming within a week or so. Now when I signed up with them, it was 02-13-2010. I was garnished on 3-01-2010. I did send them the letter right after I got it in the mail and they said they would take care of it. So I thought that everything was okay. but when I got my check and my employer told me that they had to garnish my wages because of IRS issues, I was then really **. They said they would handle it. I never got a call when I left a message. I sent an email. I did everything to get them to pick up. So nothing went well in my favor. Now I get $900 taken from my pay every month. So I just gave up, and I came across a firm that I tried one more time, I didn't want to do another program because of these people. So I gave them a chance and they actually stop the garnishment, resolved the tax issue and I got a refund of the money they took from me. So I can't say that it didn't work out for the best. So if anyone would like to get the help I got, then let me know and I can find the number for you. read more hide
After being homeless for a number of years, I did not have any money at all to purchase a stamp. I was not in a position to be able to file my taxes. Since I was recently able to move into the Y and get a viable job with income, I went to JK Harris to find out what they could do for me. I advised Matthew **, the representative, that I did not have the money he requested and could not confirm their services. Then two weeks later, I received a letter from the IRS which was later followed up with a levy against my income. It made me so mad that I ever met with him. I was not trying to avoid my taxes, but I needed time to file the six years in order to get the right amount I owed. Now I am looking for the lawyers who won the 54 million dollar lawsuit against JK Harris so they can help me. I am at risk of losing my job because of this levy which was just given to me on August 2, 2010. read more hide
I paid J. K. Harris $6,500.00 to help resolve my tax problems with the IRS. That was over a year ago. To date, they have done nothing to resolve the issue and yesterday a lien was placed on my property. I am 69 years old 7 my son a 3rd generation Marine is leaving for Afghanistan. I don't need being ripped off as I am in very bad health, my son in Afghanistan, and losing everything I want for my 2 sons. J. K. Harris just gives you the run around, constantly changing representatives, does not even advertise anymore. I'm looking for an attorney who will take on a class action suit against J. K. Harris as I know hundreds of us have been ripped off. read more hide
I owed $35,000 back to the IRS. So when I saw the commercial for JK Harris I thought I would give them a call and see if they could help me. Do not trust this company. They immediately wanted me to charge $4,500 on my credit card so they could work on my case. $4,500! After a 20 minutes conversation. That put a bad taste in my mouth. So I started doing some research on how you can reduce your tax debt. It turns out that most of what JK Harris told me they could do for me didn't even apply to my specific case. read more hide
I contacted JK Harris in 2009 to help me reduce my tax debt. I didn’t file for 2000-2004. Apparently, the IRS will file for you if you don’t. So the IRS told me I owed 20k in back taxes and had started garnishing my pay. At JK Harris, they told me, based on my hardship and financial situation, that I was qualified for an offer in compromise and would only have to pay the IRS $1,000. Lies! I paid them $2,200 up front so they could file a power of attorney and stop the garnishment and $1,200 a month for the next 3 months would be my total fees for the POA and the OIC. The garnishments stopped for 3 months. I called in to see why and they told me my OIC was rejected and there was nothing they could do for me. Then, they told me that I was not entitled to a refund because there is no guarantee for the outcome and the money I paid them was for their services, which they performed! They did nothing for me and took $5,800 from me! About 6 months ago, after searching for some sort of solution to my taxes, I came across settlewiththeirs.info. According to them, OIC is not even a legitimate way to reduce your tax debt unless the IRS determines that you have no way of repaying the debt, i.e., on your death bed with no job or assets. But they did a tax investigation for free and got back to me with the results the next day. It turns out that I was not entitled to an OIC like they stated earlier, but they said they could reduce most of the interest and penalties on my debt and stop the garnishment indefinitely. I have 12 months left of $250 a month back to the IRS, and then I will be done with this tax debt forever! And they were about 2 grand less than JK Harris. Moral of the story: if it sounds too good to be true, then it is! Stay away from JK Harris. I am filling a complaint to the attorney general, the BBB and my governor! I suggest that you all do the same! read more hide
I used JK Harris Service and was totally *** about the service that I got from them. I'm still going through the process of getting my money back from these bloodsuckers but I did find someone to help me. I went to ** and they helped me out. I got a settlement offer with the IRS and I had a debt of $32000 and saved around 25k of the total debt. So I'm happy, and also they never asked for any fees up front before they did some work for me. So go there and see what they can do for you. read more hide
