This is going to end of my use of TaxAct. It used to be a cheaper solution to TurboTax. It's not only because of the $40 fees for direct deposit. They also playing around with the pricing. They don't honor discount for continuous users and the pricing is jumping around to confuse you. Basically, other than a GUI, there is nothing special about this software compare to the old paper worksheets. If I pay TurboTax premier then it will calculate my ESPP and RSU accordingly. I paid $20 for TaxAct but I have to calculate by myself for the cost bases of my stocks. Somehow the price hop matches their prediction of 3x profit this year. Well, I would say goodbye to TaxAct.
I have used TaxAct for several years for free, since in Texas there is no state income tax. This year, I completed all the data entry only to be told it would cost me $19.99 to file with itemized deductions. My other option was to take the standard deduction at a loss. Boo, hiss!! I copied my totals from the (non-printable) forms and transferred it to the truly free ones at freefillableforms.com. I will not support a company which deals with its customers in this deceptive manner. There should have been something upfront stating what exactly you get with the free version.
I have used TaxAct (basic) for seven years. I didn't realize how much I took it for granted... until this year. Doing my taxes used to be a breeze, they aren't very complex to begin with, but it was a couple of hours at most. This year was so stressful. Every time there was an update, the shortcut/icon and program executable would get wiped out. I had to re-install the program every time there was an update. (no virus protection was running when I was down-loading the updates, and original install I had full admin perms). The navigation and prompts were not as easy to follow as the previous years, and I also got pop-ups saying I need to buy-up to the deluxe version to complete my filing. I used to point and laugh at friends using Turbo Tax and other more expensive software apps, and shook my head when reading about the bait and switch tactics other "free" tax software was using. I don't use the online version, have always bought the PC download. I would think this software company could handle incremental updates better than this. I noticed at one point they offer a new service during preparation for legal assistance in the event of an audit... maybe they should do a better job of QA. I'm very Brand-Loyal, not looking forward to spending a lot of time trying out other products, but will definitely check this page next year before buying their 2016 version.
Save your money. There is no phone service. Waited 2 days and no answer. Kept saying they were busy. VERY expensive. Put items in my account that were NEVER entered by me. If you use them, call your credit card company and refuse to pay.
I will never use TaxACT again. I did the taxes for my friend, a Native American potter with a very small little pottery business. The input on Schedule C was minimal, yet I was charged their full fee for it - as if it was a huge business with use of home, etc - for it though we were never charged in the past. FREE software indeed!
I have been a returning customer with TaxAct for over 7 years. This year, every time I log in, the website states username and password is incorrect. I call customer service and wait on hold. The website refuses to acknowledge the correct username and password each and every time I log in. Very FRUSTRATING! If this continues, I will NEVER use TaxAct again.
I have been satisfied using TaxACT for a number of years, but in 2016, the product has taken a major downturn. Only after entering your basic information in the free edition do you learn that you can not enter data for forms such as itemized deductions which in past years were available. Then, attempting to upgrade to the required "Plus" edition is a nightmare of confusion with no explanation, ultimately leading to the option of importing last year's tax income information with the warning that this will result in the loss of all entered data! Meanwhile I see they have lied to me, that as a prior customer I get a 20% discount but the "discounted" price is exactly the standard price. A VERY POOR EXPERIENCE WITH A COMPANY I USED TO RECOMMEND. I will never use this product again.
I tried to input dependent information but I cannot. Customer service is very bad. No one there to answer to your questions.
I have been using Taxact for the last 7/8 years. Had no issues. I logged in to access my 2014 returns and the return that showed up was incorrect and said it was yet to be filed. I called IRS and they confirmed I had electronically filed returns with TaxAct. I know the exact the amount of refund I got last year and which IRS confirmed. So basically TaxACT has screwed up my previous year's return. How can they mess up my old tax records. On top of that, they are asking me to refile the 2014 return that I know is already filed. There is darn not a single phone number for their third rate customer service number. I paid this company to maintain my tax records and this is what I get in return? Someone really needs to take them to task. BEWARE: Use Taxact at your own peril.
After reviewing the complaints against TaxACT this year (2016), I felt I should add my thoughts. I have used TaxACT for the past 9 or so years. Great program, easy to navigate, very satisfied for the past years. However this year, navigating through the program was more difficult. Can't seem to log in with my previous log-in and password, as I have done in the past. What change!? They need to go back to the way it was in previous years. Also note the prices have increased. Don't mind paying the higher price, if the product worked as it did in previous years. Did manage to complete my taxes, but it was not as smooth as in the past. Now searching for other sites to do my taxes next year.
I received an email for a free return just to be charged 40.00 at the end of the process. I filed with them in previous years and qualified for a free federal return. They charged me 19.99 for the federal and 19.99 for the state. They are really lying and ripping off consumers with their false advertising.
I have been using TaxAct without any issues since last 4 years, and have been recommending this to all my friends. This year, surprisingly they are charging $19.99 for Federal which used to be free until last year. They also increased State filing charges to $19.99 which used to be $15.99 until last year. Regardless, I went ahead with the tax filing as it has been piece of cake for me using TaxAct, and you know what - first they have introduced so many clicks and redundancy in the software this time, I was getting irritated clicking through. And then my efile for both Federal and State are rejected. I have tried 5-6 times fixing the errors as suggested by TaxAct mails but that has not helped. When I tried to call their customer service, those numbers don't connect at all. I wonder if it is fraud service this year???
Tried all morning to continue inputting my return data. Can't get to my information or get any help, or even get contact information for TaxACT. I have been satisfied in the past. So what is happening?
I work as a Technical manager and found this application to be difficult to use. In previous years, I used TurboTax and H&R Block and had decent experiences, so chose this due to a slightly better price. WHAT A HORRIBLE CHOICE! After spending an hour reversing an answer that was buried in a place that was hard to find (and was going to cost me ~$800 if I didn't find it), I made my final changes and was ready to file. At the filing step, the pricing didn't match the promotional pricing for being a first time user. I logged out and went back to the site where I found the original promo and selected it again. I logged in and now had 2 returns. I opened one of them and saw it was blank, so I deleted it. I then went to the other return and it was also blank! So, I now have no return and need to start from scratch! I sent them an email, but then found this site and realized it's better to cut bait and move on. I just ordered H&R Block from Amazon for $20 and recommend you don't use this horrible product. I should have gone with my gut when I started using it. I was questioning whether my taxes were more complicated than they used to be, but started realizing this software is just confusing to use. What a waste of time!
I have used TaxAct for the past four years. I have been very satisfied in the past. Like most other reviews, I was surprised at the end of the input phase that the only way that I could file was to upgrade. Last year for exactly the same forms the Federal filing was free... This year, $19.99. Last year the state filing was $14.99. This year $19.99. There seems to be more pop-ups for upgrades this year, which is a nuisance to navigate through. This year you also have to enter duplicate information when getting an auto deposit for both federal and state. State address input on most of the screens don't function well. Will be using another source next year... so much for "FREE"...
OMG - I have used TaxAct for the last six years. I am 79 and have no tax liability since 2009 when my husband died. I found it "a piece of cake" to use. However, today I pulled my 2014 tax file, assembled all the required information; set up a new password, etc. and had trouble, trouble, trouble! Could not import last year's info; was locked out several times; and experienced other problems like I just read about on this site... After 3 hours I thought I was losing my mind!!! When I couldn't see whether or not I had a tax liability for the year I was unwilling to put in my credit card information and figured I would have to return another day. I always have printed out both the federal and state returns for my file even though I did not file the returns. I figured I must be too old to do it any longer although I consider myself somewhat computer literate; used to work in a law office where I prepared Federal Estate Tax Returns; filed gift tax returns and rather complicated individual returns. Now I find after being on this site, it is not ME - it is TaxAct... Never again!!! I will no doubt pick up the necessary forms (just a 1040 and Schedule B); fill them out manually and again make copies for a file and it won't cost me anything!!! So, I will sleep tonight and just try to forget my frustration today!
Upon a recommendation from a co-worker I use this site instead of going to my tax guy. Granted the program seemed easy to use, however when it came time to getting my refund I didn't get it. The IRS confirmed that my refund was sent to my back 2/24/2016, waited more than a week and a half no refund. Called the bank, the funds were not sent, the IRS (yes the funds were sent on 2/24/2016). Called the customer service not only were they rude and argued with me that they won't help. Called their "Republic Bank" can't get a live person. Upon request from the IRS and my bank, I logged back into my account and checked to make sure they had the correct information. Checked the information, I have entered it correctly. It have been a complete nightmare. I needed that money to pay bills and repair my car. Now I am stuck and in a horrible situation because this "service" stole my tax money. Never ever use this service. Apparently they steal your money then yell at you when you dare call and ask for it. They don't even deserve a star.
Customer service has not responded to any of my inquiries regarding my inability to log-in to my account. I am trying to get copies of my filed 2015 returns. It appears after TaxAct has received their payment I have been left out to dry. All I get from TaxAct is that I need to change my password. When I change my password it creates another file for another return to be filed. I have sent TaxAct all the pertinent responses regarding the original account: email, last four digits of social and a security question but I get no assistance.
I have used TaxAct for several years without any incident. This year, I have experienced many glitches in progressing forward with the program. I was doing my son's return which only needed to be an EZ form and while entering information, a pop up appeared suggesting that I would need to upgrade based on the information that I wanted to enter. He made no contributions nor does he own property but I just wanted to complete this process so I said Yes to the upgrade. Well they upgraded me to the Plus plan instead of the Basic (which I didn't know until I was finished entering my credit card information) and I was charged $39.95 for the Federal and State return. I'm furious. Be cautious when progressing through this scam of a program. I also tried calling customer service as I was now a preferred customer and the phone was not in service!
I filed my taxes with TaxAct in previous years and was well satisfied this year. I filed my taxes in the Middle of January 2016 and they were accepted the next day. 10 days later I received my state refund and a month later after contacting the IRS about federal I was informed by the IRS that all my necessary EIC documentation was NOT submitted by TaxAct and that I would now need to wait 2-3 weeks for a letter from the IRS then paper file my EIC at my local office and then after that I would receive my refund in 2-4 weeks. I am still waiting for the letter from the IRS and when I contacted TaxAct customer service the only thing they could advise was that I contact a local tax professional in my local area. UNBELIEVABLE!!! I will never use the TaxAct service again.
Really disappointed with the product compared to how it worked and its pricing for the past several years. It used to be $12.95 for a federal return with any of the forms or schedules you needed. Now, after you spend hours inputting data, you get to the end of a section and get a message saying, "oh, that will be another $5 or $10 upgrade if you want to file that form." I won't be using this product again--I'm not sure what other hidden fees or charges are likely to pop up if I try to file within this year--I can't find any of the fees or charges listed on their site. And their pricing materials are misleading--it doesn't tell you for example that you can't even file a Schedule C UNLESS you pay the highest price ($29.95 in my case). The product is no better than it was last year--no improvements that I can see, so it's hard to stomach the increased pricing and being so misled.
I've used TaxACT in previous years because it was an economical way to file and relatively simple. This year based on its advertising it was $14.99 to file but NO! When I went to check out and file, the cost came up as $51.90! There was an additional state tax filing fee of $14.99 and a fee to directly deposit the refund into my savings account through Republic Bank if I wanted to deduct the fees from my return. What a scam. I'd rather refile with a more reputable site and spend additional time recreating my return than pay these scammers. This is bogus TaxACT!
I have been using TaxAct for the last 4 years with no problems. Last night and today I am not able to login to my account to work on my return. I get the message "Hang In There" which never goes away. I actually got someone on the phone and after 1 hour they are not able to tell me what the problem is. I told him I would have to use TurboTax and start over with my tax return and he said okay.
I did my first son's taxes and since he had stock sales the price was $14.99 for fed and $14.99 for state which was fine. I did my next son's taxes with the same info and the cost was $19.99 for fed and $19.99 for state. Why??? Who knows?
I have been using TaxAct for past nine years and never had any issue. This year I tried to contact customer service for several times but each time they kept me on hold for more than an hour - until I finally hang up. Unfortunately it seems they changed their customer policy which will definitely make me think twice before I purchase this software next year. Also, running this software (download version) is much slower than in previous years, not sure why?!
I have used TAXACT for several years and have always been pleased with the ease of use and the results. This year, I noticed a dramatic difference. Several times during the Efile process I got "thrown back" to an initial start screen (for no reason) and had difficulties getting back to where I was. At one point, I had submitted partial VISA card information (for which I wanted to charge what I owed the I.R.S.) and got tossed back to the beginning. Because of this, I had to start the Efile process all over again. Evidently, the first time around grabbed enough of my information to charge my credit card, so the second time through... obviously it did it again. I didn't know that this had happened until the next day when I logged into my credit union account and saw TWO charges waiting to go through. I emailed TAXACT, who says they will get back with me in 1-2 days, but after reading all of the reviews here, I am not holding out too much hope. I am thinking that once the charges go through, I am going to have to call VISA and "challenge" one of them to get rid of it. Needless to say, my faith in TAXACT has been shaken. And I still have my daughter's return to do. Sigh.
TaxACT has two very different products. TaxACT that you download onto your computer; a 5 star product. TaxACT ONLINE; I would give this product ZERO stars. I have used TaxACT downloaded to my computer for the past two years and thought it a great program. When I went to get it this year the website steered to the ONLINE version; so I struggled for days and many hours without success. It said I owed the IRS tens of thousands and I didn't know why. I gave up and downloaded TaxACT to my computer. It has a totally different interface and it is so clear and understandable. I reentered all of the data and was through in about two hours; and I owe a lot less, about 7cents on the dollar.
I have used TaxACT to file my and my husband taxes for the last several years and was happy. My husband passed away this last year so I followed their instructions to file a joint return with a deceased husband and my return was rejected. I was at such a loss as to why it was rejected that I called and a very nice woman walked me through the return and we resubmitted it and it was again rejected.She told me my only option was to file a paper return which obviously I have to do. I could have done this without paying them and I am extremely upset that I went through all the work on their site which was not clear if you have something unusual as the death of a spouse. I moved during the past year so I paid them for 2 state returns and the federal returns that I now have to file by paper. Very upsetting. It seems that the site works fine until you have something different like the death of a spouse and then they are of no use.
I have used TaxACT for several years, and have been very pleased with it---not at all the case this year. The program is very glitchy. It doesn't seem to recognize when I've entered things---it sends me back to previous pages. When I logged back in to pick up where I left off yesterday, it didn't work. It took me right back to the beginning. The guided process that seemed to work so well in the past, is not working well this year. I haven't contacted their customer service and probably won't, based on the other negative reviews I'm seeing. Other tax programs are rated higher than this one, and I will likely go with one of the competitors products.
Never use TaxACT. Customer service is horrible. The amount it said I was getting back never happened. I've been on hold as I'm writing this for 45 mins, all around horrible. I will never use them again. I used TurboTax last year and had no problems. Thought I would try something new and went with TaxACT and regretted it!
When trying to enter my IRS PIN, I hit 'Continue' and a blank box pops up with an X at the upper right. I looked for support to inform or get help via phone and there is no working phone number. I wasted 2 days trying to file with them then went to another site. They also seem to sneak in a $12.99 fee. Advertised as free.
The software is very accurate based on your answers to the questions they ask. However, their "side bar" is not that easy to understand. I originally ordered the basic tax package. However, when I got ready to efile the return, it wouldn't allow me to file. I was forced to upgrade to the next level. I was totally incensed that they had not been more forthcoming about the descriptions of each program offered. Program is a little unwieldy in my opinion. It's a little hard to navigate and get back to a point you want to review without going through the entire interview process again. I shortcutted that procedure by clicking on the form flag beside the amount I wanted to review. Because I am super cautious about personal info, I download the program onto my desktop. I have had no breaches in past years with transmitting my return through the program. Be careful what you sign up for. If you step through their "help" program you'll usually wind up at the more expensive package. Know your needs and choose accordingly. If you have any offsetting amounts, i.e. capital gains, gains or losses, you can't use the Basic. My package did come with 5 efiles. I had to resubmit my return because of an error, so that counted as 2 transmittals. That sucks!
They have links that pop up as you're doing your taxes to expanded explanations of the information you need, paperwork you'll need and the information you'll need to take certain deductions. They prepare state and federal returns at the same time, the fed return is free to file, so I would file fed first, pay for the state when I got my refund. Worked for me. They also keep your files on their servers so you don't have to worry about losing the info. Love that! Didn't have to finish at a single sitting. Could enter W-2s as they came in, save and finish up when I was ready. They have easy to understand explanations for each line available, worksheets to check eligibility for some deductions and credits. No problems that I'm aware of and I used them for the last 8 years before my retirement, still check by filling out a return every couple of years to double check if I have a tax liability on my retirement income.
All the basics are good, but sometimes the questions can lead you unwittingly down complex paths and forms that you don't need to fill out. This is one of the less expensive tax prep applications, but it works very well and is always improving every year. Very easy to use and it allows you to either fill in your forms directly or guided. I've never noticed anything unsecure resulting from using the site. It will log out if I'm idle too long and although that's annoying at times, it makes it very secure. The good thing is that it remembers where you left off at log-out so you don't have to retrace a bunch of steps. You can amend your return using this software now. It's fairly new and you have to still print the forms and mail as there is no eFile for amendments, but you no longer have to do them by hand.
After using Tax Act for 10 years I am through with it this year. After spending 2 hours on a complicated tax return, the pages stopped loading. I kept getting a "processing" screen that stayed blank. When I closed my browser and signed back in I got the same screen only this one said "finding a secure server." I'm not sure my return will be there if and when I finally can get back on, but if it isn't I will be starting over with Turbo Tax. Also, they trick you into thinking the fee is the same as last year (federal free, state 14.99). However it says 14.99 in large print and state-extra in fine print so the fee is actually doubled. The "phone support" is another issue. It is only during "business hours", not when most people are home working on their taxes.
I've been using TaxAct a number of years with no complaint. A couple of weeks ago, I logged in and did my taxes. Went in today to finalize them and file, and it wouldn't let me into my account. After several failed attempts, it locked me out. It didn't ask me any security questions. It didn't send me a verification code. There's no way for me to reset it. I've been on telephone hold forever, and I've been on "chat" hold forever. I feel like I'm their hostage. Never, ever, ever again, TaxAct. Thanks for nothing.
After using TaxACT for the last eight years, in 2016 it was a "D" class experience. After spending several hours navigating and finally completing TaxACT 2016 less than user-friendly program and proceeding to e-file only to learn that the system denied the advertised free Federal filing! TaxACT is only allowing income filers at or below a certain gross income, the free Federal tax filings but they didn't convey that information to its users until after they had completed the work. Everybody who isn't at or below their income threshold are immediately routed to the cost of fees for Federal e-filing long form. TaxACT 2016 insults their customers' intelligence and must think that we aren't cognitive enough to know when someone is attempting to bamboozle us; I'm done. Now I have to spend another two-three hours re-entering numbers on another (yet credible) online tax program. My consolation is that I escaped from the clutches of what appears to be becoming another greedy business using the "by hook or by crook" internet business model.
