Never an issue in terms of accuracy of results. I did have to seek assistance from their helpline on how to enter information related to an odd item for a partnership. They provided me with the proper answer. Prices are way below other software packages I have tried. Organization of flow is good as are summaries of income, deductions and taxes. Have used their packages for years. You can enter your data in a questionnaire fashion or using detailed worksheets. The flow is logical and follows the best way to enter information as it relates to each type of data. I have not had a security issue with this software but may only have been lucky. This year they have added an extra layer of security to get to the account making me feel better about it. But, is it ever strong enough in today's hacking environment. The Federal and State governments need to tighten up security also, even if it means sending refunds more slowly.
I'm a trained tax preparer, and I first used TAXACT because it was inexpensive. The first two times I used it I double-checked by doing my own on paper. There were no mistakes, and I've used it without worry ever since. It's easy to use, and it has very incisive questions so I can get the most money back or pay the least, whichever the case may be. I also like that I can view previous years entries to compare. TAXACT is a great value. Electronic federal filing is free, and the state filing is very inexpensive. I've used it for quite a while. It has value in another way -- I don't have to keep all the worksheets and papers at my home since TAXACT keeps all my information. TAXACT is very simple to use, guiding you every step of the way, and asking questions when you're done, indicating where there may be a problem and asking you if you need to change an entry. I don't really know about the security. All I know is I've never had my tax information stolen in all the time I've been using this program.
Last year we had problems. Once we finished the document, we were unable to file it, ended up having to print it off and send it in that way. We figured something was wrong with the system. Don't know if we'll use it this year or not. Have no idea, we couldn't submit it online. What more do you want us to say? We did it and couldn't submit it. Read what I wrote, ** it!! :-( Easy to use UNTIL one tries to submit it. Nothing else to say here. That part sucked big time!!! No idea!!!
I have been using TaxACT for many years but I am really disappointed with their products for 2015... I paid more than $1000.00 and at this time the Business forms for New York State are not available. I called them many times to ask when they will be ready, and nobody know!!! All other tax software companies are ready and I do not understand why it's happening.
I have used TaxAct for 2013-now. Before that I used TurboTax, which I loved but they had changed their business model by charging more and limiting the number of returns one could e-file. Since I was doing mine, my girlfriend, plus all five of my kids' returns, I needed to be able to e-file more than five. At any rate, I didn't ever really like TaxAct as well as TurboTax, but once I had swapped over I didn't want to swap back so I stuck with it. But each year I yearned for TurboTax. This year pushed me over the edge of heading back to TurboTax, for the following reasons: TaxAct is clunky and hard to use. Jumping around to go back to some other items is a nightmare. The explanations aren't that well done. Then come to find out, the forms that I need are not included. I had to pay to upgrade to PLUS right in the middle of doing the taxes. So I did but it was a huge hassle because it doesn't seamlessly let you pick up where you left off. I eventually managed to get it installed and worked my way back to what I was doing. I finally get to the end of the Federal and State return, put in all of my direct deposit info and credit card info to pay for filing the state. I finally get to hit the E-File button and guess what? Can't make a connection to TaxAct. I had to go through the "select e-file" process each time I wanted to retry. Still not able to connect to TaxAct. Now that irritates me for two reasons. One is that I wasted so much time trying repeatedly (never did succeed). The second is, why does it have to go to TaxAct in the first place? Shouldn't it be going directly to the IRS and the state? At any rate, I just spent a very frustrating day off, all day, to not get my taxes done. Thanks TaxAct. I won't be using you next year. (And to think, I could have simply taken my documents down to the local credit union and had them do it for me, for free. I used to be a VITA volunteer doing other peoples taxes for free, so I know they do a great job. I just like the control of doing it myself.)
I am disgusted that they changed their format for the 2015 tax season. I have used this company for YEARS and recommended to everyone I know. Sorry to see that they are now charging for everything except a 1040 EZ yet still advertising free returns. Disgusted. I am not usually one to write reviews but I hope this company gets shut down for their bait and switch tactics. I now have to warn everyone I previously recommended!!!
As a small tax return prep business I've been using TaxAct's professional package since 2000 and have purchased it again for 2015 taxes; this will be the last time I ever use TaxAct. I've seen their customer support go from bad to non-existence and software go from easy to use to mind boggling. The final straw was after purchasing the preparer's package plus state package. I found the current version (2015 taxes) will not allow me to e-file my clients returns since I'm running Windows XP on my principal computer. Nowhere was I made aware that current version would not run on XP and after numerous e-mails to customer support was told I'd have to either upgrade my operating system or buy a new computer. My answer to TaxAct - I may have to upgrade my computer but it sure won't be so I can run TaxAct, I'll be looking at other programs and worse case will go back to doing paper returns and no e-filing.
TaxAct was never the "best" tool to use -- it was clunky and had a horrible user interface, but it was one of the very few programs that allowed you to file many of the forms for free (in fact, for the past two years, they've released a press release touting that very fact!) When I went to file my taxes this year, as soon as I got to the Schedule "E", I was prompted that I needed to pay for the upgraded version. Why TaxAct would change the ONE thing they had going for them is beyond me. If I'm going to have to pay just because I have rental income, I'd rather pay someone else -- a site with a MUCH better UI (user interface), customer support, and brand recognition. Whoever made this marketing decision should be ashamed.
I am a tax preparer with 9 years experience. Well Jan 19, 2016 kicked off my 2015 tax service opening. Only to find out my taxACT account had been hacked and several of my clients have been rejected, stating their social security number had already been filed, forcing them to do paper returns. This is a nightmare. I in turn began to call taxACT for 4 days straight and not get an answer until yesterday. I also learned through google and Facebook that there was a security breach in which several clients information had been stolen. I am very upset. I will NEVER use this software again. They are saying it's my computer but during off season, I store my files on a flash drive securely stored.
Used this tax service last year and actually wasn't bad, filed federal free and state was 7 or 14. Forewent the state. This year I come back to file the same forms, same jobs, same kids, etc. Suddenly I can't see last year's taxes without paying! This free privilege expires, because I guess that's how you gain loyal customers right? Btw the site claims IRS charges 60$ for tax transcripts, ummm try actually FREE through their website. So why would I pay to see that! THEN you have to pay 9.99 to populate last year's valid info on the new tax return, please explain why that has to be a charge just to make you do this all over when they still have all your info from last year? If you file both state and fed that's 19.99 to get your info populated. Hmmmm, why is there an option to accept advertising from other sources to solicit you during this return? On top of that it suggests accepting this makes a difference in your price.... No it was still 19.99. Okay we got through all that BS to the part where you must pay your balance upfront with a card, for some reason paying this fee with your return money makes them have to give you a loan through republic bank which is... wait for it... 19.99! WHY? I don't get that at all, why do you need a loan? This site needs to be looked into. I'm pretty sure some of this isn't legal. So 40.00 poorer and much wiser, TaxACT won't be getting another penny from me. Just use the IRS efile, keep YOUR money.
I received a promo # to get their services for free. When I visit the site, I am unable to find out where to enter the code. I have looked everywhere and the only thing they ask for is my bank account info. I don't think so. I'm going to look for another company. I have used TaxACT in the past with no problems. They need to get it together.
I have never taken the time to write a review about a company nor a product. But, after my experience I just had with TaxAct this evening, I am so livid that I can't help but write this review. First- I'm trying to obtain a copy of my 2013 tax returns. I have used TaxAct one time and that was the year that I used them. It has been utter HELL trying to obtain this copy. I was on the hold for 27 mins the first time I called before speaking to a woman who did nothing but talk to me in a rude demeanor and cut me off with each of my sentences. (We ended up hanging up on one another.) Second time I called, the representative was a little bit more helpful but it seemed I had some other hoops to go through that the last representative never even informed me of. The third time I called, just truly did me in!!! I spoke with a representative who was first off NEW, (yes he told me this) after I had been on the phone for 53 minutes waiting for SOMEONE to answer. He was also extremely rude and not the least bit of help. He kept putting me on hold and began raising his voice at me once I told him I wanted a refund that I was "required" to pay for my 2013 copy. I bluntly told him I would never be using TaxAct again in which I got a "chuckle" in return. DO NOT USE TAXACT!!! WORST CUSTOMER SERVICE EVER!!!
I have used TaxAct the last few years because of bad service from TurboTax. I started filing my taxes at 10 am this morning. Was just about finished when it timed out as I was entering information. I tried to get back in and it would not let me back in because of password issues. I tried two times to create a new account and each time the code that was provided was not accepted. I tried emailing and calling for over two hours and could not reach their customer support. Finally got back in to the program by accident and was entering bank information when the same thing happened. When I tried to get back in it would not let me sign on and let me know that since I had logged in so many times they disabled my account. I wasted five hours of my life trying to enter my taxes and now I have to go to someone else and do it all over again. Their customer support is terrible. It took forever to get any help and I still was not able to file. I cannot understand how a company like this can stay in business. Do yourself a favor and do not use TaxAct.
I have used TaxAct online for many years now with no problem until this year when I tried to file my 2015 taxes. WHAT A NIGHTMARE! It used to be so simple and easy to use, I was astonished to find that now it was full of repetitive pop-ups and new restrictions in order to force you to "upgrade" to one of their multiple new paid "premium" levels. This year things that used to be free, like direct deposit, importing previous years information, and even definitions/advice on life events, are now only available after you pay to upgrade. Just this morning a coworker was trying to convince me to use TurboTax instead, and I said no because I've always had an easy time with TaxAct. Well, today TaxAct has convinced me to use TurboTax. Free e-filing - LIARS!!!
I have used TaxAct for several years and this year has been a catastrophe to sign in and process my 2015 taxes. I am so fed up with their sign up system that I will do my 2015 the old fashion - long hand. Their support system is a disaster - no telephone number to call. This electronic filing system is a joke!!
I tried TaxACT for the first time this year, because it was less expensive than the product I have used for the last 10 years. The process was not as user friendly, but still worked. Today I receive an email that my return has been rejected because a return was already filed this year. It appears that I am victim of the tax return fraud I have heard about on the news. I never had this with the other product. Reaching a person from TaxACT for support is non-existent. They do not answer their phones and make the phone prompts as difficult as possible to allow you to reach a person. I will never use this product again as I cannot support companies who to do support their customers. I also wonder if they have a lesser level of security that allowed this fraud to happen. I am on hold with the IRS, with a message that my hold time will be 30-60 mins, and that this will delay my refund for up to 180 days!
The only reason I gave it one star is because 0 is not allowed. My daughter -- full time student with a part time job had to pay $50 in hidden fees. Total Ripoff STAY AWAY!! Taking advantage of a poor full time student.
I've been using TaxACT over 7 years with no problems. This year I filed my taxes electronically as usual and got a surprise. I had to upgrade and pay $14.99. I've been filing my taxes the same for 7 years with taxact and has never had to pay. It's suppose to be free. That's not where it stops. My final cost to use taxact was $39.00. I had to pay additional money to a bank called Republic Bank. So my free E-file with taxact costs $39.00. I can only imagine how much it would cost if it wasn't free. I will not be using Taxact in the future and I'd advise everyone else to do the same. Unless you like being lied to. I thought the word free meant no charge. Well TurboTax, you will have a new client next year.
I have filled out my taxes and followed everything they said to do. I get my federal done. Go to finish state. A alert comes up saying box 1 don't have my wages. I go back and check. It's there. But yet they keep popping up that same alert. And that's not all of it. Every time I sign on they say they don't recognize my site. Then they send me a code. I put it in and then they don't recognize that. I'm fed up. I have used them for 4 yrs. And never had this kind of trouble. I will find another provider. My advise is don't use Taxact!
I've been trying to figure this out for days - since the 19th. All it is is a simple pin issue apparently, but nowhere is there a way to simply change it. I've already paid with my cc too and gotten an email saying my return was accepted, but it wasn't. I log back in & it still asks me if I want to continue where I left off. And when I try to go forward or back anywhere it just keeps going to the same error message. Even says I may need to file via paper (which I'll be po'd about if that's the case!). I'm so upset/frustrated that even though I've been using TaxAct for several years now (I always selected a different pin before but didn't think it really mattered), I am never using them again & going back to TurboTax from now on. You're SOL when it comes to support & answers to technical issues. Only reason for the 2 stars is if you happen to do everything perfectly then it works well (there is no warning or message to select a new pin that you haven't used before). I used to always give them an A+ saying I'd highly recommend them. Not anymore. Highly disappointed. I will be back with an update when I finally figure out how to get this resolved; when I called them the next day I was told they pretty much didn't know what I was talking about & to just log in and try again. Right. Oh AND it may be a coincidence, but now my computer that I've had for several years won't turn on now (happened when I turned it on for the first time after using the site & it's NEVER happened before) which is where I saved the copies of my return. I'm having to use my tablet now! So hence is why I can't verify that I bought the ** product.
I have used TaxAct Preparer Edition Software, for more than 10 years. For the 2015 filing season, TaxAct made significant changes, and have made the software a nightmare, for the user. TaxAct support has thus far, refused to fix the problems, and will not refund the cost of the software. Do not purchase TaxAct.
I have used TaxAct for a couple of years with no real complaint. This year, the only thing that changed on my return was an increase in income, but from identical sources as last year. After putting in almost all of my information, it tells me I have to upgrade because now I need a form 1040. I do not need a 1040, as I filed the same info last year with them (different amounts) with a 1040A. Only my income changed, so that tells me that when you hit an unmentioned income limit, they arbitrarily require the 1040, which costs. It wouldn't bother me if they had stated that before filing, but after spending a couple hours trying to fix everything & then finally input a brand new return, I realize it wasn't data entry. I'll gladly pay more to be cheated by an upfront company.
I e-filed my 2015 Federal and California tax returns with TaxACT. Both the Federal and California returns were accepted within 24 hours. I also paid the tax by credit card through TaxACT. TaxACT uses a third party to pay taxes and this third party charges a fee. This was fine with me. What wasn't fine was that TaxACT's third party never processed my credit card payment, and the temporary credit card authorization dropped off of my credit card account several days later. Also, when I went to check on the status of my returns, if I checked through one site, they were listed as accepted, but when I checked "My Account" within the TaxACT site, I could find no record of the returns ever having been filed. After speaking with several TaxACT representatives, nothing was settled except that the tech support guy told me that both returns had been accepted. Nobody I talked to at TaxACT could tell me why their third party entity, that is supposed to process the payments, hadn't done so. Also, nobody I talked to at TaxACT even knew the name of this third party company. In fact, all of the persons with whom I spoke at TaxACT sounded completely confused and incompetent. I finally repaid my taxes through the IRS website, and am now waiting for that payment to be processed. I would advise anyone who is contemplating using TaxACT to reconsider, and use another tax preparation site. I paid for the Premium version of TaxACT so that I would have tech support included in the fee. The people who work at TaxACT, from my experience, are completely incompetent and also really don't care about the customers. Updated on 1/27/2016: The TaxAct mess continues to grow. I filed my taxes by way of TaxAct on January 13th, 2016. The IRS decided to start accepting returns a few days early (January 19th had been the original date for accepting returns to begin.), and my Federal and State returns were accepted a few hours later. I made my tax payment through TaxAct using their payment processor, Value Payment Systems. The pending payment showed up on my credit card account for several days, but then disappeared without ever being processed. I waited a few days longer, and when the credit card payment through VPS still hadn't processed, I then called the IRS, and had them show me how to make a credit card payment through their website using Pay1040, which I did since I assumed that VPS's payment had been dropped. The payment through the IRS was processed in 24 hours. I thought everything was done with my tax payment. Then on the morning of January 26th, two weeks after making the initial payment of taxes through VPS, I got an e-mail from VPS saying that the IRS had accepted the payment through VPS. On the evening of January 26th, that payment processed on my credit card. I have had to call the credit card company and instigate a dispute on the payment to VPS. What a headache. My credit card company, by the way, thought that taking two weeks to process a credit card payment sounded pretty irregular. I also called the IRS again, and explained the situation, that I had paid my taxes twice. The IRS representative assured me that either the credit card dispute through the credit card company would go through, or else the IRS would refund the duplicate payment within 4 to 6 weeks. The only good thing about all this is that I won't be responsible for paying the amount of the duplicate tax payment on my credit card during the dispute... Nor will there be any interest charges on that amount. I did call TaxAct again to complain about all of this, and as before, the representative I spoke to was completely clueless about all of this. I asked how to file a complaint, and he suggested talking to the TaxAct administration people... But of course he had no contact information for them. The TaxAct customer service reps are completely incompetent. Before this year, TaxAct also used Pay1040 as their credit card payment processor, but this year went over to VPS. My guess is that VPS is cheaper for them. I will, of course, be filing my taxes with some other company than TaxAct next year.
Was doing my taxes. A box pops up and kicks me out of site. Can't log back in. Call support, they say clear this and do that! It don't work after 20 mins. on my cell. They hang up and I am still locked out WTF!!! Somebody HELP ME. DON'T USE THIS SERVICE.
I attempt to file my 2015 FREE 1040A online tax return, entered all the information and when I selected the option to file online, and direct deposit, it indicated the fee was $14.99 and asking for credit card information. All I have is 2 W2's, nothing extra. I reviewed the return to make sure everything was entered correctly. Only forms of income is from my W2's. I HATE SCAMS. I WILL NEVER TRY TAXACT AGAIN!!! Now I'm having to reenter all this over into TurboTax, which I should have used instead of TAXACT with all their extended offers!
TaxACT advertises FREE filing for Fed and State if using 1040EZ or 1040A. I go through the process of all the questions, etc. then TaxAct states that I do not qualify for free filing. I do qualify for 1040A -- not itemizing, etc. After searching their site I can find no way to ask question as to why I do not qualify. They apparently do not want any customer contact. I have used TaxACT before, but will never use them again as I feel they are not upfront and honest with their advertising.
I tried to order CD software. I could only get to the checkout then it sent me to sign in then I was in a loop and could never get to the checkout page again to get it ordered. Customer service could not help me. This has happened for two yrs. No more for me.
Can anyone tell me how in the world a company can shut down their website just because it's not "tax season". People need access to their files all the time -- not just during tax season. Ridiculous!!!
For 5+ years I have been able to file for free since NV does not have state tax. Just started entering my info for 2015. IF YOU ITEMIZE, IT NOW COSTS $14.99. Popup window informs you that "Itemized deductions are not included in TaxAct Free, so you'll need to upgrade to TaxAct Plus to claim itemized deductions to file itemized deductions. Upgrade to TaxAct Plus for only $14.99 more. Pay when you file. State additional." Sorry guys, you just lost a customer.
I have used TaxAct for a couple of years, but this year I filed my taxes late. TaxAct charged me twice. I call and they said it was for state and federal, but it wasn't - I had already filed my state. After talking with 2 people they refunded me for the extra charge, so I mentioned to one of the reps that I mailed my 1,040 because it said it was rejected! The rep told me that wasn't true, because if I was charged it was E-Filed. Today I talked with the IRS and was told that after a certain date you can't E-File. I called TaxAct back, and I was told that it was a fee to E-File. If it was rejected I shouldn't have been charged. I will never use them again!!!
I've used TaxACT since 2001 but this year I'm going elsewhere. They have changed the product names so you can't compare to the one you used last year and try to scare you into upgrading to a more expensive package than you need. Did they sit around all year trying to figure out how they could pinch more money out everyone using confusion and smoke and mirrors? No thanks, not my kind of company anymore and I'm sorry I hadn't bolted already. The only reason I'm here leaving a review is there is no place on the website to contact them with questions or for clarification. POOR customer service.
TaxAct is very poorly managed, no support and after many technical issues, I got to what I thought was the end. I paid the requested amount, charged to my card, but did not allow me to view or retrieve my completed tax form.
