I completed and printed my tax return for 2014 about a month ago. Today I got an email from TaxACT saying the return is unfinished because it was never submitted. Nasty surprise. Here I was, wondering what was taking so long for my tax refund to come in! So I clicked on the link to pull up the return and submit it, and guess what? I can't log in! I remember feeling unsure when I finished the online filing with TaxACT because I never saw a clearly visible button saying "submit". Instead, at the end of the process I was bombarded with promotional/irrelevant reading material and I assumed that printing the return was a way of submitting the return. The "submit" button, TaxACT says, is somewhere in there. You just have to hunt for it. I will not use or recommend this company again.
I have been waiting for my tax refund to go to my bank since 2/6/15. It is still not there. It has said processing for a long time. I'm just about ready to give up. I will never use TaxAct again. I have never had any problems doing my taxes till now. Very disappointed in this service. NEVER AGAIN!
I had to go back to correct something. After that I had to start over. 3 hours of this. I authorized to pay out of my refund but they still asked for my credit card. I couldn't cancel the form. Now they have my SS number and banking information. This has to be the worst company for filing. Bastards better not charge me as I never got to the submit button.
Have been trying to get into TaxACT to do our taxes. We used TaxACT last year, it will not let us sign in as a returning customer nor let us sign in as a new customer. We are very frustrated and time is running out. Also I cannot find a number to call for customer service to talk to a live person.
I have spent the better part of three hours trying to get things right - wrong. I went in and deleted an extra entry for the same amount. They added it in anyway and now I am showing more income than I had -- I can't cancel it. Thinking about cancelling their 12.99 charge supposedly free. Ha and the extra $7 for state ---NEVER AGAIN. I tried to see what my tax return entries were but kept going back to other things - complicated and borderline evil.
I used to use TaxAct online. For 2014 I used the downloaded version. After submitting our tax return and receiving a successful response from the IRS, I ran a what-if test (nothing like our normal 1040). The result produced a mathematical error: on the last few lines of the printed 1040 it subtracted 7,883 from 9,488 and showed a result of 1,618 (rather than 1,605). A $13 error. Now I worry about the actual return we sent in.
I have used TAXACT.com for about seven years. I have not had any problem nor has my filing ever been returned because of an IRS problem. However, today I received a call from a man who said he was from the IRS and I owed over 3000.00 in back taxes due to several mistakes on the forms. When I ask what some of the misinformation was he just said, "Contact the local IRS office." I ask for an address of the local office, but he refused to give me any information and promptly hung up. I suspect this call was a scam, since I have not received any from the IRS in writing. I have reported this to the IRS office, and am waiting for a reply. Be careful, don't give any information to the caller. If there was a problem, I feel sure TAXACT or IRS would have contacted me by mail.
I had already filled out my taxes using H&R Block program, but couldn't file electronically. I would have to mail because I was "over the 5 limit" - so I sought out TaxACT because I wanted to file electronically. As I went thru each page, the final - was not accurate! It showed refunds of less because it didn't take the property tax deduction! Could never figure it out. I was forced to pay big money for the also faulty TurboTax, which costs $100 - but at least it was accurate! DO NOT USE this.
I efiled my Federal and State return on TaxAct on 3/2/15. When I logged in to see the status of my filings the message was efile not received. I emailed TaxAct support over 10 times asking for clarification and all I got was that my returns were filed. On 03/12/15 I finally had to resort to calling them at a $7.99 fee. I got a manager that finally sent me the email stating that I may have been a victim of fraud. I then received the email stating that I should contact the IRS Fraud Department. Really 10 days after I filed? They offer no support, just evasive email responses forcing you to call and get charged. NEVER USE THEM. THEY ARE FRAUDS.
After completing the online... yes... FREE service for 2014 Fed and State I was offered at the end to utilize their direct deposit service. They said it was $19.95, took my cc info charged my account and a day later said, "Oops, we can't do that!" After trying to get assistance that never came had to cancel my card, reject that charge and damn near take them to the Supreme Court for help. Ended up doing by hand and all is well. STAY AS FAR AS YOU CAN FROM THESE SCAMMERS!
I have used Tax Act for a number of years but never have had so many frustrating problems. Almost every time I login the system will time me out stating that I have been inactive even though I have been entering data. Other times it will not let me enter a legitimate on-screen option that is highlighted, for example: yes no, where one of them is highlighted. This year's version is extremely frustrating. With all of the stop pangs a requests that I login again I get the uneasy feeling that I might be responding to a hack!
My wife received e-mails from TaxACT regarding account creation and confirmations of successful income tax filing actions. However, my wife never did business with TaxACT - instead, someone else mistakenly typed my wife's e-mail address during account creation, and TaxACT does NOT validate those. Because of this, my wife received notices about the other person's actions, and potentially revealing personal information. We were able to determine the name, birthday, and state of residence of this other person. If we could guess their city of birth, we could completely access this other person's TaxACT account, and potentially steal their identity. TaxACT's "Security Center FAQ" has the below entry regarding this problem. However, shouldn't ANY e-commerce system perform simple e-mail address validation? Duh! Why am I am receiving emails intended for someone else? It appears someone may have mistyped their email address when registering their account or entering the email address to receive notifications about their electronically filed TaxACT income tax return. Our system checks an email address to make sure it is in the correct format. We have no way to verify if an email address entered by a customer is indeed their own. This makes addressing this issue somewhat problematic as we have no other way to contact the customer who has entered the email address incorrectly. Please contact us and let us know of this issue. We will remove your email address from their account to prevent future emails from sending to your address and note the account to alert the account holder to correct their email address.
I began ONLINE but encountered the limitations of NO preview of form until purchasing Deluxe version. I evaluated the options and purchased the Ultimate DOWNLOAD version with State return. After downloading and installing, I found NO WAY to obtain my ONLINE data for use in the Downloaded version. I phoned Customer Support and the agent CONFIRMED that you cannot transfer data between Online and downloaded.
I entered all of the data as required and it looked ok until I did the comparison to last year's return, then there was an additional interest income of over $1million that was not anywhere on the forms. I didn't want to file it with bad information and tried to print out the files -- I only get a script error when I try to print. I tried to reach Tax Act to ask "WHAT", but I can't find a phone number anywhere. Reading the rest of these reviews, it probably wouldn't help. I will have to go elsewhere for my taxes!!!
Efiled on 1/22/15 and efiled my tax returns. It is now 3/17/15 and no refund. Both state and federal were accepted. Can't get an answer from taxact. Anyone else having this problem?
They took 600.00 out of my account. Told me to file a dispute. I call everyday to check if they have received it but update on my dispute form. They said to wait for the call. No call yet. I hope a lawsuit takes place soon. Our hard earned money goes on this PayPower prepaid card. Don't use PayPower to file your taxes.
Beware!! It may be cheap..... but you definitely get what you pay for here. Upon trying to get some help with the form 4562 I searched high and low for some kind of tutorial to walk me through filling out that form, the website is horrible to navigate, then upon calling the company, I first have to go thru a list of 20 questions just to verify my identity (and each time I called no two people asked the same questions!). Then I was told I had to through to "Tax Preparer Support" and that was an additional cost so I paid for that then I was told to "hope for the best." However the real THE ISSUE is on multiple occasions when trying to get through... I was on HOLD FOR LONGER THAN 30 MINUTES PLUS!!! Ridiculous customer support. Will not be using ever again!
Efiled on February 11th 2015 was accepted that same day. Today is March 13th 2015 and still haven't received my federal refund. It says accepted and being processed. 9/10 people receive their taxes back when they e-file and go with direct deposit, which I did over a month ago. I used TaxACT last year as well but received my federal taxes in two weeks. My state taxes are scheduled to be processed by March 18th 2015. I contacted IRS and was told if I don't hear anything by April 15th 2015 contact them back.
Ok I had my brother in law do my taxes and this was the site he used. Last year I used H&R Block and got my taxes super quick. This year on the other had is a completely different story. I had him do them and they got accepted and sent kind of but when it came to receiving the money I still have not seen it. The IRS SAID that it would be deposited in my account on March 2 of 2015 and I still have not seen my taxes yet. I am getting pretty pissed off with this whole situation.
In 2012 I filed my income tax through TaxACT. My daughter, who was a full-time student @ the time, also filed with TaxACT. The problem is that I used my daughter and received an earned income credit. Now two years later the IRS has taken my refund and said that I was not suppose to be able to use my daughter. I did answer the questions to make sure that I could use her. Don't understand how since we both filed through TaxAct why the conflict was not caught, either by the IRS or TaxACT, but that is not helping me now that the IRS is on my case. They now want me to pay $2500.00. Thanks TaxACT, you got paid, the IRS will definitely be getting paid but I will be paying for some time to come. Very disappointed with this product. Wondering who can I get to help me out in this situation?
After using TaxAct for 10+ years and never experiencing problems, this year went to crap really fast. First I discovered by accident that one button indicating I was not of retirement age (I'm 100% disabled receiving disability retirement from the State of Tennessee). Considering all the pop-ups and alerts, the program should have been able to discern that I was only 48 and question why the button was not checked considering retirement age is 65 in most states (at least that is what I think). That one discrepancy on my 2013 taxes cost me over $3,000 on my tax return. Now I am going to have to file an amended return. Thank you very much TaxAct. This year is even worse! After importing last years taxes to save time inputting basic data, the program gave me an Obama Don't Care Premium Tax Credit of $840 to help with health insurance premiums. I did not even notice this as I entered all our data from the each of the tax forms we received this year. I did manage to check the retirement age box and was surprised to find that we were getting $6,780 this year. I finished going through the programs pop-ups and ran the alerts. After being assured everything was correct, I e-filed my taxes and received an email confirming they were accepted by the IRS on February 11, 2015. The following week I filed my son's taxes and he received his refund in four days while we were still waiting for ours. Then on Monday, the IRS "Where's My Refund" website changed from the normal screen I had been seeing for weeks to one that said they were still processing my return and they would advise us of a refund date at a later time. With no indication of why the delay, I called TaxAct to find out what was going on. A huge waste of time!!! After being on hold listening to a machine for thirty minutes, the customer support specialists collected every bit of verification data possible and then continually repeated "we have no information once the IRS accepts the return" to all my questions. He could have told me this before wasting my time with the verification process. Finally he did give me an 800# for "Where's My Return" which only offer the same info as the website with no option to speak to a live person. It was then that I began searching for an answer in my return. I did not find the anything suspicious on the Obama Don't Care Premium Tax Credit of $840 until after I started over with a blank return and inputted all the data from scratch. I am guessing this is the reason for the IRS delay. Does this mean I am going to be fined or imprisoned for trying to cheat on my taxes? Is there anything I can do to fix this and get my actual return? As a disabled Vet, my return is very important as I need it for my property taxes! Plus, I don't like the feeling that I did something wrong when I always try to do what is right and have never tried to cheat on my taxes. Any help is greatly appreciated!!! Thank you, take care and may God bless...
TaxAct took our money and never filed our taxes. We were unable to go back and check the filing. We also were not able to pull up past taxes.
Taxact charged my credit card immediately even though the e-file was rejected. I have the first time home buyer credit from 2008 that requires a yearly payment out of my refund. Taxact asked about this but did not properly deduct so now I have to file an amendment which I have never in my life had to do. Really upset about this and it appears my only course of action is to file an amendment.
I have used TaxAct.com before for years, it was fast and easy to prepare step by step. It was cheap and let you print your returns many times you want even if for few days after you have filed. However, this year simply did not work well at all. It gets break down too many times in middle of preparation. It was very hard to get to the end to file them. Even if you file your return, the website tells you that you haven't printed and haven't filed your tax return. It doesn't let you to print your returns. Again after you have filed, it ask you to continue and file them again. It's very very bad experience this year. I wont even try it next year again. Stay way!
I used TaxAct for the first time this year and will be my last due to they suggested paypower to use because I do not have a bank and paypower took 4 weeks to send my card and took $67 of my refund.
Taxacts computer glitch (they admitted it was their fault) cost me my direct deposit. It makes me furious they "guarantee accuracy" but when called on it, there is nothing they can do. Pathetic. Don't use this service, it's crap and if you have questions they charge you to talk to someone on the phone! BEWARE!!!
I've used TaxACT in the past but this year very disappointed! Filed my taxes 1-23-15 and still no refund. They took their 14.99 out of my account right away and now it's in a system error? Really!
Card was issued. On the 1_30_2015. And I still haven't received it yet and then it's my money but I cant get but $500 a day, that's not fair. And they said, "Have to pay $25 dollars to get another one issued". I don't think that's fair to me when I've never received the first one.
Spent 1.5 hrs entering tax data into the alleged "free" web. At the end it wanted a credit card. You see, it's 12.99 fed + 7.00 state unless you want it free THEN it's $19.99. FRAUD. I spoke with MIKE at TaxAct and he said there was no information under my name, BUT he knew my security question?? How, if the data wasn't saved? This after I had already given Casandra my cc # before I was transferred to Mike who wanted to argue with me about my time spent entering the data and how he worked at AT&T in Basking Ridge. I'd rather hand-write in my taxes and use snail mail rather than deal with someone whose only interest is "schooling" me. The "help" format was useless and you could NOT review your entries on the 1040 and Schedule A. Do NOT use this "service", it's a FRAUD.
I have 3 different problems using TaxACT. First, I filled everything to the end where it is ready to electronically submit my taxes and it kept saying I had to sign a form for this bank to give me money. Then it wanted extra money for using it. Well, I knew that it is free to put money in MY account electronically, so I was so confused, spent a while trying to figure out what the heck they were doing. I finally went back many pages and caught where they MISLED me into thinking that was the thing to do. After wasting much time, I carefully got it finished correctly. Now my second problem, I have no idea where my taxes are. I electronically filed them on January 21, 2015, and today is February 14, 2015 more than 21 days and NO taxes. IRS has only Received it, but hasn't approved it yet. My State taxes were done same time and they just got Received, why so long? I am sure it has to do with them, because I have always received them quickly with HRBlock internet site in years before. Except I did use TaxAct last year so I could just bring up last years. Sure wished I went back to HRBlock internet. My third problem with TaxAct is when I get on the site it goes somewhere other than at the end, and it wants me to go through all the questions over again and signing forms again. It won't let you see everything I have done without filling out questions and signing same forms over and over. Now today, it won't show the electronic status. It is so bad. I wish I had never used it, but how would you know unless you do the whole thing and find out this? And I want to tell everyone to not use it!! And I wished that they had told me.
I have used TaxAct free for three years now and this year it seemed to operate differently. I started doing 2014 taxes and with all the pop ups/the way they explained, I ended up entering all info just to find at the end I had to pay. So, I closed the program and began again - with difficulty and finally understanding to watch and opt out of the Deluxe part. My taxes were filed and I received my refund direct deposit, no problem. Now I'm trying to figure out how to cancel out of the Deluxe which keeps sending me messages. From all the comments made - I believe I will go back to Turbo Tax free next year.
Submitted my taxes and was rejected due to IRS pin#. Tried again rejected again. Was double charged. Ended up printing and mailing instead of e file. Same thing happened last yr, submitted several times printed and mailed for same incorrect pin. However charged only once. Hoping for a 17.99 reversal. The customer service line - can't get through either.
Do not ever use tax act.. we used them before and my mother in law filed for us, everything was fine but this year.. we filed and I put my new bank info in sense I had moved and did my own, everything checked out alright, my info was accurate I made sure before I submitted it, I was checking on irs.gov and it said the refund was sent to the bank, 3 days later nothing was in my account so I checked taxact again and it had different bank info in there on my return copy that I did not put there. We checked the routing number and found out what bank it was. Gave them a call and they said the account was inactive. So going to have to call the IRS tomorrow and see if it can be fixed. I am not sure if it was some old info or what but this was a very frustrating experience I never had when I did my taxes prior years before with turbo tax.
I just filed my federal tax return and now see that the software Taxact failed to add all my retirement income. It left out 2 1099Rs and now I don't know what to do. Help! Should I go in and try to correct this or should I just wait for the IRS to find the error? Will I go to jail? LOL
TaxACT's Support staff is completely incompetent. I tried to access my 2013 return to verify my identity so I could e-file my return for 2014. Every time I tried, I got asked a security question about what city I was born in, and every time I would answer correctly, I would get an error message. I am completely unable to file my 2014 taxes now as the Support staff is absolutely no help. I started a live chat with a TaxACT agent, and after I explained my problem, she logged off and left me hanging! Stay AWAY from this service! Most unprofessional service I have ever used! If I could give them negative stars, I would!
Tax Act charged me the $17.99 for state and federal taxes last year, but never e-filed my return. I did not find out about it until now! I luckily saved my tax return, so I have it to print and mail in, but I was charged for a service I did not receive. I have emailed them and am awaiting a response. I am not hopeful that the issue will be resolved. I have called EVERY number I can find online; all I get is a busy signal EVERY TIME. I will not use this service again, nor will I recommend it.
Like many of you, I have been using Taxact for years (10+, for me). After filing for 2013, I just received a letter 3 weeks ago from the IRS letting me know that I have a tax "Credit". They received the monies I owed for taxes due but I had NOT filed my Federal Taxes!!! I contacted the IRS because surely this was a mistake because I had copies and print outs of my transactions. To no avail, there was no record of any filing and penalty fees will incur!!!
I paid 14.99 for my state tax return and the federal was free, but I need a couple copies for my files and for tax credit. I can't get them to print out. I can't get them to come up on the screen so I can see them.
I did my taxes through them this year and they are EXTREMELY misleading. They say they are free and then they charge you for State tax forms AFTER you are done. Fine, I screwed up by using them, but now, even though I've completed all the questions, agreed to Efile and to have their "state fee" come out of my refund, I still can NOT make a copy of my State form to have for my files. Heck, I don't even know for sure they have filed anything yet and don't provide a way of verifying it. I'm sure glad I did this early so that in 3 wks. I've received no refund, I'll refile elsewhere. DON'T USE THIS SITE, YOU'LL BE SORRY.
Filed 2013 federal and state taxes using Tax Act online services, paid fees to Tax Act, authorized electronic payment of additional taxes due. Tax Act did not file either return, did not transfer funds, and DID NOT NOTIFY ME THEY HAD FAILED TO DO SO. Received notice from California Tax Board one year later informing me no state return had been filed for 2013. Called Tax Act to find out they didn't file the federal return either. On my way to a tax accountant to get this mess straightened out, no doubt at substantial expense plus additional tax penalties. You've been warned!
I've used TaxAct.com before, and it was a good experience. This year, however, the Web Site simply doesn't work. I wasn't able to enter a simple college tuition information - don't think I would trust this site with anything more serious. No Customer Service on any kind - no chat, no email, no phone number, no technical support - nothing! From my experience - this is the sure sign of a bad business. Stay away from services like this! Don't say I didn't warn you.
Saw the comments by Z in Brooklyn, NY. Like this reviewer, I was also preparing my return online with the free user version. I accidentally hit one of the pop ups that made me a deluxe user. I would not be able to submit my return unless I paid to file. I spent several hours preparing my return. They told me I need to start over now to use the free edition. Like the other people on this site, I doubt that this will restore me as a free user. I'm thinking of telling the Ohio Attorney General's office about this scam, as well as the BBB. Do NOT use TaxAct. It also took me 5 time to provide my user information before she began to help me. Sounds like they have no intention of helping. This all sounds shady to me.
I received a RD-108T Supplemental Vehicle Trade-In Sales Tax Credit Form. Their software didn't have anywhere to put this credit. I tried to search their help topics but it isn't there so I try to click for email help. It just puts me back at the review topics page. They seem to be unreachable. I've used TaxAct for years - looks like I should go somewhere else.
The website offers free tax preparation and at the end they charge 12.99 for federal and state they charge 7.00, unaware that doing an itemized return they charge a fee and you don't know till the end.
