I filed my taxes on 1/20/12. I was accepted the next day 1/21. TaxAct "claims" the Endeavor Card comes within 7-10 business days. It is now 2/4, exactly 14 days and 10 business days later. Still no card. I called the Bancorp customer service number last Friday. The woman on the phone told me they processed my card 1/23 and I would get it in 7-10 business days (wow, great help) so I would've received it anywhere from 1/31 to 2/3. Today is 2/4 and my DD date is 2/6. I still don't have my Endeavor Card. The customer service line has been absolutely unreachable the last 3 days. Ive tried calling. Every time I call Im on hold anywhere from 45 minutes to 2 hours. Before I can't wait anymore and hang up, Ive actually waited a full hour on hold just to hear, "Due to unforeseen circumstances, we cannot answer your call at this time please try again later." I don't know what to do anymore. TaxAct customer service doesn't know Jack. Bancorp is unreachable, and Im sure the IRS can't do anything. I've done a lot of research on The Bancorp Bank and their Endeavor Card and its not just this year but over the years tons of people have had this issue (and many other problems which are even worse but I won't go into). So to anyone that hasn't filed yet: never use the TaxAct Endeavor Card! If anyone is reading this and had the same problem but finally got there card, please tell me how long it took you to get your card. I really need my money and my DD date is the day after tomorrow but because I didn't get my card in the mail today I won't have my card when my DD goes through, which is even more frustrating because my card will be floating around in the mail somewhere with my money on it. If I don't get my card on Monday I want to know what other options I have if any.
I cannot print my return for my records. I've done all I know to do and tried the suggested solutions. But still I am not able to print it.
I filed my taxes online like I have been with this company for several years. This year never received my card, can't get in contact with customer service, when I did was hung up on. Told I could get my card expedited for 50 bucks agreed still no tracking number, no response, nothing I'm to through need to pay my bills and am totally backed up my money was deposited to this Bancorp Bank on the first and I still have nothing. I need my money now.
I filed my taxes with TaxAct which went fine. I agreed to have my refund direct deposited onto the Endeavor master card. When telling you about the endeavor card, it says it can be used to make online purchases. I purchased an item from someone with a PayPal account and cannot use this card. There is no way to transfer funds from this card to another account or card and when you call customer service, most of the time you can't get through. And when you do, you're charged $2.50 to not get your problem resolved.
I got the card but no money released. This is a very big rip off.
I have an Endeavor card that expires on 2/12. First, they shut it off a month early, and I had to complain. They said I would get a new expiration date. This never happened. Now, it is just days before I lose my card, and they are too busy to answer the phone. I called and they hung up with a callback later, yet they charge me a $2.50 service charge. They also can't be contacted by email. What a fraud! I am paying $2.50 to get hung up on. I need contact, and I need it now.
Simple: I paid for the one-time DAS fee to access my 2010 taxes last year, and today, I go to print out the filed taxes from last year and I have to pay another one-time fee in order to access the information. I"ll never use Taxact again.
I was unaware TaxAct online had an age limitation for the so-called "free" e-file. It is atrocious! I used TaxAct last year but turned 56 just 2 months ago. After spending over an hour getting my return ready, I find they were going to charge me $7.95 to e-file. I will not use their services again and I will warn all of my friends, relatives, and co-workers. I feel like a victim of fraud. Their false and fraudulent advertising is all over television, radio, the internet, and the IRS site. Every one of their ads says "free" federal e-file, "free" tax preparation, and "free for everyone".
I used tax act last year, very pleased; also used tax act this year, very pleased with the service. What I'm not pleased about is the Endeavor Card or the Bancorp people and as a reflection that leads right back to tax act because they are associated with Tax-Act. I have an illness and I have a limited time left on this wonderful earth, but I don't have any insurance to pay for my blood work, my medicine and a few more vital things that I need in life all because the associates Tax-Act uses will not give me my IRS refund. I was told to leave the hospital Jan. 28, 2012 because of my insurance problems. I used Tax-Act to file my taxes this year, and was accepted by the IRS, etc. I had my card expedited so I could buy me some insurance and get my medicine for my illness. It's only supposed to take two-three business days; it's been two weeks and no card. When I talk to Endeavor custom service they hang up on me and say it's Bancorp's fault. When I talk to Bancorp they say it's Tax-Act's fault. I don't care who's at fault, where's my money? I'm dying and I need my medicine and my blood work by Friday, which will be in two days. I need help. If anyone can help me get my money from these guys, God will bless you and I will pray for you. I can be reached at **. I need help!
Get this pop up advertisement off my email page! It has no "X" out or close button and is blocking my page! I am sick and tired of having to get offline to get rid of it. Then after I check and deleted my emails, it pops right back up! I am getting pissed off!
I want to file a class action lawsuit against tax act. I filed Jan. 10. It was accepted on Jan. 13 and it was direct deposited on 24th. I called customer service and they acted stupid and I was charged $2.50. I had to call again to talk to someone with brains which told me it would be there in 1-3 business days and I was charged another $2.50. Meanwhile, I can't log in online. I had to call and ask why I was charged $2.50. They said a new card will be issued in February, which is the reason why I cannot log in into it. Does that make sense? It is the 27th and still no money. So I called back and another $2.50 was charged. Whoops! No, this time they decided to double the chargeit was at -$7.50 and it should be -$10.00 but it says -$12.00 off my Endeavor card so far. I think they hold your money longer so you call and they can charge and you make millions and laugh in your face. I understand that existence of a wrong, which forms the basis for a lawsuit, affecting a specific group of individuals or businesses is required in order to file a class action lawsuit. Locate an attorney who handles class action lawsuits. Attorneys may be located using the Martindale Hubbell website. This website allows you to search for attorneys either geographically or by the category of type of lawsuits handled by that attorney. Sign an agreement with an attorney to represent you in the class action. You may be required to pay a retainer fee, such as a deposit, against any attorney's fees and/or costs incurred by the attorney in handling your case. File the class action lawsuit. One of the most often used reasons for filing a class action is to recover damages incurred based on products liability theory or relative to defective products. Unless you are granted a deferral or waiver of filing fees, you will be required to pay a filing fee which varies among the courts. Serve a summons and complaint on the appropriate defendant(s). You may need to hire a professional process server to perform this task. Then send or publish the notice to all members of the specific class of members as per the order of the court. The court generally decides how proper notice should be given to the plaintiffs. Generally, notice is given either through publication of a notice in a major newspaper or magazine, or via service by mail or by personally serving notice. You will then need to provide the court and the opposing party/parties with a copy of the certificate of compliance with the court's order.
I filed with TaxAct for 2011 taxes. I chose to use the endeavor credit card card have not received it. I called and finally got through to the company and was told they received release for it on Jan. 17, but I will not receive my card until Jan. 31. That's not fair. Due to them holding my money, me and my children are now homeless. I was needing that money for a house. How can they keep my money and collect interest off me? They get paid enough from everyone. Why is our government allowing this to happen?
Fraud charges on my card, called, investigation was to be done. Was never called back. Called again, was told it had been too long. "Sorry nothing I can do."
Fraud charges on my card, reported it. Never notified back. Called again, was told it had never been filed and it was too late, sorry.
I tried to start my taxes on Tax Act website and ended up with the online edition. This edition is terrible. It is very difficult to use, shuts down frequently, difficult to navigate and does not allow me to save my returns. I have wasted dozens of hours due to this terrible software and it is impairing my ability to file my taxes. I was supposed to receive a free e-filing for both federal and state, but the state filing was not available for Oklahoma Non-Residents. The other main issue is that after I filed my taxes with the online version, there is no way for me to save a couple of my own tax files that I spent hours creating on my own computer. They also want to charge me an archive fee to save my tax records. I basically purchased a product for a one-time use and now, I don't even have anything to save for my taxes except for a printed copy. I asked them about converting from the online version to the normal downloadable version that I have used in the past and they said that is not an option. The way that this software was marketed seems very fraudulent.
TaxAct combined my income information from Federal in filling out my State. In the Federal they kept my wages earned from an employer separate from unemployment benefits. But as for the State part, they "imported" this sum as one lump sum for income and had NOWHERE to correct this. I didn't notice until after when I was given fees and letters from the IRS telling me that I hadn't reported the unemployment benefits onto the State return. So they added it on (thought it had already been added on), and this upped my taxes.
I used TaxACT just like the previous years ,but this time decided to get the Endeavor card. That was the biggest mistake. You can only use the card at one certain bank but they don't tell you this. You have to call them and see why your card don't work and to talk to someone, they charge you $3.50. I used my card for a room deposit just as a hold. They went ahead and put it through as a charge at $120.They were only supposed to use it as a hold, not run it.The fee was $100 not $120. The hotel says it has been released back to my card as it takes 14 to do this on their end so I need to call my bank. So I called and once again I get charged $2.50 to ask about my own money. They tell me that it's still there but it's on hold now till July 19 .I used this card at the hotel on June 5th just for one night and now it's gonna take a month and a half to get my money back? This card is the biggest rip off I've ever seen. It charges you for every transaction you make. The bank charges you and the business charges you. So you get double screwed .I plan on letting everybody I can know about this card and hopefully, enough people will hear about it and the company will get shut down.
Utter failure. Could never get my state taxes filed. Once I realized that and sent them in manually, I had already been charged the fee by TaxAct. I have been charged a penalty by the state for late filing. The Feds sent me a notice that my return was not signed and I can't find any way to contact them. Unreliable and a bad experience. Not recommended especially for something that can put your finances in jeopardy.Con sequences: $26.07 and $17.95.
The so-called premier Federal & State TaxAct software simply does not allow a person to e-file their returns, and does not provide the state part of the deal. I am unbelievably frustrated with the lack of support and have been unable to file. This product is **.
I filed my taxes online with TaxAct.com and elected to have my filing fees come out of my refund. Well, I got my refund the day I was supposed to but it was over $3000.00 short! I can't believe this. Republic Bank and Trust, the bank that was authorized to take my filing fees, took it upon themselves to take the majority of my refund and send it to a company in California for a student loan. However, this student loan wasn't in default and the IRS is not the one who did this. How can they get away with this? I've looked for tax lawyers and all I can find is one that helps when you owe taxes to IRS. I didn't get any offset letter from IRS and they gave Republic Bank the entire amount of refund. How do they then have the right to do this on their own cognizance and what is the recourse that I can take against Republic Bank and Trust?
I have been using Tax Act since 2003. I never had a problem and I still use them. Sorry for all the problems people have. I have never paid for my taxes and I do long form because of being a business owner. People need to pay attention you can get by Tax deluxe. If you hit no thanks. All of you people who are saying you cannot, are not doing it right because it works very good. I have told others about this site and are happy. I would never have my money go to any bank but chase and it has always been there when it is suppose to. When I have made errors it has come back and told me I entered something wrong. And I have paid the 12.95 for archived records and has received them right away. I can tell people who just want to complaint about services and it is so funny because this is a great service if you know how to use it correctly. Everyone is not capable of doing their own taxes and should maybe go to a tax preparer instead of blaming it on the company. Blame it on yourself for not being able to read the instructions correctly.
TaxActOnline has been bombarding me with emails claiming to have first filed my taxes and then telling me there's a problem with a company tax ID number so I need to contact them to straighten it out. Since I never heard of this company until a few days ago, and haven't even begun to do my taxes, I don't know what they're talking about. And there's no good way to contact them. I don't know who's doing what, but something is fishy.
Previous Years Tax Act would import you prior years' data to save time in completing all the forms. Now Tax Act wants to charge an extra fee to import that data and also to print any of your prior years returns. I have been filing with them for many years and this is the first time I have not been able to import and print old returns for free.
I was offered this Endeavor card for my tax return. Any way that I handle the card results in service charges that I cannot bypass. I was misinformed. I felt that I was signing up for a direct deposit card that was handled like a gift card. A $2500.00 tax return is being charged, $2.50 a month, $5.00 for any withdrawal, and an initial charge of $33.00 plus whatever it costs for their tax services. Charges are also incurred if you use the card for purchases. This is a major scam.
I have invested about 7 hours and $12.95 in attempting to retrieve a copy of my 2008 Income taxes which I filed electronically on Tax Act. I had problems from the get go. First, I had to request updated sign in information, that worked sometimes and other times would lock me out of my account. Then I emailed them for assistance, paid the $12.95 for a copy of a prior year return then attempted to retrieve it. I still do not have a copy of my 2008 tax forms (state or federal). I have used tax act for the past two years and am reminded once again why I keep saying I will never use them again and this year I did not. It took me two years to come to my senses. I will never recommend this site to anyone.
I got my tax refund put on an Endeavor Card. Everything was fine until I charged a hotel room to the card. They held $120 as a deposit. I had my vacation, the hotel cleared my account but Endeavor will not release the $120 deposit. When you try to email them, it comes up invalid. When you call them, they charge you $3.95 per call. I paid the $3.95 and talked to someone who said the hotel needed to call them. The hotel called Endeavor (and I was charged another $3.95) and Endeavor said they would hold that charge for one year. Each month of non-use, $2.95 gets deducted. By the time the year is up, I will have no funds left in the account. What a scam.
I have very simple returns and have used this software for about 5 years without incident. My 2009 return was botched. TaxAct did not calculate a Schedule M for me when I rightly deserved the credit, and their software was not smart enough to inform me that I was entitled to claim the new home buyers credit on my 2009 return if I purchased the home in early 2010. Now they want me to pay extra to file an amendment. This is the last time I use or let anyone I know use this software.
Like others on here, my refund was erroneously put on Taxact's own Endeavor Debit Card instead of the bank account I instructed them to deposit it into. They have limited amounts that you can take out and charge a fee to do so. When my wife tried to call the number on the back of the card, she was instructed that she would have to pay 3.95 to talk with anyone about this. This is a shameful, dishonest way business practice which should be illegal. A policy to make your customers get the service they have already paid for? Extra charges to get my own money of out of the debit account. I have already paid to prepare the taxes through this business. I shouldn't have to pay more to get my money, especially when my deposit instructions weren't followed.
On 4/14/2010, I was contacted by my Mother, Joan regarding her use of taxact.com for a tax filing. She calmed, she was contacted by a taxact representative and was informed her tax return would be done completely free of charge. I reviewed this after she had been duped into paying $17.95. I went to their website and it claimed a free tax filing. However, when you proceed there's no way to actually get a free tax return filing without a deluxe upgrade. Loss of $17.95.
The TaxAct software worked, however, it tricked me into upgrading to deluxe, which I had absolutely no intention to do. I tried to reverse instantly, tried to get my money back, and got terrible response. I recommend that you use another, more honest service that charges only for what you use. I also find it disgraceful how many times the service shut me out, forcing me to idle for 10-20 minutes.
I e-filed my 2009 federal tax return online through taxact.com. I opted to receive my return via their prepaid debit card, (Endeavor Card by Bancorp Bank HSA) My return has since been direct deposited onto my Endeavor Card, however, someone tried to receive an additional card without my consent, thus alerting their fraud department. This is not my complaint. In fact, I applaud them for this action, my problem is I have provided via fax (at my expense of $16.11 to be exact) All of the documents they requested 3 days ago. Without so much as a return call to resolve this problem. I am on a fixed income and am depending on my return desperately. I cannot even get a live customer service person, let alone a supervisor, after numerous voice mails, that is all they offer, I am outraged that my return is just sitting there, even if I have provided all of the documents they have so curtly requested. This outrageous act has affected not just myself, but all of my family, in which, I alone support. I am on a strict budget, as to the hard economic trouble that our country is in. I have had to go so far as to find food banks, have had my electricity disconnected, suffered financial embarrassment, mental anguish and so much more than I care to mention as to the blatant customer service I have received from the above mentioned business. I just want what is rightfully mine and should have had full access to days ago.
It is only fair that people also read success stories. I have been doing my taxes through TaxAct since 2005 and I have had plenty of help. The people have been patient and I'm a hyper person but they would listen and help me to resolve my tax issues or guide me where I would need to go. Never had to wait long to be helped-- what can I say. Sorry for those who were not as successful.
On February 24, I completed my online taxes and submitted them for refund. I was told that I would receive my refund on the Bancorp endeavor card within 10 business days. It has been almost a month of Mon-Fri waiting and still no refund. I have tried contacting 2nd story products to resolve this matter and all I get is the runaround and a phone number that is busy 24/7 or not answered because of heavy call volumes. The number given to me is for Bancorp. What are they doing with my money and why can't I get what belongs rightfully to me? As far as I am concerned, I hope that particular bank goes belly up because of their incompetence and non compliance with their agreement. A class action law suit should be brought against these companies for breaking contract. If I or one of my fellow Americans were to break contract, we would pay heavily but it seems that no one cares what companies like this do. I am very disappointed in this company and I would like to ask the question, "What if the people decided that enough is enough and they aren't going to pay taxes due to this happening?" My next complaint will be lodged with the Fed Trade Commission Consumer Affairs division and will be repeated until I have this matter resolved. There are a few damages such as putting me in a position of duress. I am stressed over past due bills and cannot afford to buy the necessities of daily life i.e., pet care and personal products. I have actually became an insomniac due to stress and cannot afford to go to the hospital or buuy medications to relieve these issues. I have also became very disappointed in our system both legal and of commerce. It is this type of betrayal of contract that causes really big problems not for just myself but the nation as a whole and it's time someone stood up and took action against it recurring in the future.
I had started filing my 2008 taxes with TaxActOnline. When I kept getting information I was not entitled to on earned income credit. I tried to correct the information, but could not so I cancelled the process. So I did a paper file but I am not sure my online filing was cancelled and the IRS may use both. A loss on my refund because a claim by the IRS that my 2007 tax return did not match.
I cannot get any kind of contact with Tax Act. I completed a tax return on 2/18/10 with no kind of message from Tax Act. I need my return done now.
I filed my federal and state taxes with TaxAct. I understood I could file my federal online for free and I would have to pay $14.95 to file my state taxes. I was charged $14.95 twice for filing my state taxes. I would like to know why I was charged twice.
I attempted to file my 2009 taxes online through Taxact.com. I paid them $14.95 for "deluxe" service and another $5.95 for storing the records. The 1040 goes fine. I answered all questions and provided PIN numbers but it won't print. If it won't print, they can't file it. I watched the video, read all the help sites and sent an email. Taxact.com responds by telling me to watch the video, check the pop-up blocker, check my Adobe, blah blah blah. I did all the things suggested. It still won't print, won't file. No help, no taxes filed. I just paid for absolutely nothing and now have to go out and find a tax preparer or just get the forms and file them myself like in the "olden days" file them.
