I responded to a suggestion from a friend for an online business. I initiated the contact for information. The initial set up for income advantages coaching was U$D3,850. This was information as an eBay reseller. I am a senior confined to a wheel chair. I only was looking to make enough money to have my van converted to live with my disability. I told this to the coach and he assured me that with this investment, I would soon be making thousands in the new business venture. I should have looked into this company, but I so wanted to believe that I went along. There was never any clear reference to what exactly I would be reselling on eBay only that there were thousands to be made. When I started to question, I was told that to sell on eBay people were looking for bargains. An educator called and said that to really make money, I needed to get into drop shipping. In order to get set up as a dropshipper, they would require more money, and more to set up a business credit. Every time I questioned, I received another call with more hard-sell tactics. I am a senior and I did not understand that there are people that will employ these types of practices to scam people out of money. Again, all I really wanted was something worthwhile to occupy my time so that I could afford to live comfortably with my disability. I am confined to a wheelchair and I am vulnerable. These people know just how to handle such a situation. They played on my vulnerability to extract what limited money I have. My quality of life has been compromised because of my willingness to believe. I am at a loss. I just don't know what to do next.
I purchased an online website where I was an affiliate marketer for Amazon, Clickbank, etc. in January 2012 from a company in the U.S. During the first week in February 2012, all of the calls started. First was a gentleman from The Tax Club who said he received my information from another party/company about a business venture I had just started. They were selling a business saver plus package; the price was $4,785.00 with a monthly recurring charge of $49.95. At this time, I told them that my business wasn't even up and running yet and I was told that in order to qualify for my business start-up costs, I would need this service. The next call came the following week. This was for business credit coach (one-on-one coaching), setup of credit bureau files (not done), access to members only back office (?), access to business credit specialists who apply for business credit funding (not done), help to get DUN's number (not done), access to business credit lender list of over 2,000 companies (not done), access to their network of over 378 banks and business lenders, personally introduce and recommend me for funding (not done). After a lot of going back and forth with this gentleman, I felt I had no choice but to purchase this package in the amount of $4,995.00. Otherwise, my business would fail. The next call came the same day and was from All Access Books for bookkeeping services costing $2,995.000, with a quarterly recurring charge of $99.00. Again, I was made to feel this was required for the success of my business. The following week, it was Essential Plans calling for the purchase of the business plan silver package for $2,693.00, which was to include a business plan strategy, provision of DUNs (not done), lifetime proofing and editing of business plan, provision of corporate credit cards, referrals to 3rd party lenders and drop shippers (not done) and unlimited one-on-one consultations. This has not been done even though I had made attempts to reach someone. My calls were not returned. The same day, I also received a call from a gentleman from Success Online for the purchase of the Traffic Wizard Gold package for $5,000.00. This was to include linking thousands of related domain names to my website, send 10,000 visitors to my site every month. Again, under extreme pressure to have a successful business, I purchased this package. I have had several phone conversations regarding the visitors they are supposedly sending to my site which I don't see, but they assured me that this is being done. By this time, I have used up all my personal credit, I am over the limit on one credit card and have maxed out my personal line of credit. The following week, a call came from a gentleman for more purchases that my business would require to be successful. I told him I had no more credit available and with much talk back and forth, he talked me into getting another credit card which I was able to do and I purchased a business logo from Ikongo, which included designing a logo for my business and 1000 business cards for the sum of $1,925.00. This is the only thing I purchased without delays for what was provided. I also purchased a Merchant V-Card Bronze package from Success Online for $399.00, which is a virtual business card to be used on places like Facebook, Twitter, etc. I got nothing but the runaround with this and I have not received this. Lastly was the purchase of the Consumer Trust Platinum package from Success Online for the sum of $2,295.00. These last 3 purchases put me over my limit on my new credit card, but this was approved after the gentleman from Success Online called my credit card provider first. At this point, I felt that all my decision-making had been taken out of my hands and these people had taken over. I was pressured very strongly by them saying things like "Don't you want your business to succeed?", "We see you haven't made any money yet and these purchases will ensure the success of your business." I told them I was so far in debt now that I could not even pay what I owed now, my personal credit was suffering. They said that I would have to decide whether I wanted to succeed or not and again, I purchased things I didn't feel I needed. In late April, I started receiving calls from a gentleman trying to sell me more marketing. He got my information from The Tax Club to call me because my business wasn't doing well. I told him I had no more money to invest, that I was already in debt for $33,000.00. This guy practically harassed me over the next few weeks. No more calls until late June 2012, when a gentleman named Rick called from Online Business Solutions (I believe this is what he said). He told me he was given my information from The Tax Club and he wanted me to purchase a marketing package for my business for the sum of $3,995.00. I told him no, I had no more money to invest. The following week, he called again and when I said to him that he had called me the previous week, he said it wasn't him but I said the guy had the same name and was calling from the same place. Again, he said it wasn't him and that if I couldn't pay $3,995.00 for this package, maybe they could give it to me for $1,995.00. I told him it didn't matter how much it costs, that I didn't have the money. He then went on to say "Can't you set aside $5.00 a week to make this business a success?" and I said no. At this time, I could invest nothing more. He told me he would call again in a few weeks, but I told him it would make no difference, there would be no change. I was broke, I was paying for purchases already that I either didn't receive or didn't require for my business and that my personal credit had been damaged because of all this. These guys don't care about the average person. They only care about making money themselves. They are salesmen who are only interested in making a buck and use every line they can think of to reel you in deeper and deeper. I am nearing retirement, but now because of bad advice from these guys, I will not be retiring for years and years to come. Lastly, I would add that all these dollar amounts are in U.S. funds and I am Canadian and had to pay the exchange rate so in fact, paid more than what you see here. I feel very strongly that I should be reimbursed for a lot of these purchases because of the tactics used. I don't need a lot of these things and had I spoke with an expert first, I would not have done this. Thank you for listening and I hope to hear from you soon.
I started my new online business last year. The Tax Club came in and introduced all kinds of services that could help my website making money in the long run. I paid almost $50,000.00 for them and trusted them that I would get my money back within a year. The salesman advertised lots of story, which made me fall into the dark hole and I didn't notice. I just want to keep my family under the roof, but I couldn’t make any money since April of 2011. I couldn't keep up with the recurring charge every month, so I have to cancel the services two months ago. The only services I got from The Tax Club were headache and bad credits. I don't have any money left and I couldn't buy anything for my kids, such as new summer clothes, toys, and I can’t take them to the movies. I have to save all the money so I can pay the creditors. I have to spend all my kids’ savings for these services that I couldn't get anything from them. They refuse giving me back for the services that were never rendered. I don't know what to do next. I just have to work and suffer for the mistake that I listened to The Tax Club.
I would like to submit a formal complaint against The Tax Club's lack of service. I have been given various "business names" including ** and **. I secured their services at the end of March to create a website for a small company in West Texas. The website has been through a series of "revisions." Each time, I refused to accept the site because the changes that I requested were not completed. When I have responded to their design, I have had to call back 1 to 2 weeks later and ask why the changes haven't been completed. I will then receive a new request to accept with maybe 1 or 2 of the changes that I requested having been made. Case in point, the second time we went over the site, I requested a total of 5 changes from changing colors to adding the logo and changing some pictures. After two weeks, I contacted them five times over three days and finally received a call back. Within two hours, I received a new copy of my entry page with just the logo added - none of the other changes were addressed. I called again and resubmitted my request for change. I waited a month for an updated page, and finally called to cancel the service and receive a refund. I was told that there were services rendered, so I wasn't entitled to a refund. When they realized that I had copies of all of our correspondence, they offered a 25% refund which is still unacceptable. I signed up to received a full working website. After 3-1/2 months of going back and forth, I still haven't received even the first page according to the specifications that I have given to the company repeatedly. As I told the representative, I work in the oilfield. I can work on a pump all that I want, and if I don't give the customer a working pump, I don't get any money. That is the way business works. These services that they supposedly rendered were grossly inferior and completely unacceptable.
My series of experiences with The Tax Club has been the most extreme of my life as I was caught in a web of deception that escalated to financial distress every step of the way. Finally, it was my gut that told me to stop listening and call a halt to everything. By then, however, I was nearing insolvency in a financial life becoming chaotic. Here is a list of the suspicious business practices I encountered: Lack of transparency from start to finish. - There was no upfront information at the first step about what the total cost would be. I mistakenly assumed that first output of money was all that would be asked but each step of the way, it would take more money to complete that step and on and on it went. It felt if I had known the total costs, I would never have started in the first place. But then, I also felt like I was too far in to stop and I was still hoping we would reach a point where I would see income. Lack of continuity from one step to the next of this business building process and supposed coaching from the success team. - I had a different coach almost every week. This lack of continuity was bewildering and affected my decisions. These men took the freedom to ask for more money and I was subjected to the high pressure sales I call guerrilla sales. At the same time, a coach might sound concerned and would encourage me to keep going as everything would turn out great. And as others have said, I did finally clue in that I really did not need an LLC and I too had been promised huge tax savings even though I had no income as yet. This business building was unnecessary because I did not know what I wanted to put into the LLC as my primary business. The vague and generic business plan alone cost upwards of $2,000. And I had already established the LLC with another outfit. Obfuscation about who they were and who they were associated with. - I thought the success building team was part of a primary opportunity I was pushing and they never indicated they weren't. Each time, I would mention that I didn't want to go further until I received pending commissions from that business. Still, they would pressure me to keep going. I exasperatedly held to the belief that that business would come through and I went there and asked if The Tax Club was part of their business and they said absolutely not and they had never heard of them. Today in consulting a consumer advocate, I have learned that very likely I will not get a penny from that business either and that they and The Tax Club could be affiliated for the purposes of sharing a percentage of the payments I was giving The Tax Club. So they could be associated in a hidden way and not upfront at all. This could constitute a double scam and then one is faced with wondering if in turning for help somewhere perhaps that help might constitute a 3rd level of scam. Invasion of personal privacy and insensitivity to one's financial context in personal life and finances. - I witnessed and experienced an alarming mac truck customer approach to the point of some coaches contacting credit card agencies themselves and asking them if they were willing to lift my credit limits or else go over limit temporarily. This was the worst experience of all and it was at this point that I knew I had given over my personal decision making. Although I had consented to start with, I was unprepared for the lengths these coaches would go to get the money while completely ignoring my reservations and protests about doing this. The persuasion tactic at this ultimate point was that we were almost there and now my personal credit could be separated from business credit building. This again cost more money and we worked out a down payment even though I was protesting that I had reached my limits. I did set this up and when I learned what my monthly fees would be for the next two years, I stopped everything. Yes, unfortunately, I had signed several contracts from one step to another but I am reporting this now and I fully intend to ask for reimbursement of everything I gave to The Tax Club. In trying to retrace my steps, I asked billing to send me an account for everything but I don't believe that all is reported there because there have been different billings under different names. I have to go through all my credit card statements since the last few months of this misadventure and try to find what I am sure is missing from the accounting because some parts part of the business building team's work was outsourced somewhere else. Lastly, this misadventure with financial bullies constitutes elder abuse. I am retired and had hoped some investment in recurring income could improve my life and the lives of others I care about as I proceed into older age. Instead, I surrendered the remainder of my savings from my false hopes and gave my independence to the pressures of questionable salespeople. They held out false promises, exacted exorbitant fees for no returns, and exemplified heedlessness about the financial rights of their customers. It feels like robbery and certainly like a set up full of false promises leading to dispossession of many of the persons involved with them.
In October 2011, I received a call from a Jacques ** from The Tax Club. He said they were working with PMI (not true) and they had been asked to contact us (my wife and I) to help us set up our business. He offered us a business saver plus program which included the setup of an S-corp, issuance of EIN, unlimited tax consulting, e-tax hotline, customized tax plan, and filling of personal and business taxes for 2011 ($895). The package would cost us $4,785. We told him we were not doing business yet, so there was no income. He insisted the S-corp would benefit us because we could write off what we had invested with PMI, the cost of starting the business, and that there was a total of 330 write-offs for the business. The S-corp was established in November 2011. Two weeks before the tax deadline (April), my wife completed an online application they called the VTO and followed up with a call. She was told by Mily ** that the taxes would not be filed on time and that we had to wait for an agent to be assigned to our file. When Kevin was assigned to the file, he told us we could not write off anything on the business because there was no income. My wife then contacted our longtime tax professional who informed her there was an $800 yearly tax for an S-corp, the deadline for the business tax was March 15, and that we could report a start-up cost on the business and the rest would be amortized over the next 15 years! We have called several times, but got the runaround. After reading comments on this website, I e-mailed them on May 22 to the address provided by them on this website (ca@thetaxclub.com) and another one given to us by one of their lousy customer service reps (clientcare@thetaxclub.com). I received an auto response that said I would get a response within 3-5 business days, but I have heard nothing. All these "professional" Tax Club representatives do is lie, lie, and lie to get our money. I will not stop until I get what they owe me. I know they cannot charge me for services not provided to me and they did not file my taxes and customize a tax plan. And whenever you call, you always have to leave a message for someone to call you back because there is nobody available to answer your questions right there and then.
I feel like I have been sold, in high pressure, products and services I clearly do not need. Their tax advice thus far is just my name applied to some standard explanation of tax practices which I can get for $150 from TurboTax, not $4,700. I just got off the internet and found free services such as obtaining an EIN. Big deal, it is just a form, no special training to obtain that. My naiveté in business matters made their salesmen sound sensible. In fact, they want you to pay and expensively for nothing but advice; you will do most of the work anyway. They want you to pay for services when you don't even have a business yet. Doing my business taxes and bookkeeping will be easy since I have no business yet and no transactions to keep track of. There are all sorts of free bookkeeping software and I have done my own taxes for the last 25 years with no audits and no problems. I just want my money back for services not done. I realized they filed for my EIN and corporate papers; again, both things offered for free on the internet. They are just standard forms, nothing more. If sometime in the future these things become too hard for me to deal with, then maybe it would make sense to hire them. Not without any business. They will just run up your credit and ruin your credit while continuously trying to sell you more services. Monies that could better be spent building your business. I want my money refunded. This all began by them sounding as if they were associated with Power Sellers College Tech, which they are not. So at first, I thought I was being advised by one of the instructors from PSCT. It just doesn't make sense to invest in all these services before you even have a business up and running. Sort of a cart before the horse scenario.
In January 2011, I purchased an entity and tax program for $1890 from The Tax Club after spending $5,000 on Stores Online and $20,000 with PMI. When I bought The Tax Club products, I was told by Mike **, the representative that once my company incurred a loss, which most companies would, I would recoup the full amount of $1890 in my taxes. I felt that Mike pressured me and convinced me that I would be making a lot of money and that I would need a resident IRS agent. I thought that this and the fact that I would be able to get all my money returned in 2011 would be a huge benefit. Turns out to all be lies. I would not have purchased this product if it were not for him telling me this. There was no question in my mind nor in his mind of what he was telling me. This money would be returned to me, period. Then come 2011. My plan was to use The Tax Club in 2012 for the 2011 year taxes and so I contacted The Tax Club and informed them in early February that I needed the forms sent to me in the mail and not in electronic form because I don't do anything on my email. They said that they would send it to me. After a couple of weeks, I called The Tax Club back asking about the forms. They said that they had sent the forms via email. I told them again that I needed the forms sent to me via mail. The representative said that they would send the forms via regular mail. Again, I never received the forms after a couple more weeks of waiting. I called again and spoke with a different representative who said that they would overnight the forms to me. I received the forms within 2 days of the tax deadline. The forms were a terrible quality as though they had been copied multiple times. And at this point, it's too late for me to complete the forms and send them back to The Tax Club because I would be in violation of the deadline set by the IRS. So I ended up going with H&R Block to complete my taxes for $400. After I filed my taxes with H&R Block, I was informed by them that the cost of this product, $1890, I had purchased from the Tax Club would not be returned to me as the salesman had said. You can imagine how furious I was at this point. All this hassle and money spent and I don't receive the money back as was promised. I feel like I was scammed! I then called Nicole with The Tax Club and explained what happened. She was very abrupt with me and didn't seem to care about everything I had gone through with The Tax Club. She then read me a sentence that said that I agreed that the representative did not make any earnings claims to me at the time of the agreement. I don't even know what an earnings claim was at the time I enrolled, so I don't know if he made these claims or not! There was so much information being told to me at the time. How am I supposed to realize that the representative telling me that I would have the full amount returned when my taxes are completed to be a lie or earnings claim? Tax Club needs to fix their sales! Now I'm broke and can't afford these monthly payments. Tax Club did not provide any service to me and brought me into their program with false hopes and misrepresentations. This is only the beginning of what I am prepared to do. I need someone to call me, not email me.
Website/Logo/Services in general - The salesman indicated in a roundabout manner that they were associated with a coaching service that I had recently signed up with and paid for, and he proceeded to tell me that I had to have all of these other services. Very high pressure and they kept calling me back until I relented. The amounts of money kept changing but in the end, I was out some $19,000 plus for services only partially delivered. They then wanted me to e-sign a bunch of so called receipts which read more like additional permissions for payment (the word receipt and descriptions of services conveniently omitted). I did not sign and asked for a refund of my money, I got no response to that, only another request to e-sign. I did not and have not heard from them since. I am disabled and used some of my retirement funds for this. If I do not get a refund of all or at least part of this money, I will soon be homeless. This was without a doubt all a scam. I cannot understand how these people got my name and phone number as they contacted me. There is a privacy leak somewhere. I thought this was illegal per company policy. I shall have to inquire with The Federal Trade Commission.
