I was contacted by the Tax Club after Consumer Affairs published my complaint. The lady told me that she would look into my case and call me back within 48 hours, which she did. She told me that they had decided to refund me $3,500.00. I was happy to get something - anything at this point is good. I received three refund forms, one for success planning, one for my essential plans and one for Internet marketing. When I bought their services, I paid in U.S. money and I had to pay the exchange. They send me refund forms totaling $2,920.25 - that is just a slap in the face. Then they include a clause that says I will have to release the Tax Club, their associates and assigns of all further responsibilities and liabilities. Success Internet cost me a lot of money by dragging the completion of the "website" for almost a year. I paid for a site hosting company, signed a three-year contract for a merchant account, paid monthly payment for months. When it was obvious that they were not able, capable or competent enough to give me what I had paid for, I had to cancel the merchant account and pay three years of services I did not use, plus a cancellation fee of $300.00. The refund would have been so welcomed at this time but not at the expense of my ability to voice my opinion and experience with the company. I would have accepted the money, not $2,920.25, but the whole $3,500.00, had there been no condition to the refund. The Tax Club owes me this money (there is no doubt at all) but they should not ask that I give up my rights. They took everything from me and so did their associates. I want my money back, all the money that Success Internet charged me for services not rendered. How dare they cry out "wonderful new." They just used me again. No, it's not good new. It will be good new when they pay me back.
From the minute I answered the phone, I was lied to. I answered the phone, and could tell it was a telemarketer, so I said I wasn't interested. He said, "You just spent $10,000 with us and you're not interested." So I said, "Oh, it's you, guys." He said yes and to enhance and make my business work, I needed to get my taxes, quarterlys done, plus a business plan. This cost over $3000. They sent papers the same day, as to business plan, which I could have pulled up off the internet within 15 minutes like they did, but I opted for the cancel button instead of e-signing their papers, when I found out he lied. He wasn't even associated with the company I spent the $10,000.00 with, and all the cancellation would let me print was a note that said you have been successfully removed and I still kept getting phone calls from them wanting more money, for quarterly filings, business loan, etc., things which he told me were included in what I had already paid. What a liar, cheat, scam, everything I hate. I have e-mailed them, called asked to speak to owner, no success, and the bank won't refund money because they said they gave me some service. They sent me everything they did the same day, and they have a 3-day full refund. Ha! What a lie! Since I had to pay another $3,000 to someone else, Amerify, to do my taxes and quarterlys, which they have done. I want all my money back from them, the Tax Club, my essential plans, success planning group, whatever they want to call themselves. Also, I want the world to know what liars and cheats they are, so no one else has to go through what I have, help help! This is so wrong; they prey on older people on social security, mostly older people because we are old school and are honest, so we believe others are also. Bot anymore, and I don't like to feel like that, but I've been cheated and lied to so much. Stop these people now, make them refund the money they don't deserve and didn't work for, plus I think they should pay penalties.
I decided to get a website with Genesis Admin which is another story in late 2011. Not long after, I get a phone call from the Tax Club offering to help me get my business going with help to get an IRS number and getting an LLC name. All this sounded easy as I was told this was all able to be claimed back on my tax return. I thought about it and decided not to go ahead with it, but some guy rang and talked me round to thinking this would all be okay. This was a large outlay at the time, which went on my credit card. Not long after, I got another call from a different person selling me Asset protection etc., and again saying this was all tax-deductible. I am not sure how many things I was sold by many different people. This got very confusing as I didn't even know what they were supposed to be doing. They talked the talk and I stupidly gave my credit card number and 6 months later, I am 30000 New Zealand dollars down the toilet. At one stage, with my credit card at the max, they even got me a loan to pay off. What was I thinking? I was last contacted in January; they were trying to hard sell me marketing and then later trying to sell me compliance which I did not go through with. They were very intimidating phone calls. I have all the names of people I have talked to. I have not been contacted since, not a word. It's very hard to call from the other side of the world. I live in New Zealand time frames and zones, have tried many times and cannot get through. I emailed a few of these people, have not had any reply, very poor. I emailed The Tax Club a couple of times about tax returns. Someone called from the tax returns department and I was told that I could not do a tax return as I was not trading (my website is live but not making any money). This just sent me into depression as I was told that all the money I spent was tax deductible. I believe these people are scamming me with their sales talk. They knew I was an easy target, not from the USA, so they kept at me. They sent out electronic purchase receipts but I have never sent these back. I'm not sure about the law from down here about these. I have had no service from these guys. They don't help you and they sold me things that I will never ever need. I only have this little website which has not made any money and will probably never make any money. I am so upset with what they have done and with myself.
I was contacted by The Tax Club after filling a form for information about e-commerce. They told me they could help me set up an e-commerce business and that they offered all the help I could ever need including tax filing, website, virtual office, bookkeeping, etc. Their "associates" iKongo, success internet, accountants etc. are also part of the scam. They sell websites that can't be used. Once I started asking questions, everyone disappeared. I couldn't get a hold of anybody. After a year of chasing after them and $40K invested, I had to call it quits. Even with the useless website they provided, the useless video, the fact that they could not file my taxes or keep proper books, I did not receive anything from The Tax Club or their associates that I could use. When I finally was able to reach someone and ask for a refund, they said I had received everything I had paid for. I am now so much in debt that I can't pay my bills.
I dropped The Tax Club two years ago but the more I think about it, it was a scam. The software was awful and I had to do my own research with the IRS and point out the errors that were made in my draft returns. It was a waste of $1500 bucks to join and a waste of $50 a month as I had to do my own taxes using horrible software. I asked for a refund and I was never contacted. Likely the worst company that I have ever seen.
On May 10th, 2011, I spoke with Jacques, a sales representative, who convinced me to purchase from the Tax Club based on false pretenses and lies. He led me to believe that the full cost of my purchases would be 100% returned to me in my taxes the following year. I was skeptical so I asked again if he was referring to 100% returned and he confirmed yes. He then promised that there would be $330 deductions by setting up an S-Corp and asset protection. Based on this, I proceeded to purchase a total of $11,000 from the Tax Club. I was assured that I would receive this amount back to me the following year, so I didn't see a problem if I invested this amount of money. After I had done some thinking, I contacted the Tax Club within my 3-day cancellation period and requested to be cancelled from their programs since $11,000 was a large investment. This was after I had purchased an $8,000 program with PMI. I spoke with a Dean and told him I wanted to cancel and be refunded the money. He then promised me that I could write off all my personal expenses onto the business, which is another lie. Dean convinced to move forward even after I had requested to cancel. He then offered to reduce the amount of the program by $1,500 off of the business planning and business coaching products. I accepted based on what Dean was telling me about my personal and business taxes being returned 100%. Then started the service side of the Tax Club. I was referred to Harvey ** who was a broker to try and get business credit. The only catch was that a $50k line of credit would cost me $6,000. This would be an upfront fee of $6,000 for business credit that I would never use. So in addition to purchasing $8,000 for the coaching with PMI, over $11,000 for the Tax Club, now another $6,000. Where would this end? I immediately said no to this business arrangement and felt that this whole experience was a big scam. A scam to pull more and more money from my pocket. Throughout my whole experience with the Tax Club, my calls were never returned and the conversations that I had with the account managers were terrible. They did not provide any value to me at all. I'm a reasonable person, but this experience was terribly misrepresented and has cost me a tremendous amount of money that I will never recover from.
In November 2010, we got a call from Tax Club inquiring about trying to help us secure our online business with corporate structure. They suggested that we needed some direction and coaching to help us succeed. They then pressured us to join their team of experts. In the enrollment process, they assured us that we could not fail and that we would recoup our investment within 3 months and that the cost of the program was 100% tax deductible, which they led me to believe I would get a credit of $7500 for the year. That was obviously not the case and we are not able to receive the cost back into our taxes. We were totally scammed out of $7500 with the Tax Club. With the amount of money we spent on this program, we should have received expert help and not the misrepresentations and useless material and services that were offered. I left multiple messages and emails asking someone to call me back to discuss my problems with the program. I am extremely upset about my whole experience! I was misled into thinking my success in ecommerce and with the Tax Club would be easier than it has been and that I would be able to recoup my investment quickly and receive the full amount of the cost back in my taxes. I must take action to recoup my money. I’m asking that the Tax Club refund the money so I can move on with my life and put an end to this tragedy.
Since February 2012, I've been working, or so I thought, with the Tax Club and their associates (My Essential Plans, iKongo, All Access Books, GoGo Drop Ship, etc.) to start an e-commerce business. They maxed out my credit card and had me take out another card and they maxed that one also. To this date, nothing has happened. They don't answer my calls, emails, etc. What legal recourse can I take to get my money back? I've been scammed out of over $20,000.
I became upset with the Tax Club in the process of setting up my S-Corp. It was in November of 2011 and they wanted me to send in the paperwork they had prepared after we signed up. I had already gotten my EIN before signing with them and in their process, they had gotten another under the same company name. I now had two EINs under the same name. I contacted them about this problem and they told me that I had to write the IRS and cancel the EIN I signed up for. In talking with the IRS, I was told that S-Corps have to pay a tax of $800 for the year. This was something the Tax Club never informed me of. As it was November 2011, and I was just starting the business and haven't had any sales yet, I asked the IRS agent if I can wait until January 2012. She told me that there is a 15-day grace period so I could file on the 17th of December to avoid the tax for 2011. I felt at the time that the Tax Club should have informed me of this as I was just starting my business and they were the tax experts. I contacted Mark **, about this and I stated that I thought that the Tax Club was supposed to have my back, and why didn't the Tax Club inform me of this. I told him I was dissatisfied and that I want to cancel. I have the emails and my business partner was on the phone with us. Mark ** at that time, had made promises on behalf of the Tax Club, stating they should have known and to keep us on board and restore our faith, he would defer the monthly installments of $49.95 for three months and pay two years of the $800 to help our business get started. At the time I felt that the Tax Club was trying to make things right and decided to stay with them. Mark also stated that when I get my website up and running, to send him a link as he was interested in some of the products I was offering. It took me 5 months to publish, so I went to send him a link and found out that he was no longer with the Tax Club. So I asked the Tax Club representative at this time, if the promises that Mark ** made would still be honored. He asked what promises so I told him what Mark had said. He said that he would have to pull the tapes of our conversation and that they would get back to me, I asked if I could get a copy of the tapes, he told me no as they are the Tax Club's property. When I tried to have the Tax Club make good on their promises, Jerry, my West Coast representative, called me back after two days stating, “The tapes can not be pulled.” (They had mysteriously disappeared). He offered me 3 months of deferred payments and I told him that I wanted to cancel my account. At the time I felt, this $150.00 is nowhere near the $1600 they had promised me. Minutes later, I received an email stating that I would receive a phone call from one of their reps within 48 hours regarding my request to cancel. This was not a request, this was a demand. Today March 14, 2012, I have received another email stating my account is closed. No call, no $1600. Do not, I repeat, do not get involved with this company. They have lied to me, and they will lie to you! They are unscrupulous! There has been over 350 complaints filed against them. Do your homework before talking with or signing on.
I was first contacted to join The Tax Club for $2,000 and $20.00 a month. I paid money for no service. The only thing I have received was an invoice and a newsletter. I have tried several times to send an email, but it keeps returning. I have also tried to phone them and I was on hold for a long time. It costs me a lot of money to phone them. I just want an answer to my question: What have they done for me with my $2,000 and the $20 per month? I'm still waiting on all the help I was to receive with my taxes.
This is the email of The Tax Club via Consumer Affairs: The Tax Club takes any questions and concern seriously, and we always hope that we can find a reasonable and professional solution in our dealings with clients. This client is not being truthful with her facts. First, this client contacted us after two years of her corporation being established, and requesting a refund for work long finished. Her reasons for requesting a refund were personal in nature, and had nothing to do with our performance as a company. Because we had completed the work, and the client had signed each agreement sent to her, we did not feel that she is entitled to a refund based on personal hardships. As a business, we have to be paid for services provided, and have not found employees willing to work for free, so we cannot offer services for free. The client has claimed because we are American, we only care about business and profits. We care about providing a service and being able to pay employees that provide that service, and yes, we should be able to make a profit as well. We are sorry for the client’s personal frustrations, but despite her claims, we have fulfilled our obligations she paid us for and will not issue refunds on work completed. In response to that: No, In fact my LLC was closed down as a result of "delinquent accounting". Please contact the Wyoming folk that the Tax Club set me up with to confirm. Services have not been rendered. I sent TTC an updated address in March 2011, which they didn’t change. I tried to get in contact with TTC in 2011, with nothing received but bounced emails!
As they sold it to me, they were to be an agent that would complete the paperwork and liaise with the resident agent to comply with US bookkeeping requirements. I sent them my paperwork with a letter updating my contact details long before the LLC was subject to a forced closure for "delinquent books". In my instance: Paperwork was not completed on time and contact details were not updated. I received the Wyoming letter from my tenant, months after it had been sent to the outdated address. By which time, for the reason of "delinquent accounting", the LLC had been shut down by Wyoming folk. If a part of the service has been to "comply with US bookkeeping requirements", they have failed.
I was contacted by the Tax Club after signing up with OHN for a website. An employee of the Tax Club, signed me up for a 2010 Business Saver Plus account in June of 2010, in the amount of $4,785.00. Two weeks later, I was contacted by a Jessie, another employee for a further payment of $7,495.00 for Small Biz Credit Solutions and Internet Marketing Success packages. These transactions amounted to $12,370.00, and to date, nothing has eventuated. I was also contacted by **, who stated that he was my main point of contact, and would email me his phone number and email address. To date, this has not happened. I asked him if there were anymore costs to be incurred for this account, and he said no. Two weeks later, I was contacted by **, to discuss bookkeeping, who explained the importance of keeping accurate records, and asked me for a credit card number, for a further $8,990.00 payment, to which I declined, as I didn't have the funds. Andy demanded that I give him another credit card number. I told him I didn't have one, and he replied "you must have", and then became sarcastic and said, "well, what are you going to do now?" He then said he would speak to his supervisor, **, and came back with an astonishing reduced fee of $4,990.00, if I paid it that day. I repeated that I didn't have the funds, and would they call me back the following Saturday regarding this amount. This was the last conversation I have had from anyone at the Tax Club, until I filled in a "how did we do" survey. I received an email with a refund Authorization Form attached, for the insulting amount of $895.00 on the 30th of January this year. I have tried phoning them, but the numbers supplied have all come back with "this number is not available". I then sent a letter, outlining all details to the managing director, and sent it by registered mail. Someone from their billing department phoned me, and still only offered me the $895.00 refund. They then put their customer service person on the phone, to hear my grievances, and also told me that I would not be refunded for any other money, as after all, this was back in 2010. I stated that some responsibility should be accepted for their employees, and that no services have been provided, since paying $12,370 in good faith. I was then phoned back about ten minutes after ending their call, and told they would refund $1,000.00 on the Small Biz Solutions, and $875.00 on the Internet Marketing. They then sent me an email, with two refund authorizations for these amounts. Disgusted and frustrated, I signed them, and returned them by mail on the 15th of February. To date, nothing has been refunded, and as usual, they have not kept their word of refunding as soon as they received my mail. What can I do next?
Net Essential Plans, The Tax Club, contacted me and said they got my file from WhyProsperity whom I was doing business with. They also got my credit card number from them. While talking to me on the phone, they rang up an amount of $1,744.00 although I didn't give them permission. I told them that I don't have that kind of credit left on that card. Nathan said, "Lets just try it." They must have had the complete sale ready to ring up and on the computer because a second later, he said, "Yes, it went through." At that point, I thought they were still connected to WhyProsperity and hoped they really would give me the help they talked of. They continually want more money and give me nothing. Even when they say they will send me something, they don't. I have nothing for that money. They are crooks. Swindlers, hucksters, frauds, amoral. I'd say more but I want my money back and will try to get it.
Initially, I attempted to start an online business in January 2011. I started receiving calls from different people about my website. One of these callers was from The Tax Club which I believed was part of the organization I was doing my website through. Before I knew it, I was into The Tax Club for over $3,000.00 and they wanted more! I finally had to yell at the guy that I had no more credit left to tap to pay him. But like a dummy, I stayed with them in hopes of getting "back in the game" and using whatever services I had paid for. Naturally, I missed the deadline for terminating services before all this was refundable. Interestingly, I never signed anything or sent anything via e-mail acknowledging that I accepted their products. It is a very expensive lesson learned! As I have seen mentioned in other complaints, I am willing to join any class action taken against this company. I have not even bothered to contact them based on the replies they have given to other complaints. I haven't even established my "e-mail" account as the username/password do not even work. They did not even bothered to try and fix it either.
In March 2011, I received a letter from the Franchise Tax State of California, regarding a proposed assessment. The tax return for 2007, filed by the Tax Club on my behalf, had a different income amount, that was on the IRS form. I contacted the Tax Club in March 2011, and was told that they were too busy to handle this now, and would get back to me after the tax season. They also stated that there was time, so I should not panic. When I asked how an experienced accountant could make a mistake of showing the income on the IRS form was different from the State form, their answer was "people make mistakes". Several months later, The Tax Club prepared a new form for the IRS, showing the correct income for 2007, with $5,125 due to me. This was rejected by the IRS as being passed the 3 year deadline. If this claim had been submitted when the issue first arose, it would have been in the 3 year filing deadline for the IRS. Any competent accountant should know that the income should be the same for both IRS and state. The tax Club rep admitted "people make mistakes". The Tax Club alleges that the original W2 was in error. I contacted the company, and was given a copy of the original W2. The personnel department of Inland Pacific Builders will so testify.
In March of 2011, my daughter and I embarked on a venture. We were going to build a web business. The Focus group affiliated with Success Internet and Internet Success provided a coach and instructions for $15,480.00. Within a week, my daughter who has cerebral palsy was diagnosed with cancer which had metastasized from the breast cancer that she had had in 2009. I tried to get out of the deal. Jerry ** and Derek ** spoke with me. Derek told me that he was part of the Focus Group and he and Lee were the guys who get the job done right now. He said that if you don't invest now, you will never make any money. I was told that if I do everything he says, I will be making more money than I will ever need. He said to get a CRM, Marketing, and several other promotional services. I sent a check for $7,450 and was billed $10,000.00 on a credit card. I was billed many other charges totaling nearly $70,000.00. I was told that they would build me a fully functioning website and I would have to do virtually nothing. I spent my whole summer getting products and dropshippers and all the while taking my daughter to radiation and chemo and dealing with her being sick. Derek and Lee and I forgot about Heather. She was supposed to be getting the designers and everything associated to building a functioning website. Derek told me that because of my circumstances with my daughter, he would personally get everything done quickly. I still have nothing worth anything. He did build a pet supply website that is nonfunctioning. All of the products that I gathered and the dropshippers I paid for are of no use. I tried over and over to get a refund. I am about to lose everything and my daughter is still battling cancer. These people should be stopped. They took advantage of me and my situation. They made promises that they had no intentions of keeping. I have lost about $70,000.00 to these people. I am going to go to the Attorney General.
