I was pressured to purchase products that I did not need. I purchased a Business Saver Package under very heavy sales tactics by The Tax Club. I had requested to call my personal accountant but they said no one else could set up an internet business as the Tax Club could. I also purchased two other packages through the Tax Club that was bringing my total costs close to $20,000. I have an internet coach that is building my website and guiding me at all levels of my new business. I told him how financially stressed I was and he told me that I did not need any of this company’s products to run my internet business. I then called to cancel all services and was only able to cancel two of the services. The Business Saver Package had passed the cancellation date. I am only requesting $1795 of the $2995 I was charged due that they did provide me with my LLC. The difference of $1200 was to cover the fair market value of the LLC. All of the products that they sold me were already covered in my affiliation with PMI, my business coaching company. I fell that the Tax Club knew I was uninformed as I was only in the first weeks of building my business. Their heavy-handed sales techniques leave little to desire. They are refusing to refund any money to the E-contract that I signed while still on the phone with them. I was not allowed time to even read it.
I was contacted by the Tax Club and they told me that I needed them if I was going to have a successful business, and I needed to purchase their tax service for $3,908, Business Credit Solutions for $3,524, and someone to build the website for $1,395. Once I realized what was going on, I called them up and told them that I had made a mistake and I didn't want their services anymore. I didn't know what I was thinking at the time and if they could refund me back part of what I had invested because really they hadn't done anything for me. They told me that I had 15 days to cancel the services and if I cancelled, I would get nothing in return. I am a senior and I need help. Please help
I was contacted by Jay ** and I was told that they will provide me with traffic on my website between 5,000 to 10,000 visitors. They charged me $2,497.00 and nothing happened. I got a call from Eddy ** and he was supposed to help me get company credit. After we talked about landing institutes, he said that I had to have copyrights and trademark, costing me $5,000 and no more contact. In July of 2011, I received a call from Kevin ** and I was told that he and Alex ** will take over the website and market profit. I was charged $3,000 and I have not heard from them. I made several calls to no avail. So my advice is that Tax Club is a fraud where they target senior citizens.
In mid-2008, my late wife got involved trying to start a web business to add to the shop she already had. She started through Stores on Line and PMI. It wasn't long before we kept getting calls from The Tax Club. She kept agreeing to use their services, to the tune of over $14,000. Unfortunately, my wife passed away shortly after. I contacted The Tax Club and asked for a refund as very little was done by them, but agreed to some of the things that were done. They sent me the refund documents via email, which were completely unreadable. I was contacted by Lango ** and she promised to send hard copies of the forms. When the forms arrived, the names were wrong. I contacted her again to have them corrected. She did and apologized for the problem. By the time I received, signed and returned the forms, I was told that since they were not returned within 30 days, they would not issue any refund whatsoever.
After my first complain, I got some sort of an agreement with The Tax Club that would help me. It did a little bit they cancel the $ 2500.00 Loan, but its not enough I still have an over max-up credit card. So far the service I received it only worth $3000.00 ,I feel I was still over charged ,and I asking for a refund.
We signed up for The Tax Club business essentials and The Small Biz membership to the tune of $5,133.00 on January 2011. Also, on top of that, we paid $14.99 and $29.99 monthly. I had just started an e-commerce website and I was actually still building it when The Tax Club called us. They said that we really needed their expertise. They said that they would build a business plan for us and get us business credit, and not to worry about using all of our personal credit for their cost. I would be able to transfer it all to business credit. Instead, all I got was call after call from people all over the US with The Tax Club, trying to sell me everything they could! I fell one more time for their trafficdriverpro.net scam. It cost me $2,500.00 with guaranteed 1000 unique visitors a month! I called them after a few weeks and told them that I wasn't getting any results and they told me that it would take 4-6 weeks to see the visits coming through. So it's been about four months and no results! No 1000 visitors etc. I called the main number for The Tax Club which is impossible to get a hold of anyone but snotty operators who transfer you to phones that tell you to leave a message. It took two weeks to finally reach Raymond, the guy who is in charge of the trafficdriverpro stuff. Like I said, I even contacted traffic driver pro and I was promised a call back but nothing! We asked for it to be cancelled and refunded because it didn't do what they said it would! They like to argue that we had 15 days to cancel, which they never said, they said that it was guaranteed! Even if it was 15 days to cancel, I called within that time and they told me it takes time, 4-6 weeks for results! Really? How could you even cancel in 15 days if it takes 4-6 weeks to start working?! Anyways, I just got the same e-mail I received, when I cancelled the other tax club membership, that they cancelled the items I requested but I'm not due any refund. So all in all, the company has lied and bilked me out of $7,633.00 and 5-6 months of monthly fees for doing absolutely NOTHING, except to put me and my family back in debt and ruin our credit rating! This company needs to be investigated for their scummy practices. I will be a witness!! Please help me!
I was contacted by PMI and then The Tax Club after sending for Anthony Morrison's Book. Each group relieved me of a significant amount of money to the tune of masking out my credit card. The calls kept coming from others at The Tax Club trying to talk me into more things and programs I should buy, extend my credit and take out a line of credit or let them build my website. I have no website and I became ill shortly after signing up. My account was put on hold and the calls kept coming. The Tax Club assisted me in setting up a "S Corp" in Florida for over $1,200.00 in costs (I'll need to recheck the figures) and after Mark ** sold me the farm, I got a few phone calls from Justin who was of no help at all. I complained in an email on the site and he put my account on hold. I am unable to move forward to begin a business due to declining health. This business never got off the ground and I never even knew what the business was. So I feel quite scammed and I am asking for a refund of my money. I will be inactivating my business and who knows what tax reporting to the IRS I will be responsible for. I never got one word of guidance, direction or anything from The Tax Club. There were just phones calls about paying more money for more affiliate ideas. It was a total scam approach. I never received any of the benefits promised by The Tax Club other than the paperwork to send to the State of Florida and a corporate seal. I attended a few webinars in the beginning but then my illness prevented me from participating. Everytime someone called, I'd ask questions about how all they were promising and talking about was going to happen if I didn't even know what kind of business or product I would be able to sell on this website. No one ever could answer other than to offer another way to empty my bank account and max out my credit card. This last time they wanted $10,000 and they told me to take a loan on my 401K to pay it and that was supposed to be a big bargain. I find it hard to think that this is anything but a scam when the representatives put nothing in writing about what I'm asking or complaining about. The only way we communicate is with the phone and numerous telephone numbers all the time. I would appreciate a refund of my money since I cannot physically or mentally continue as stated early on.
Shortly after signing up with Achieve Technologies I got a call from The Tax Club. The thing that got me was them telling me that I would get the investments I made with them and Achieve back at tax time. In my mind I saw a check from the IRS for at least $9,000. I'm sure that's what they thought I was thinking too. Total credit card debt for this business venture right now is about $12,000. Over $5,000 to The Tax Club. At tax time I already had my personal done. They prepared the corporate and to my surprise they told me I had to amend my personal taxes to show the loss that I had in my business. I don't need to pay less in taxes. I paid them a monthly fee ($49.95) for about 18 months. They helped me incorporate ($225 through legalzoom.com). They prepared my corporate taxes once ($205 for Turbo Tax software and $100 for my sister to prepare them). For the amount of time I was with them I used 2 of their services. How much of the investment with The Tax Club can I get back?
On March 14, 2011, I had a call from Ryan ** stating that I need a business in the United States for me to operate sales in this country with drop shippers as he finds out I was taking a course through Power Seller College. They were charging me $2995 and a monthly fee of $49.50 to access their website, which I did use very little due to limited time I am online. I got my company name set up, that went OK. But after this, on March 21, 2011 James ** called to offer me a Corporate Credit Plan at $4295. I refused at that point as I knew it was more than I can afford. But as persistent he was, he mentioned he'll help me get corporate credit to pay off my credit card debt in a matter of no time. He failed to mention that it will take up to six months and I will have to do all the work. So even if I told him about thrice that I can't, I gave in and maxed out my credit card + $2500 loan with a finance company he chose. Now with all these, I thought I had all planning systems in place to get my company off the ground. Boy was I wrong. I found out I still have to pay more to set up the website, the advertising, the merchant account, and so on as per David ** on March 28, 2011. He said all I paid for is coaching of difference department with The Tax Club. His part was to sell me his coaching plan for the price of $3693 to advertise and analyze the company progress. This was not accepted.
I was contacted by the Tax Club when I had signed up with Fortune Learning Systems (you know that FLS is in court). The Tax Club bullied me into paying them a fee for tax info and also a fee for My Essential Plans to set up an LLC (which I didn't need, but being a Canadian I didn't know that). The Tax Club set up 3 appointments for me and they never kept any of them, when I phoned to complain they said the account rep would phone me back in half an hour. He never did call. When the FTC shut FLS down, I never got an established business going so I did not need an LLC. I cancelled the membership with the Tax Club and asked for a refund, I was told there would be no refund. I complained to everyone I could think of and they responded with the same response they give everyone who complains. They took a goodly sum of money from me, and I would like to see them totally shut down just like FLS.
I signed up for The Tax Club because it was referred to me by legal zoom. At the time I was told there was an initial fee of $1600 and a monthly fee of $20. This ensures tax preparation every year. The first two years went smoothly. Now they are telling me I need to pay $895 a year for tax prep in addition to the $20 per month. I was never told of this fee and they have no documentation of any such fee. The original contract says nothing about a tax prep fee. They have apologized to me for forgetting to mention the $895 per year fee; however, they will not refund any of my money. They also have admitted that there is no documentation anywhere of any such fee. I have two small children to support and a struggling small business. I never would have signed up had I been informed about these fees. If there is ever a class action suit against The Tax Club, I want to be involved. Please contact me. They are very dishonest and I feel like I have been scammed. They are taking advantage of innocent people who are just trying to make a living. Thank you.
On Nov 9, 2010, I've opened an internet e-commerce business and I'm coached by Premier Coaching in the process to learn the business. In the meantime, I've been contacted by Tax Club to take care of my legal paperwork. I've filled them out and sent it to Wyoming Secretary of State. It cost me $2999. As first deposit +$39.95/month that they agree to take only after the third from the third month. I've decided to cancelled my adhesion and hire a personnel accountant to take care of it, in Writing a registered letter to Tax Club, to be reimbursed. No way, sir. First, I'd never get a written answer at my letter but I've been called by M. Corey *** from tax club ( * *** *** **** ext: **** ) to make me understand how profitable it will be to stay with Tax Club. Finally, I'm harassed by a young men who don't want to hear nothing but the care of my business plan that I don't have yet. I don't even have a web site yet. I'm still learning. This is really frustrating and after all complaints I'm reading with clients having the same problems, I think I'll have a hard time to have my money back. A lawyer will charged me $1500 to have my money back. I'm retired with my wife and my handicapped daughter and my finances are not that great. Just enough to live in my fifth wheel. I only want a little Internet home Business to help me out with my budget. Now I'm $12,000 involved in that business and can't afford to spend another penny for the care of that little business. As a Canadian, is there anything I can do to have my money back ($3000 with tax club)? Thanks for your support.
Wow, all the complaints against the Tax Club do ring true in my experience, also. The Tax Club responses are a "boiler plate" form reply stating that they are committed to customers. That's garbage. I also lost a bundle of money to this back room sales operation. They do have accountants but it is their sales tactics that cause so much harm. I endorse a previous posters' comments that the Attorney General of the State of New York should close this company down.
I've read complaints about The Tax Club and I have the same experience. They even connect to my bank on three way communication to activate my credit card which I told them I'm keeping for emergency purposes. To make the story short, I got ripped off by about $20,000. I tried to get refunded but to no avail. I am trying to make payments for my debts that this caused me and am really having a hard time making ends meet. My credit score is ruined because of late payments. No physical damage has been done but a lot of emotional stress.
After signing up with an online hosting service on the 17th June 2010, so that I could supplement my government pension. I was spending time getting my web site up to scratch. On the 30th of July received a phone call from Domonic from the tax club informing me that he had got my name from the online hosting firm and that they would set me up with all the accountancy expertise I would need for the small sum of 4349.74au. I informed him at the time that I did not have that sort of money. He asked me if I had credit cards. I answered yes. He then asked me to affirm the numbers, expiry and security numbers. Next thing I know the money is out of my accounts. They never asked me if I wanted to proceed with anything. They didn't care that it put me over the limit. I was just happy that it went through. I was then rung the following day by Justin *** account ex. He gave me a spiel about the business. I told me I would have to fill out papers and get credit so that the business could pay me back and he would send everything to me then he transferred me to Kelly ***, corporate record pro to explain all the details to me. In between all this toing and froing and tears on my part saying that I couldn't afford any of this. On August 6th, I called from tax club. On August 11th, mail from tax club with application for EIN number and LLC registration to be sent to the Secretary of State in Wyoming. Another 128 tax club supposed to call 17th August, no call. August 24th again no call. August 25th tax club called and they require another $3511.19. How do they know how much is in the account? Web seminar on 26th August, useless. 30th August, no call. 31 August, no call. 1st September, Ronny *** calls... wants another 1700. I told him I didn't have any more and that I was going to look into their dealings and to date I have heard nothing more from them. Apart from the 59.95au, they kept taking out of my account every month so 9708.52au. Later, no word from anyone since my health is shot. My savings are gone. I am trying to live on a government pension that is not enough to keep me alive and all because I was taken in by the tax club scammers. I am 63. What can I do? Any suggestions?..
I was actually contacted by the Tax Club representative who outlined the benefits of membership which included setting up a business entity, why I should have it set up in the US, preparation of business plan, and organizing business credit. All this made sense. So in November 2008, I paid AUD5800 for the membership with ongoing monthly fees. The phone consultations were booked, my LLC was set up on the spot. And that's where the service ended. I was asked to pay further US2000 plus for business plan, more money for business credit card, then about USD2000 for bookkeeping service (with monthly fees). I didn't have any more money and I was taken aback by the Tax Club not being upfront about the costs involved, so I did not proceed. I did pay another US600 for basic bookkeeping service, where I actually kept my records for a while. Until during one of my two accounting consultations I was told that 1/bookkeeping does not communicate with The Tax Club and that it is not necessary for me to use this service. Confusion reigns. For months I couldn't log in to my account as my password didn't work. I didn't receive any communication from the Tax Club other than "thank you for becoming a member" and recurring billing and newsletters. I had a hard time figuring out how the Club operates. I had two consultations, each time with a different accountant. I felt I was fobbed off, which was easy as I am totally new to being a business owner, let alone in the USA. The latest accountant advised me to alter the registration of my LLC. I had to chase the paperwork, which was meant to be emailed to me--it wasn't. Then IRS had a problem with my paperwork.I emailed The Tax Club about it. The last communication I had regarding the subject was asking me to send the IRS letter and someone will be contacting me. No one did. And I haven't heard back from The Tax Club since. Tax time came, I made a phone call to customer service to find out about the technicalities of tax return. I needed to purchase VTO (virtual tax organizer). I logged in to my account successfully but when I pressed the "buy VTO button", error message appeared "account cannot be found". This problem was never resolved. In the process, however, I found another piece of information that had not been disclosed before I signed up for membership: the cost of the tax return, and that there is an extra charge for VTO. I don't know how much it is because I could not get to the purchase site. I sent a number of emails requesting an itemized invoice; i.e. what exactly was included in the membership. Interestingly when I made inquiries at a corporate business website I found on the Internet, I was provided with very clear information and clear step-by-step instructions as to what I will need to organize. I then realized that not only did The Tax Club fail to disclose all financial information, but also did not provide structured information like EIN number to file taxes, does my LLC have one SS4 form (apparently I need one), who my resident agent is, DUNNS number application. Up to this point I didn't even know enough to ask questions. I think this makes for a really poor service. I sent emails to customer care email address, appointments@thetaxclub, billing@thetaxclub. All emails were returned to my mailbox. Apparently the mail system was unable to deliver. My latest emails were sent Aug. 16, Sept. 16 and Sept. 24. I received no reply. Until Sept. 25 I received communication from the billing at The Tax Club that my account has been cancelled and that they are sad to see me go. What a joke. Reading the accounts of other Tax Club users, it seems that this organization deliberately targets individuals who are very new to business and therefore are vulnerable and naive. I am really surprised that they continue to be in business. Isn't there any consumer protection in the US?
In February of 2010 I decided to start an online business in advertising. I was contacted by the Tax Club who said they could do a number of things one of which was getting my business set up as an LLC entity. Upon naively paying $2,999 plus I realized that the refund period of 15 meager days had already came and gone. After 5 months of being in business to date my company has not made a single penny. The Tax Club sent me my Articles of Incorporation in a binder (I could have gotten my own Articles of Incorporation!) and say they deserve all of that $3,000. I tried to get a refund but it was too late and as they say the rich get richer and the poor get poorer, when companies like the Tax Club suck everything they can out of a low income American. Isn’t there any lawyer who could initiate a class-act lawsuit against these bottom feeders? I am currently living with my mother who is on the verge of losing her home, my cell phone has been turned off because of non payment, and my business I put over $10,000 into has not made a penny. The emotional damage of having everything taken from you has greatly taken its toll on my own happiness. I feel there is nothing anyone can do to stand up to these frauds.
I have had some of the same experiences as the ones that I read. I would like to know what each did to resolve these as I would like to know of a place to take my matter with the Tax Club. It seems that they should be investigated. I have spent a lot of money with them as they claimed that I would recoup this in my business. I just went further in debt and now have no money left with which to build my business.
After being ** enough to be ripped off for $43,386.72, we found this was just a scam with a lot of associated companies that every time the phone rang, it was somebody different asking for more money. There was bookkeeping, planning, credit and lots more also a website which never happened, which they kept spelling wrong. That's when they stopped phoning us. We wrote emails to ask what was happening and they replied they would look into it. We then got a phone call telling us we needed to spend another $600. We said no. No more phone calls, no nothing until we were contacted by Ester ** to see if we wanted to cancel our membership. In the meantime, they are charging us $50 a month to do nothing. We cancelled and asked for a refund. No, we are not getting any refund. Please help. What can we do?
Heavy sales pitch got me for 2,975 plus 49.95 a month starting 12/09. As soon as my credit ran out, so did the service [as they continued to run roughshod over my good credit score without regard until it was tapped] and hung me out to dry. No refund as of 5/10 and no returned calls. A perfect example of bate and switch and scam like business practice. Please stay away from anything to do with the tax club and the Manhattan professional group. Since my credit was tanked by these crooks it was necessary to enter a debt reorganization program and try to get back on track before I get an ulcer or lose my marbles. Here's hoping for some financial recovery from an unemployed American. PS. with friends like this who needs enemies.
